,User_name,Review title,Review Rating,Review date,Review_body,Movie_name,movie_id
63,lerancho,Comparison of the book and the film,6/10,7 June 2012,"As a person who'd just finished reading the book on which ""The Help"" is based and who'd just watched the film, I'd like to say a few things about the differences between the book and the film and how that reflected on the story.The film represents a much shorter version of the story than the book. The major differences, and the ones that I thought were NOT beneficial for the story, are as follows.Constantine's daughter is black, not white, like in the book, and all her background story is missing. This is not OK, because Skeeter's mum's reaction to her sudden appearance in the house in this case is hardly clear.Skeeter's mum tells Hilly off when she comes to her house, something that she didn't do in the book since she didn't even know about the book. The character of Skeeter's Mum, like it's done in the book, would have never understood the her daughter's book and would have never been proud of her daughter the way she is in the film.Also in the book Skeeter decides not to write about her mother had done. In the film she does.It's not also really clear that Skeeter's mum has cancer and that she's really ill.Aibeleen doesn't get a job in the magazine, like she does in the book, which I think is a shame because it represents new beginnings for her in the book. In the film she is basically left with nothing.Then there is Minny and Miss Celia. Minny actually saves her life when she calls a doctor when Celia has a miscarriage. In the film Mr. Johnny just says, ""She got better after Minny appeared in the house"", which in my opinion is sort of strange and doesn't explain at all why he says that she had saved her life and why he is so grateful to her and offers her the job for the rest of her life. It is therefore very unconvincing in the movie, when he does that. Incidentally, Celia in the book also never ever learned how to cook.Also, the whole ominous atmosphere in Celia's house, the air of mystery is absent from the film, which is a shame, as well as her frequent miscarriages (only one is shown and very briefly, without showing Minny's involvement, which is crucial) as well as Minny's constant fear of Johnny.It is also not shown that Minny is actually really scared to lose her job when the book comes out.Now, to Aibeeleen's son. In the movie he's ""killed"". By whom? For what? We don't know. In this case I think it would have been better to leave it the way it was in the book – that his death was an accident. I can see what the film creators were trying to do, but it didn't quite work.Also, in the church when they congratulate Aibeleen on what she has done, they don't even lock the door – a small detail that would have shown, how much they are all still scared, which, I think, is important.What I find is also quite important to the story and something that was hardly if at all shown in the film is Skeeter's social isolation after her fall-out with Hilly. That's the cost she paid for disagreeing with everyone else in town and for trying to do something about it.Also, how Skeeter's mother constantly criticized her is not shown, which would have added comic value to the film but also explained why Skeeter was so attached to Constantine. The story with Elisabeth, how she'd never really liked her child Mae Mobley and never treated her well is also omitted from the film. It would have been much more painful to watch Aibeleeen leave the family if we knew what she meant for little Mae Mobley.What was also different from the book but what I DID like, was the cause of the conflict between Minny and Hilly, which was sort of unclear in the book: Hilly just started telling everyone else that Minny had stolen silver from her for no apparent reason rather than she wanted Minny to work for her. So I find that the thing with the bathrooms in the film actually works better.What I also liked was the way the characters were cast, especially the character of Hilly, as well as Minny and Aibeeleen.And the way love affair with Stuart was shown also worked well - it was much shorter than in the book, however the filmmakers managed to grip the essence of their relationship in a few scenes.All in all, good effort. But the book is even better - more multi- layered and more powerful.",The Help,1454029
64,SamJamie,"A perfect, heartfelt & emotional movie",10/10,1 December 2020,"In 1960s Mississippi, Southern society girl Skeeter (Emma Stone) returns from college with dreams of being a writer. She turns her small town on its ear by choosing to interview the black women who have spent their lives taking care of prominent white families. Only Aibileen (Viola Davis), the housekeeper of Skeeter's best friend, will talk at first. But as the pair continue the collaboration, more women decide to come forward, and as it turns out, they have quite a lot to say.Although I wish I hadn't waited so long to watch this movie, it felt like the perfect time for me to see it. Being one of the most uplifting and feel-good films I've seen in a long time. The film works beautifully as an entertaining film about a troubling period in American history and the people who were impacted by it. The film is elevated by performances from the three female leads as Emma Stone, once again, shows her range as a serious actress and Viola Davis epitomises courage through her sombre eyes. Octavia Spencer's Minny provides the movie's funniest moments, especially when she gets her own back on former employer Hilly with an audacious reprisal that proves that revenge is indeed a dish best served cold. Not only are the performances terrific, but the characters are also believable, likeable female characters set against the turbulence of Mississippi in the 1960s. In addition to being entertaining, the movie functions as a time capsule as well as a lesson in American history, women's and civil rights. I believe this movie will stand the test of time and it's one I will certainly recommend for the rest of my life.",The Help,1454029
65,laurabhunter,Amazing film,10/10,13 March 2021,"This is an amazing film, loved the cast, the theme, and the powerful message, I've not read the book but i will.
I know it's fiction and I'm white middle class and never cease to be shocked by the injustice portrayed by pieces such as this. Real people lived this and still do, it can't go on
                
                    2 out of 2 found this helpful.
                        
                            Was this review helpful?  Sign in to vote.
                        
                        
                    Permalink",The Help,1454029
66,napierslogs,"Comedy, drama and characters who walk Hollywood's high rope.",7/10,11 August 2011,"It's the 1960s in Mississippi, and the uppity, high-class, rich white girls have returned from university with husbands in tow and babies in their bellies, and now they get to hire maids of their own. The maids of course are poor black women from the other side of the tracks (literally). Skeeter (Emma Stone), on the other hand, has returned home from university with a degree in hand, rather than a husband, and after a stop-off in New York City in a failed attempt to get a job as a writer.The other girls are 1960s Barbie dolls in their party dresses and perfectly coiffed hair. While Skeeter misses the maid who raised her and finds herself drawn to the world of the help as she struggles with her first job. She first gets the advice of two experienced maids working for her Barbie doll friends — Aibileen (Viola Davis) and Minny (Octavia Spencer) — for a cleaning column, but she wants to start pushing the boundaries of the law and tell a story from their point of view.At its worst, ""The Help"" is a melodramatic but poignant, long drawn-out affair where a white woman happily solves racism in America and the whole world can hold hands and skip in perfect harmony. However, at its best, it's a well-crafted film that subtly holds together multiple genres as it balances that tight rope between drama and comedy. Lean too far in either direction, and you fall (which it comes close to multiple times but never actually crashes).A hidden story in this movie, is one of a girl, Skeeter, who has triumphantly navigated university, but is at a stand-still in trying to get a job and live independently, so for now, she's at home and working for the local newspaper as she forges her way in the real world. Sounds typical, doesn't it? Except there's a good chance you won't even notice this story because it is hidden beneath all the class-divides, racial-divides and friendship-divides.There's even a character in here who will surprise you: Celia Foote played by Jessica Chastain. Although I generally know better than to listen to plastic, talking Barbies who described Celia as white trash, I still believed them. The layers of her cluelessness and my surprise were delightful and entertaining to unravel.It's dramatic because this is a story of inequality. The help get treated is if they are ""less than"" while the southern belles act as if they are ""more than."" As said before Skeeter wants this to be about the maids' point of view, and as you can guess, they are mostly sad stories. Except for Minny's because she likes being bold. Octavia Spencer and Sissy Spacek as the mother of a mean-spirited Barbie doll are responsible for most of the comedic relief. And relief it is because they are funny.There were references to Martin Luther King, Jr., John F. Kennedy, ""Gone with the Wind"" and Margaret Mitchell. Because this is Hollywood and the excessive run time, I'm afraid they have already placed this movie in that esteemed group. It's good, it's fun and meaningful, but let's not get too carried away.",The Help,1454029
67,huh_oh_i_c,The Deep South was and is a police state like Nazi-Germany and the Soviet-Union,8/10,20 August 2011,"For about two-thirds of the film, the overall atmosphere really reminded me of the stories my grandfather told me about his life in Germany and his fathers life in Russia before that. It feels like the black people lived in a totalitarian state, a police state. And of course it really was like that. This is what it must have been like, in Apartheid South Africa.So, the real value of this film is that you realize that much has has stayed the same and worse, that America is changing back, in a way. Of course it's a little better now. In the 1960s, blacks couldn't protest and didn't kill whites who slaughtered their fathers, mothers, daughters or sons, because they knew that the retaliation would be against ALL black people, not just the ones who fought back. See Israels methods against Palestinians, they blow up the house of the whole family of a ""terrorist"".But given the current political climate, it's not a stretch to say that things aren't improving. Blacks are STILL the bottom of the rung, despite all the ones who 'made it'. Unless blacks are 14% of all professions, especially the ones that create wealth like upper middle class businesspeople, and the proverbial doctors and lawyers, things aren't resolved.This film does indicate that African-Americans in Hollywood STILL aren't fully equal. How many major Hollywood films have you ever seen with a true black female lead? Especially ones where she doesn't play a 'black' character? I guess those movies aren't really there.I first saw Viola Davis in an episode of Law and Order Criminal Intent, where she was the though mastermind bad cop. Ever since, she just played 'black', or 'token black'. Sad.The latter third is a feel good movie. It's understandable why, it's hard to accurately portray the bleakness of those years, especially for a white writer. You can see the denial of harshness of those years right here on these pages and in other reviews. There's complaints that they can't be critical about this, in other words, the film is a race card that's been played. Complaining about the race card is a deceptive and slightly more subtle form of racism, but it's racism nonetheless.This country is not yet ready for a true portrait of slavery, or of Jim Crow times.The Melancholic Alcoholic.",The Help,1454029
68,rmax304823,"Humble Help -- So Hard To Find, These Days.",7/10,18 May 2013,"Jackson, Mississippi, in 1963 and the segregation is iron bound. A feisty young local journalist manqué is hired by the local newspaper to write a household advice column. This prompts in her an interest in the black maids who service the community of higher-class white housewives. A volcano erupts.You see, the white folk live in them big white houses and the white womens they have dare hairs up in piles on top of they head and they demands that the silber be polished just proper for when they entertaining. The black folk lives in them shotgun houses in they own districk and eats fried chicken and rabbit stews all day. They need them maid jobs powerful bad because the menfolk, they don't make no money toiling at the mill.I know. It sounds like an afternoon television special that should be shown in a civics class, but it's better than that. The first thing that impresses the viewer, after the initial exposition, is the presence of social borders that are more effective in keep people in and out than the Great Wall of China was at defeating Mongol raiders. The social world is divided into strict categories.It's a binary universe. You are either ""in"" or ""out."" You are black or you are white. You are a man or you are a woman. You are respectable or you are white trash. There isn't much in between. (Poor Truman Capote.) And within each of these socially constructed categories, there is an intense sense of schedule, of the proper time to do things in the proper way, the time for politesse, the time for slap downs. The heroine, the would-be writer, is an affable and outspoken redhead with frizzly hair, given to wearing Mexican shoes and not yet married, although she's in her twenties. Her mother, Allison Janney, nervously asks her, ""Honey, it's past your time and you have no boy friends. Tell me, have you ever had any, um, unnatural feelings? Like feeling towards girls?"" That's scheduling for you. And here's social class. A naive but pretty and friendly young blond, Jessica Chastain, moves into town, drinks too much, wears revealing gowns, speaks a little too freely, and can't cook anything but corn pone. When she shows up with a covered dish at a party by the local doyen from etiquette hell, nobody answers the door. They hide from her view behind the furniture and speak in whispers. As one of the well-groomed guests observes, she's ""white trash."" Well, let us not run out of space by going on too long about the keenly observed characters and plot, which is weakened only in the last quarter or so, when everyone winds up happy except the witch. The witch's performance is splendid, by the way, but then everyone involved gives an unusually tuned performance. The editor has caught Viola Davis, as the principle maid, doing some marvelous acting. Sadly, there is the hint of cloying stereotypes. Man, the director has gotten respectable Southern women and their cliques down pat, but he overdoes it with the nameless horde of carefully made-up butterflies mincing around, fluttering their delicate hands and turning every sentence into a melodic carol that ends in a question mark. And the African-Americans, while human and hardly saints, don't seem to have anything in the way of vices. They simply accept the insults and burn with unspoken resentment.Of course, the central theme is the way maids are treated as robots and the way the robots take their revenge. The black maids receive what sociologists call ""non-person treatment."" They're not really there, and the exchanges are either functional (""Get me an iced tea?"") or perfunctory (""That's a mighty purdy dress, Mizz Scarlet."") Those social borders are noisome. For one thing, they have two sides. After hundreds of years of being bulked up, they now operate to effectively keep categories comfortably apart. African-Americans in particular have a solidarity that other minorities can barely understand. It's asking a great deal of them to sacrifice that hard-earned group loyalty in the name of an equality that many of them see as a façade. Would you want your daughter to marry one? Neither side is especially anxious for that to happen.I'm not even certain that the tendency to feel more comfortable with others who share your appearance and culture is so unnatural. Every big city has its Chinatown and Little Italy. And when ""Planet of the Apes"" was being filmed, the chimpanzees ate with the other chimpanzees, the gorillas ate with the gorillas, and the gibbons hung out with the gibbons. Maybe it's better not to think about it. It's certainly EASIER not to.",The Help,1454029
69,davidtraversa-1,Two hours of painful contemporary history.,10/10,5 April 2012,"This movie is so good it's impossible to put in words all the deep feelings it aroused in me. Compassion, outrage, humiliation felt for the oppressed..., a mind-boggling experience that everybody should undergo and that, at the end of the viewing, one will come out of it with an expanded view, with a kinder comprehension about oppressed minorities. The acting is magnificent, beyond all eulogies, the solid craft --perfect script and impressive acting techniques-- employed in delineating every single character, principal or secondary is something to be seen to believe it.The recreation of the 1960s is outstanding, in every respect: colors, fashions, cars, props, the hyper feminine way women displayed at that time, shrieking and giggling like stupid Barbie dolls, the macho men all tied up in knots, and the terrible, awful, taken for granted routine of everyday living with... slaves. Black slaves, people suffering every moment of their lives the constant fear and humiliation of being exploited by white people and worse of all, being resigned to that condition. I think this movie should be required viewing in schools, not only in the USA, but all over the world. I couldn't find any flaws whatsoever in this admirable production, technical or otherwise. A perfect movie in every sense, extraordinary actors, superb director.",The Help,1454029
70,Vartiainen,Is this real life or just some fantasy?,7/10,2 July 2017,"Based on a book of the same name by Kathryn Stockett, The Help talks about mid-century Southern USA and about a young aspiring writer, who decides to write about the eponymous help, the black people who pretty much made sure that everything stayed on course in the white households, from raising the children to checking that the roof was still up. She faces a few problems though. First of all it being extremely unpopular to talk about such a subject and second of all it being somewhat hard to find a black person brave enough to talk against whites.This film was immensely popular in the States, like these films usually are, and I can kind of understand why. It's an uplifting story about a historical wrong that is still relevant even today, featuring an ensemble cast and great technical aspects.And yet, at the same time I'm watching this film and thinking to myself that I don't see the attraction. It might be that I have no touching point to this issue. I'm white, that much is true, but I'm also both Nordic and the son of a farmer. Slavery didn't enter into my worldview until I started watching movies aside from cartoons. And I'm watching this film where white people in the 1960s treat their help like they're cattle. Cattle with leprosy even. And I'm thinking that this is extremely silly and overblown. But for all I know it just might have been exactly like that, which is a chilling thought.The ending is also too saccharine, in my opinion. Flowers rain from the sky, the wicked are punished and a holy choir sings Hallelujah kind of saccharine. But perhaps in America, where this is still a huge problem, that kind of an ending provides the needed emotional catharsis.Like with all these types of films, I don't feel like I'm qualified to judge them. I like the acting a lot, I like the story, I like how it looks and feels. I just find it a bit exaggerated, personally. As well as an hour too long. Still, worth a watch if the premise tickles your fancy.",The Help,1454029
