,User_name,Review title,Review Rating,Review date,Review_body,Movie_name,movie_id
58,blanbrn,Courage and being brave becoming a hero in a different way.,8/10,4 November 2016,"Plenty of movies are made about war and a lot has been written about War War II especially, this picture directed by Mel Gibson called ""Hacksaw Ridge"" looks at a different kind of hero from the time period. It's the true story of Desmond Doss(in a strong performance from Andrew Garfield)a medic and self proclaimed pacifist who won a Medal of Honor without ever even using a weapon. And this film is in detail showing the rural life that Desmond lived in Virginia growing up. As he becomes a man he has a pure romance with a young nurse all while maintaining his faith in Sunday, and after going in service to fight in Okinawa, Japan Desmond and others experience hell on the battlefield as this film is very graphic with bullets, blood, bombings, and partial body parts of death all caused by war. Thru it all it takes extra courage for this man who went a different path of being brave to become a hero to be remembered. Really this picture makes one feel the glory of courage with red, white, and blue honor as it's thru love and compassion of others that made Doss a man who will be remembered as the greatest helper never to have packed a weapon.",Hacksaw Ridge,2119532
59,Screen_Blitz,"Mel Gibson's testament on war pacifism packs a punch, and not without the grisly portrayal of war",8/10,7 November 2016,"There are very few directors out there who portray the dark side of religion and war as powerfully as Mel Gibson. Looking back at the critically acclaimed 'Braveheart' and the highly controversial 'Passion of The Christ', Gibson's depictions of violence clashing with spirituality has proved to be far more effective than contrived; and this World War II biopic centering on the true story of a soldier driven by his firm spirituality to the take a different path in active combat instead of being a man carrying a gun in the midst of the bloodshed. His path is not to take the lives of others with the use of bullets, but save them. What could have been just your average faith-based drama feeling like a clichéd religious sermon ends up being a powerful testament of war pacifism and a man's challenge against the tyranny that targets his religious ideology. The film tells the true story of Desmond Doss (played by Andrew Garfield), a devout Christian and member of the Seventh-Day Adventist raised by his caring mother Bertha (played by Rachel Griffiths) and abusive alcohol father Tom (played by Hugo Weaving) strained by his experience in World War I. With World War II ravaging, Desmond enlists in the army as a Conscious Objector. During boot camp training, he faces causes displeasure in his drill sergeant (played by Vince Vaughn) when he refuses to touch a gun due to his religious beliefs. But when his platoon is deployed on the battlefield in Okinawa, Japan, Desmond proves to be more worthy as a soldier than many believe when saves over 50 wounded soldiers -- and doesn't even fire a single shot.One of the biggest ironies is how Mel Gibson cohesively makes a case of pacifism through an unflinchingly brutal portrayal of the horrors of war, and the story of how lead character Desmond Doss must face the violent nature of active combat that greatly conflicts with his religious beliefs. The first half of the film introduces Desmond as a young man who embraces his spirituality, while forced to deal with abusive upbringing by his father Tom who feels scarred by his son when he decides along his Howard (Desmond's brother) to enlist in the war, recounting his harrowing experience in World War I that costed the lives of his friends. Along the way, we are then introduced to hot-shot nurse Dorothy (played by Teresa Palmer) who Desmond quickly forms a relationship and provides some sweet moments of levity and connection for Desmond when he out overseas on the battlefields, though the depiction of their romance is a bit hokey and somewhat awkward during the first half-hour. Ultimately, the first hour is primarily about establishing Desmond's pacifism and the cruel nature in which he endures when he makes himself the center of ridicule by his officers and fellow comrades who view of his refusal of abandoning his firmly held conviction against fighting as an act of cowardly, which is gracefully brought together in the boot camp training sequences in the fashion of 'Full Metal Jacket'.Most of Mel Gibson's directing style shines through not only the performance aspect, but the incredibly realistic (and horrifyingly graphic) combat sequences. Shot with quality cinematography by Simon Duggan, the second half pulls viewers into the muggy heat of the Japanese battlefields as we watch the soldiers trudge the muddy fields little with decapitated bodies, dismembered corpses, dead soldiers rotting and getting fed off from rats; and the gruesome scenery firmly sets the tone for some of the most graphic and astoundingly authentic battle sequences since 'Saving Private Ryan'. If you recall the heart-wrenching Omaha Beach invasion in the opening scene, the battle sequences are here feel nothing short of an extension to this. With limbs blown off, bodies disemboweled, and heads torn apart; these combat sequences portray the hellish reality of active combat, and does so without feeling gratuitous or exploitative. Along with Mel Gibson's execution of war are some unexpected surprises that arrive from the performance department. One of which is Andrew Garfield as the lead Desmond Doss in a powerful performance that expands upon his ingenious talent compared to his ill-fated outing in the 'Spiderman' reboot franchise. Vince Vaughn, an actor slowly fading away from his series of dull comedies , delivers an R. Lee Ermey treatment in his role as the ruthless and intimidating drill sergeant. Though a little clumsy in some scenes, he manages pull off the rare feat of escaping into a sincere performance.Hacksaw Ridge is a powerful and deeply gripping testament on its lead subject's war pacifism, and marks a highly admirable directorial return for Mel Gibson. This film is certainly no cinematic landmark in the war genre, but it stands strong as one of the most profound films of the year. If this film manages to garner some Oscar nominations, it shouldn't much of a surprise.",Hacksaw Ridge,2119532
60,shelswel,Like a Doss!,9/10,18 October 2016,"For well over a year now I have been waiting with baited breath to see this movie. I have been a fan of Desmond Doss from a child. Having the privilege of the movie being filmed in my neck of the woods, and even getting to watch some of the scenes being filmed and meeting Mel in the process (ever so briefly), escalated my enthusiasm. When you are that pumped and euphoric, you are usually deflated when the moment finally comes but not this time.Although there were a few aspects of the story that were not as accurate as I would have liked, I realize poetic licence is necessary in some ways to give the real essence of the story. And truth can be so much harder to believe then fiction sometimes. Mel managed to portray the man Doss so very well. Some people are worried this is a religious propaganda/anti-gun movie and I assure you that is not the message of it at all. However there is no getting past the truth of who he was and it is the reason the story is so powerful. He was a man with an unmovable moral compass and it doesn't matter if you don't point yours in the same direction, you can't help but respect him for his courage, bravery, and unwavering faith. The movie starts laying the background of the man that will be the hero of Hacksaw Ridge. It is both witty and endearing. Andrew Garfield nails the roll as the gentle scarecrow of a man. He is a bit gawky and yet charming. His accent is true to the real Desmond, awkward though it is at times. He really draws you into the character and shows you what a fighter he was, non-violent but a fighter just the same. It is well explained what personal experiences have lead him to his discussion to not touch a gun.Hugo Weaving masterfully plays Desmond's alcoholic dad, battling with his demons from WWI, and Rachel Griffiths plays his devoted Christian mother trying to hold them all together. Teresa Palmer plays Dorothy, a nurse that captures Desmond's heart. Sometimes cheesy, but then again in reality it would have been, and it is very amusing to watch. Teresa's Dorothy is a beautiful and charming addition to the movie.Vince Vaughn plays the roll of Drill Sergeant Howell. He adds humour with his name calling, and humiliation of the soldiers, but is a very genuine - just a guy trying to win a war and keep his men alive in the process - kind of guy. Luke Bracey is a fantastic addition to the cast as private Smitty, the more traditional war story soldier.True to his reputation Mel does not hold back with the battle scenes. The devastation is already extensive and the ground strewn with bits of bodies by the time the 77th arrives. The shattering reality of war is dizzying and full of impact, moving so quickly you can barely identify the characters in a whirlwind of panic, pain and death. But amidst the chaos, Desmond Doss's character is revealed to everyone and even his harshest critics realize how wrong they were about him. Watching the story change from having the battalion hate him so much that they try to have him imprisoned, to refusing to go on the battlefield without him, is so moving and inspiring it leaves ""It's A Wonderful Life"" in the carnage on the hill, getting eaten by maggots along with the dead soldiers Desmond sifts through looking for ""one more"" soul to save.",Hacksaw Ridge,2119532
61,brankovranjkovic,"Hacksaw Ridge, the real life ""Captain America"".",9/10,27 January 2017,"This Oscar contender is a film based on fact, directed by Mel Gibson.The story is of optimism and of the strength of the human spirit.Andrew Garfield plays the wartime hero Desmond Doss. Although he was a contentious objector, he also wanted to serve his country and to save lives, and so joined the military to become a field medic. The first half of the film explores his childhood and family dynamics. The 16 year flashback explain where his strict religious beliefs and attitude to (not) killing came from. Unfortunately his attitude were at odds with standard military protocol, and since he would not kill (he would not even touch a gun) this leads us into the second half of the film.The second half describes how his attitude put him in conflict with his senior officers and the rest of the platoon, his basic training was particularly tough, with frequent beatings and a potential court martial. The second half also follows the intense war scenes at Hacksaw Ridge (Okinawa), this was particularly important since taking the Ridge could completely change the dynamics of WW2. It's difficult to believe the film is a cert. 15, as the battle scenes are absolutely intense and brutal with bodies cut in half and legs blown apart. (Must have only just scrapped a 15). Desmond Doss never fired a gun but is officially credited with saving 75 injured comrades single handedly, he never gave up on his faith or his beliefs. Stay until the end credits to see a vintage interview with the actual Desmond Doss and other significant characters who were portrayed. Very highly recommended.",Hacksaw Ridge,2119532
62,bankofmarquis,Strongly directed with intense battle scenes,9/10,10 November 2016,"I now have a new leader in the clubhouse for BEST PICTURE OF 2016 - HACKSAW RIDGE.From the Director of BRAVEHEART (more on that later), HACKSAW RIDGE tells the true story of Desmond Doss, the first Conscientous Objector to win the Medal of Honor when he saved 75 men from certain death on Hacksaw Ridge in Okinawa during WWIIThis film is divided into 3 parts.  The first focuses on Doss at home before the war, falling in love and dealing with an alcoholic father who is fighting his own demons from his experience in WW1, the second is your typical bootcamp scene where his platoon-mates and drill sargent must come to terms with Doss' Conscientous Objector status, and finally, the last part focuses on the experience on Hacksaw Ridge.The opening 3rd of the film is fairly pedestrian, it introduces us to the Doss character and the reasons for his stand on never touching a gun.  It would not have been successful if it were not for the work of Hugo Weaving as Doss' father.  He is absolutely terrific, and almost unrecognizable, as the worn down alchoholic who is still suffering PTSD from his experiences in WW1.The 2nd part of the film is a typical bootcamp scene and all of Doss' barrack-mates are pretty generic, I wish the director would have attempted to make them a bit more different, for when we get into the battle scene, when they are all wearing the same battle fatigues and are covered with mud, it is hard to determine who is who.  Vince Vaughn is an interesting choice as the drill sargent who comes to understand Doss.  He is not your typical drill sargent and underplays the role - something I would not have thought that Vaughn is capable of - I credit ""the director of Braveheart"".But the showpiece of this film is the last 3rd - the battle of Hacksaw Ridge.  This part of the movie ""out-Private Ryan's"" the D- Day scene of SAVING PRIVATE RYAN, the best filming of a WWII battle scene ever.  The director does not flinch away from the violence and tension of this scene and when Doss starts saving troops one by one and goes back ""for just one more"", I was on the edge of my seat.  It was truly moving and uplifting - a series of scenes not to be missed - but NOT for the squeamish.Up to this point, I have not mentioned the performance of the actor playing Doss nor the director, let me do so here.  First, Andrew Garfield (THE AMAZING SPIDERMAN) is terrific as Doss, again, underplaying his role and showing a strength of soul throughout the film.  I was a bit disturbed by his Sourthern Accent, but - at the end of the film - they show an interview with the real Doss and, darn it, Garfield nails the accent of the real man, so cut him some slack when you see this film, folks.Also, you will need to cut some slack to the director - Mel Gibson - he is, not surprisingly, omitted from all publicity from this film - and rightfully so - for his off-screen behavior.  If folks knew that this was a Mel Gibson film, they would be turned off and not go see it and that is too bad as this is a well directed film that tells an uplifting story that should be viewed by folks.  Say what you will about Gibson off-screen, but in this film, he is a heckuva director.9 (out of 10) stars and you can take that to the Bank (ofMarquis)",Hacksaw Ridge,2119532
63,areatw,Emotionally moving true war story,7/10,24 March 2017,"'Hacksaw Ridge', though advertised as a war movie, is more like a drama set on a battlefield. Not that there's anything wrong with that, especially given how engaging and emotionally involving this true story is.The film is very well-written and directed and it was a pleasant surprise to see the emphasis placed on the story and dialogue rather than just actions scenes. Andrew Garfield deserves a lot of credit for his outstanding performance as war hero Desmond Doss.True stories are always the best stories, and this is one of the most uplifting and inspirational I've come across in a long time. 'Hacksaw Ridge' is a good film about a wonderful true story. Definitely one of the must-see movies of 2016.
                
                    7 out of 13 found this helpful.
                        
                            Was this review helpful?  Sign in to vote.
                        
                        
                    Permalink",Hacksaw Ridge,2119532
64,KineticSeoul,"Incredible story about conviction, family and honor.",9/10,21 January 2017,"This is a film about prejudice against sensitive men and their conviction. Which is thoroughly shown through the mistreatment of Desmond Doss. Who is a stand up guy that wanted to do good for his country by being a medic for the wounded soldiers in battle. The mistreatment came from Doss being a pacifist and for him sticking to his conviction not to kill but to save lives instead in battle by being a medic. Which leads to Doss facing hatred, trials and hazing from the other soldiers because they all think he won't be able to protect them in battle. This is based on a true story of conviction, family and honor. And it's directed very well from the build up to the convincing and engaging violent battle sequences for the second half. Andrew Garfield plays a lovable character as Desmond T. Doss. Garfield did a great job playing Desmond T. Doss as this dorky, lovable, kind and honorable guy. I am going to be very honest though, during the whole film he reminded me of Fix It Felix Jr. from ""Wreck-It Ralph"". As a matter of fact if Fix It Felix Jr. came to real life in human form it would be Andrew Garfield in this film. This is a powerful movie about a man standing up for his conviction at all cost. And the brutality of war and the incredible and inspirational will power a honorable man had when it came to saving lives. It's a film that I can highly recommend to just about anyone.9/10",Hacksaw Ridge,2119532
65,midas-jacobs,War from a pacifist view,10/10,12 November 2016,"""Hacksaw Ridge"" is about the pacifist Desomond Doss, who refuses to pick up a gun, but somehow still manages to save over 70 lives in the battle of Okanawa.Last night I saw this movie and ""The accountant"" back to back, and I have to say that this movie was the best out of the both. Mel Gibsons directing was on point. After ten years of doing no directing, he still has it. His shot composition is very good and he has put some symbolism in the last frame. Quite obvious, but still. He also managed to created a realistic feel for the movie. Mel also has some for shadowing going on in the movie. It doesn't happen once or twice, but a couple of times. I didn't really mind it, but maybe you could get annoyed by this. Mel Gibsons way of showing war was very good. He put down hell on screen. A lot of things helped him with this thing, the make- up design for example. The make-up looked very real. It reminded me of ""Saving Private Ryan"". Heads and other body parts were flying everywhere. The costume design too was really good. The movie also reminded me of ""Full Metal Jacket"" in a way. The training sequences looked similar and there was the drill sergeant. It kind of mirrors the movie in my opinion.What Mel Gibson also did well were the battle sequences. If they are there, they hit hard. You feel so involved in those scenes. I was at the edge of my seat the entire time, with goosebumps. The score was loud and worked perfectly with those scenes. An example of the well-crafted score is in the first battle sequence and also my favorite part of the movie. This is with the mist hanging there, hiding everything in a threatening way. The score slowly building up to the reveal. The slow editing. And then action breaks loose and the score is at its peak, with the pacing suddenly moving faster than before. That part was really brilliantly handled by Mel Gibson and he gave me chills in those parts. Something that he also did right were the scenes where Desmond is the only one up there saving everyone. You are constantly sitting on the edge of your seat. At first I thought that it was going to get repetitive after a while (him constantly doing the same thing trying to help people), but Gibson managed to keep me interested, by showing new things constantly. The scenery in those scenes were good looking, jaw dropping even, but sometimes the Cgi was notable.Now I've been praising the movie a lot for the battle sequences, but there are two things that I want to mention, which I didn't like from those parts. One is the scene where Desmond saves Sgt Howell, by dragging him on a blanket. That was just ridiculous. The ground was uneven everywhere and yet he pulls him forward like it's nothing, without any bumps even. Sgt Howell also just keeps shooting at the Japps like he is Rambo. And another thing I disliked was the cheap way that Desmond escapes from the Japps in the tunnels. That was lazy movie magic. And a thing that I disliked a tiny bit, is that the first act takes a long time to set up the rest of the movie. But after the first act, everything becomes ten times better.The acting was really good. Andrew Garfield gave his best performance yet. He really showed how his character evolved from a normal boy, to a damaged man. He shone on the battlefield, with all the emotion he had. He could say things, without even speaking. His accent was very good. Hugo Weaving, who played Desmonds dad, really was fantastic too. If he doesn't get an Oscar nomination, there's something wrong with them. I think that Weaving managed to show what war could do to a man. He gave in my opinion the best performance of the movie. Someone that surprised me was Vince Vaughn. This was one of his more serious roles, and I think that he should keep doing them. He was phenomenal as the drill sergeant. Not as good as the one in ""Full Metal Jacket"", but still very good. Sam Worthington and Luke Bracey are good in this movie. I didn't even realize that I was watching Worthington act. And last but not least: Teresa Palmer. She was very good, and also gave the performance of her career,. Which does not say much if you look at the other movies she has been in.The script was good. It was good in the dialogue aspect, but very good in the charactorial aspect. The characters were well developed and had its arcs. We go from Smitty hating Desmond, to them building up a friendship. We go from a normal young man, to a damaged one. There were also some cliché characters (The hand someone, the nerd...), but they need to be there, because of the giant amount of other characters. The cliché ones are easier to recognize on the field. Some of the characters that they set up, were being underused in my opinion. Like I've said before I think that they could've left some bits out in the beginning of the movie. I understand why they put those things in there. They wanted to set up the characters believes and motivation for it, and give him some more substance, but it just took them to long to do this.So that's my opinion of ""Hacksaw Ridge"", I probably forgot some things to say, because there's a lot to say about this movie. It's one of my favorites of 2016 and that's why I'm giving this one a 9.6/10.",Hacksaw Ridge,2119532
66,Laakbaar,"""My way to serve""",9/10,27 December 2016,"This movie is the story of Desmond Doss, an American army medic who was a hero at the battle of Okinawa. This enjoyable, profound and well-crafted movie not only tells a great story, but also has important life lessons about war, courage, sacrifice,leadership, character and conviction.We should be grateful that a movie like this can still be made in 2016. That there are still writers, directors and producers able and willing to do this. We're no longer used to going to films that hold out characters as role models. Yes, there is a religious element to it. But I'm not religious at all, and I felt the religious aspects of this were sensitively handled and not too overt. I don't think it's inappropriate to be reminded now and again that we were once in a life-and-death struggle with some of our current allies. It is shocking now to see the intensity of it in one realistic battle scene after the other. Tempora mutantur, nos et mutamur in illis What I didn't like about this film: (1) The recruit training scenes were not 100% realistic to me. (2) The director made it seem like Doss's c.o. status was unusual and affront to his officers, but of course they must have had a system for dealing with this not uncommon situation. (3) The battlefield carnage may be too realistic to some. (4) The Japanese side was not developed in any way, and I think they were almost caricaturized.If you have children who can handle battlefield carnage, take them to see this inspiring film. Are there still young people of conviction out there? Is Mel Gibson's Desmond Doss a realistic role model for our jaded times? I think Andrew Garfield played the role well, and is someone that young people can identify with today. I'm sure some people are going to be uncomfortable with seeing a movie like this made by a director who is wrongly perceived as a dumb*ss beefcake actor and as conservative, ultra-religious and racist. And yet regardless of what you believe about Gibson, there is no doubt that the man is a gifted craftsman. He is a great director who makes mind-blowing movies.",Hacksaw Ridge,2119532
