,User_name,Review title,Review Rating,Review date,Review_body,Movie_name,movie_id
43,eddie_baggins,Could be the best war film since Saving Private Ryan,8/10,6 November 2016,"It's been a long hard road back, but with Hacksaw Ridge the long ridiculed and often ostracised Mel Gibson has once more announced himself to the movie world with a unique and affecting war film that is arguably the best of its kind since Saving Private Ryan stormed the beaches in 1998. In the process of his fight back to redemption, Gibson who has long been a powerful storyteller, has also created one of the most fully formed and impressive Australian films of all time with Hacksaw Ridge providing us with an impressive and on form cast, a stunningly captured film that features some of the most intense battle scenes conducted on film and a real life central figure that well and truly deserves the airtime he gets in this movie. More than likely inspired by his own faiths and beliefs, Gibson has in the story of war medic Desmond Doss (played here by Andrew Garfield, in the best form his been in since his breakthrough Boy A), a man who refused against all the odds to hold a weapon during the war thanks to his firm stance against taking a human life, found a character that brings out the best in the filmmaker and with a strong initial set up of Doss, followed by a gruelling time at boot camp and a blood filled campaign in Okinawa that provides this war epic with a heart and soul that makes it an experience that can be enthralling for viewers of all shapes and sizes. The enthralling nature of Hacksaw Ridge stems from its focus on not being a simple war story, it's all at once an affecting tale of love, an examination of one's stance to remain true to what they believe in and an ear shattering, nerve rattling depiction of war and while the middle section of Gibson's film lingers on slightly too long and a repetitive nature of events threatens to derail the tales great opening and incoming spectacle, Gibson and his troops that includes an awards worthy supporting turn from Huge Weaving as Doss's alcoholic father, Vince Vaughan's likable army sergeant and another turn from Teresa Palmer that suggests she's very much verging on becoming Australia's next big thing, make sure that Hacksaw Ridge never allows itself to dip below anything but a fantastic overall production.It's not for the faint of heart and many may find the war scenes within Hacksaw Ridge to authentic to bear but this is a film that showcases many of the best elements of Gibson as a filmmaker and in telling a worthy real life story, Gibson has announced himself once more to an industry that could've easily been done with him and this impressive film is a likely contender at the upcoming awards season, bringing about the recognition that Gibson's past failings have once and for all been forgotten about. 4 rope burns out of 5",Hacksaw Ridge,2119532
44,MovieHoliks,"Do yourself a big favor, and SEE THIS MOVIE!!",9/10,7 November 2016,"I made it to the multiplex over the weekend, and was blown away by this movie -- THIS is exactly what the movie-going experience is all about. After a ten-year hiatus since 2006's awesome ""Apocalypto"", Mel Gibson directs this true story of WWII American Army medic, Desmond Doss (played by ""The Amazing Spider-man"" himself, Andrew Garfield). He served during the Battle of Okinawa as a ""conscientious objector"", or as he put it more fittingly, ""conscientious contributor"". Rachel Griffiths and Hugo Weaving give in-depth performances as his parents, as do Vince Vaughn and Sam Worthington. Do yourself a big favor, and SEE THIS MOVIE!!",Hacksaw Ridge,2119532
45,freshclean-66-318608,A Rated R Movie That's Very Inspirational.,8/10,6 March 2017,"""Hacksaw Ridge"" is a very inspirational and gripping war film directed by Mel Gibson. It shows what strong faith and staying true to what you believe can do. Desmond Doss (Andrew Garfield) is is a WWII Army Medic who serves in the Battle of Okinawa but refuses to carry a weapon because of his faith. He faces many challenges because of his faith even before he hits the battlefield. This makes for very interesting story. Along with a great story-line, this film is filled with action, drama, and a great cast. With Vince Vaughn playing the role of Sgt. Howell, Hugo Weaving playing the part of Tom Doss, and Andrew Garfield playing the part of Desmond Doss, the cast was just about perfect. In the end, this film is very inspirational and I encourage anyone to see it but if you like good war films, especially historical ones, I highly recommend this one.
                
                    2 out of 2 found this helpful.
                        
                            Was this review helpful?  Sign in to vote.
                        
                        
                    Permalink",Hacksaw Ridge,2119532
46,tobbejonsson,Sweet but shallow,1/10,2 February 2017,"This is a sweet movie. It's very very sweet. In fact, it's so sweet that you can almost see the syrup dripping from the screen. And don't get fooled by the colors. This movie has a more black/white feel to it, heaven or hell, good or bad, etc etc.And I'm confused. Is this a political movie? I don't know anything about Mr Gibson's political views, but if this is it - I'm not buying.Is it a religious movie? If so, what is the message? That it's OK to go to war in the name of God?.I'm confused. So...what am I missing. Well, some nuances for starters! We have this clean-cut handsome James-Dean guy and his gorgeous sweetheart girlfriend (this is where the movie is sooo white and happy), and then we have this gruesome war where everything is very very black. And the Japs are evil. End of story. Is it that simple? Hmm...don't think so.This is a hard movie to rate. I give it 1/10 colorful nuances but a whooping 10/10 syrup bottles! And watch out - you might slip on the syrup floor on your way out from the theatre.",Hacksaw Ridge,2119532
47,ihanson7,"Enjoyable, but almost two different movies",7/10,27 February 2017,"Hacksaw Ridge was a very enjoyable (based on) true story, but almost two different movies. The first half focused of family and love and the second half was a bloody war scene depicting true bravery by a determined idealist. I would recommend seeing it on the big screen for the sound and cinematography. It received nominations for Best Drama Picture, Best Actor in Drama and Director.
                
                    5 out of 6 found this helpful.
                        
                            Was this review helpful?  Sign in to vote.
                        
                        
                    Permalink",Hacksaw Ridge,2119532
48,MovieAddict2016,Gibson has made a superb war film. Even Vince Vaughn and Sam Worthington are great in this!,8/10,5 November 2016,"Say what you will about Mel Gibson - because much can be said and much has been said - but at the end of the day, he is an undeniably talented filmmaker. Even his most flawed films, like ""The Passion,"" are ambitious and hard to ignore. He isn't someone who rests on his laurels or takes paycheck gigs, and ""Hacksaw Ridge"" is imprinted with as much of his DNA as a filmmaker as any of his other movies.Combining the visceral nature (as well as the literal viscera) of ""Apocalypto"" and ""Passion"" with the grandeur storytelling of ""Braveheart,"" this true story is without a doubt a movie riddled with issues: the first half, though compelling and with fine performances, does at times border on the sentimentally hamstringed and predictable.And yet it works, mostly because of the performances and the direction. I read a review stating that everyone in this film was miscast; I couldn't disagree more -- this is a fine example of how perfect a cast can be. Andrew Garfield is exceptional and deserves an Oscar nomination. Teresa Palmer does the best she can with a relatively one-note love interest; she manages to actually make the character stand out more than on paper.Hugo Weaving gives perhaps the finest performance of his career, another award-worthy supporting turn as Desmond's father. But the real surprises here are the straight-to-video actors who usually seem devoid of charisma: Sam Worthington does career-best work here, while Luke Bracey, the nobody actor from the ""Point Break"" remake that no one asked for, is memorable as a stoic soldier whose skepticism of Desmond gradually evolves as the film progresses.Finally, there is the revelation of Vince Vaughn's drill sergeant, who already ranks up there with R. Lee Ermey (if that sounds hyperbolic, it really is that fine of a performance). After his failed comeback with True Detective's miserable second season, and bomb after comedy bomb, it's nice to see him returning to his roots as a character actor. He's simply great here.At the end of the day this is likely to be overlooked at awards season simply given Gibson's baggage and the unfortunate shadow it casts over his work, but my hope is that voters will be able to see past that and approach the film on its own terms. It features some of the most gruesome and unforgettable war scenes ever captured on film, and yet none of it seems particularly excessive or undeserved: to really appreciate the sacrifice and the heroism that the real Desmond displayed in battle, you almost have to be thrown right into the worst of it to be able to place it in a proper context. This is not ""Enemy at the Gates"" or ""Behind Enemy Lines."" Mel Gibson has made one of the best war films of all time, and he, Garfield and at least two of his supporting actors all deserve recognition for this come Oscar season.",Hacksaw Ridge,2119532
49,donprosseractor,Superbly crafted screenplay of the Doc,9/10,19 October 2016,"I was fortunate enough to see an advanced screening of HACKSAW RIDGE in Hollywood and was impressed. The screenplay is authentically-driven to the last detail and portrays the horrors (and prejudices) of wartime conduct. I knew we were watching an epic film when at the conclusion, the audience was stunned so much so that the applause was delayed.If you consider yourself a true patriot of America, this movie portrays YOUR values in a blessed light. For ONE gentlemen, amidst extremely adverse treatment by his own comrades and even more deadly hated by his enemy to have save SO many men... is simply epic.I watched the advanced screening with members of the military and faith community alike. At no time did anyone retract from the horrors of war or add asinine political commentary. We all understood that soldiers fight for one another before they fight for a cause and that hatred of war is universal; even among soldiers.",Hacksaw Ridge,2119532
50,lojitsu,Help me get one more!!,9/10,4 March 2017,"Here's The Lowedown on ""Hacksaw Ridge"" (R - 2016 - US)...Help me get one more!!Genre: Drama/War My Score: 9.0Cast=9 Acting=10 Plot=8 Ending=9 Story=10 History=8 Script=9 Filming=9 War=10 Pace=8WWII American Army Medic Desmond T. Doss, who served during the Battle of Okinawa, refuses to kill people, and becomes the first man in American history to receive the Medal of Honor without firing a shot. ""With the world so set on tearing itself apart, it don't seem like such a bad thing to me to want to put a little bit of it back together."" I loved this movie...where one day changed the viewpoint of an entire army!!! This is one of those movies that will make you wonder if you could believe in something so strongly that you would go against the US military. This is probably my favorite war movie since ""Saving Private Ryan"". In War, fathers may bury their sons...but on Blu-Ray, this movie will live on!!",Hacksaw Ridge,2119532
51,phd_travel,A remarkable hero and a remarkable movie,10/10,20 January 2017,"This is the best large scale war movie in years. The screenplay by Robert Schenkkan is emotionally charged and involving. The direction by Mel Gibson is superb. The battle sequences is second to none. Scary and not confusing at all. This movie is a must watch. The first part shows the childhood and character shaping events of Desmond Doss. It may seem slow to those eager for a typical war movie but his unique personality is what made him different and such a unique hero. His alcoholic father and other reasons why he abhorred violence are made clear. His romance is unlike some movies not annoying at all. Teresa Palmer makes a believable and warm love interest. She reminds of a more salt of the earth K Stew - really purty. His training and the opposition he faced not carrying a gun seems a little too much. Makes you more amazed why he still wanted to fight at all. All this gets a lot of sympathy for the main character emotionally like most Mel Gibson's movies you are 100% behind the hero.Then the battle begins. That ridge looks pretty daunting. I know it wasn't possible to film in actual locations since the location in Okinawa is very much built over. But the ridge doesn't look like the landscape of Okinawa I guess because it was filmed in Australia. But that doesn't detract much from the terrific battle sequences that are scary and some of the best ever filmed. After the first main battle is over then the heroics of Desmond start and they are just so unbelievable it has to be a true story. Andrew Garfield is right doing the hillbilly thing well and then the unlikely hero even better. He is perfect for the role. It helps to have recognizable supporting cast like Vince Vaughn, Sam Worthington and Luke Bracey so you can remember who is who when they are fighting.This is a movie that will leave you spent. If Mel's name didn't carry with it the unfortunate associations with his tirades it ought to bag all the awards.",Hacksaw Ridge,2119532
52,rgkarim,Gibson doesn't Hack On Hacksaw Ridge,9/10,3 November 2016,"American entertainment, most of us know it's all about the extremes these days (extreme crudeness, extreme drama, extreme stupidity). Well tonight an extreme director, Mel Gibson, takes a shot at making a movie that might defy the simplistic trend of most cinema is today. Tonight a buddy and I hit the theaters to check out Hacksaw Ridge, a war drama that pegs the life of a rare officer position (the combat medic). Will this interesting spin fit well in the library of battle based films, or has Gibson gone off the deep end. Let's get goingLIKES:  Action Packed  Balances faith with honor  Inspirational  Fantastic effects  Good charactersYeah, I have a lot of likes and it starts with the action this movie has to offer. Hacksaw Ridge can be described as the pacific campaign of Saving Private Ryan, with plenty of explosions, bullets, and flamethrowers to light up the silver screen. You'll be cringing as all hell breaks loose in high definition sound and incredible special (not cheesy) effects that will drag you into the depths of battle. You might find yourself at the edge of your seat watching your hero tear through the scarred land, jumping through the carnage to take down a bunker. Like realistic portrayals of war, this is the film for you. But Hacksaw ridge isn't just about soldiers getting dismembered or barbecued. No it's a tale meant to inspire people to believe in their values, defy the odds, and yes help people without killing them. Gibson and his team have designed emotionally packed scenes where the cinematography alongside the stunning orchestral work bestows the honor of our soldiers. The dialogue also preaches the message Doss' story is designed to tell, much of which involves faith being tested against tradition. Sometimes it got a bit cheesy with the blatant, overdramatic deliveries, but it fit so well into the film it really didn't faze me. Regardless, both patriots and religious zealots will love the balance of faith with duty, and have a character you latch onto. As for the cast, well Hacksaw Ridge has a little something for everyone to latch onto. Doss is the picture of a perfect, good spirited southerner, complete with hick like accent (thank you Hollywood stereotype). His morals, loyalty, determination, and overall nice guy attitude are qualities that many will find endearing. Too much of a good two shoes? Well then go for the gung ho Yankee who wields a gun like Rambo named Smitty. His character is all about the action, the adrenaline, and the war hero pride you love to see in these epics. Still too serious, then throw in Vince Vaughn as a sergeant who has action, comedy, and a bit of compassion to round out the cast. The company has strong heroes to lead the charge, amidst the extras whose names you might forget. DISLIKES:  Slow to take off/A bit rushed  Characters lost in the carnageHard to find fault in this movie, as Gibson and company did so well making this epic war drama. However, there were a few things my buddy and I found a little limiting. The main thing was how long it took the movie to take off. Sure we have to have an origin story and build up how are character had his coming to Jesus moment (a rogue brick to his brother's head). Despite how good they did with this, it doesn't help that it took a while for Hacksaw Ridge to take off. The first thirty minutes in particular are rushed relationships with his parents and girl, which although establishes Doss' life, drags at times as you wait for the training to begin. In addition, some of these arks get dropped into the background, left to simmer until the ending when the campaign is over. This was especially true for some of the soldiers, who after a five-minute introduction are dropped into a sea of extras almost never to be seen again. Doss and a few other troop members will get much of the screen time, while others will stand out only by looks before violently flopping on the desolate wasteland of the ridge. You would think a little more involvement after taking the time to name them, but no not the case. In addition, some of the romantic and family dynamics are dropped like a bad grenade, only to be tied up at the end of the show. Outside of these small flaws, the only other thing we agreed on was some random additions of Japanese customs, which while accurate was kind of pointless in the grand scheme of things. The VERDICT:Hacksaw Ridge is one of the best modern war movies I've seenperiod. The nice spin on the protagonist being a pacifist drops a whole new light on the war theater and provided a character who was deeper than the barrel of a rifle. Doss' story is certainly inspiring, and it's nice to see a movie where both faith and honor can work in tandem without being dragged out and dull (Unbreakable). Yes it does take time to get stoked, but once the spark ignites, it shines in suspenseful, well-shot delight. Of note, this movie isn't for the faint of heart. Weak constitutions may get sick, or have nightmares depending on how mutilated, bloody bodies affect you (PLEASE DON'T TAKE SMALL KIDS TO SEE THIS FILM). I strongly encourage a theater visit to this movie, perhaps a couple of times if you've got the cash. My scores are:Biography/Drama/Romance: 9.0Movie Overall: 8.5-9.0",Hacksaw Ridge,2119532
53,miguelneto-74936,A great movie about a hero who saved a lot of people without using a gun.,9/10,29 January 2017,"Hacksaw Ridge is yet another proof that Mel Gibson is a great director, Hacksaw Ridge is top 5 best war movies of that century, the movie resembles quite Full Metal Jacket from Stanley Kubrick, who has 2 act, totally different, the first shows the Doss's life, his relationship with his family, his training and his passion for the doctor Dorothy, Andrew Garfield makes perhaps his best acting career (I have not yet watched Silence), it impressed me, I always found him a middle-aged actor, Vince Vaugh is very well, Teresa Palmer, Sam Worthington, Luce Bracey, Hugh Weaving and etc, the rest of the cast is very competent, the script unfortunately is not perfect, has many problems, has very dialogues Mel Gibson bloody portrays the horror of the war, and he is very good at doing it (Braveheart is proof of this, blood battles and Very well done), the soundtrack is good, the rhythm is very good, it has incredible scenes, I really enjoyed the final scene, and the construction of Desmond in the movie is great, Hacksaw Ridge is undoubtedly one of the best Oscar movies, and If winning will not be unfair, Mel Gibson has to make more war movie. Note 9.4",Hacksaw Ridge,2119532
54,twpain,Loved It!!,10/10,7 June 2020,This movie tells such a powerful story of a guy named Desmond Doss who wanted to go to war but would not fire a gun. The story was made so well and Andrew Garfields performance was exceptional. The story was done right the action was very entertaining making for one of the greatest war movies!,Hacksaw Ridge,2119532
55,jb07-660-944395,A modern Sergeant York,9/10,4 November 2016,"Mel Gibson has put together a great bunch of (mainly Australian) actors who bring their characters to life. Andrew Garfield does an amazing portrayal of Desmond Dos, and full marks have to go to Vince Vaughn who makes a brilliant sergeant.The first half of the film is very similar to Sergeant York, except that Desmond Dos won't touch a gun. We can only marvel at his strength of convictions. Given that war films are a dime a dozen, and the initial barrack room scene has been done to death, the initial barrack room scene in this movie is original and novel. It is also quite funny.The second half of the movie provides many examples of Dos' courage. A courage that most of us can only wonder at. Here is a man who is prepared to go into battle unarmed, with the sole aim of saving lives.Unlike in We Were Soldiers, Mr Gibson seems to have kept a lot closer to the facts, although he still put in his customary bayonet charge near the end.Showing the actual interview with Desmond Dos at the end was the icing on the cake.I was very surprised to read in Wiki that Dos did many more heroic deeds than those displayed in the movie, and that he was wounded three times.A true hero and a great film.",Hacksaw Ridge,2119532
56,colewaters,Hacksaw Ridge,10/10,10 November 2016,"Hacksaw Ridge is a triumph. Mel Gibson shines behind the camera as he directs this once in a life time movie. This is one of those movies where you walk into and you don't think your going to enjoy it, but you turn out to love it so much that you want to watch it over and over again. Andrew Garfield showed his star role to date he was amazing. This was the most realistic war movie since Saving Private Ryan, but this movie was way more realistic then SPR was. This movie deserves to win awords especially Oscars and Golden Globes. This movie also had a lot of great supporting actors as well. Parents this is a war movie so it is rated R for a great and deserving reason so if you want to take your kids to see this make sure you want your kids to see a bloody war movie like Hacksaw Ride the best war movie everThanks for reading
                
                    13 out of 27 found this helpful.
                        
                            Was this review helpful?  Sign in to vote.
                        
                        
                    Permalink",Hacksaw Ridge,2119532
57,gradyharp,'Help me get one more.',10/10,28 May 2017,"Seeing and experiencing films such as HACKSAW RIDGE during Memorial Day is a strong reminder of the honor we owe to the men and women who have fought to protect us. Though wars continue, around the globe and within our strife-ridden country, the horror of war is ever present, but the courage and sacrifice veterans have made and continue to make deserve our honor.HACKSAW RIDGE is a very fine film about the battle of WW II on Okinawa as written for the screen by Robert Schenkkan and Andrew Knight and direct with great sensitivity by Mel Gibson. This, as we all know, is a true story of a young conscientious objector Desmond Doss (Darcy Bryce/Andrew Garfield) who entered training for WW II having had a terrifying experience as a child with his brother Hal (Roman Guerriero/Nathaniel Buzolic), enduring the PTSD alcoholic father (a brilliant performance from Hugo Weaving), growing up as a 7th Day Adventist, and how he adjusts to military life in training, nears court marshal because of his refusal to carry a gun, and ends up in Okinawa where unarmed he save the lives of 75 fellow GIs. Thankfully the script allows the first half of the film show the character development of Desmond, introducing the men in his company (Luke Pegler, Luke Bracey, Nico Cortez, Farass Dirani, Jim Robison, Goran D. Klet, Damien Thomlinson, Sam Worthington, a brilliant Vince Vaughan, and more), and Desmond's love interest (Teresa Palmer) and his mother (Rachel Griffiths).The fighting action is brilliantly depicted and well photographed by Simon Duggan – and of course directed by Gibson. Rupert Gregson-Williams supplies the very appropriate musical score. The film is violent to watch: war is violent to watch. The message of Desmond Doss's honor is underlined by images at the end of the film. This is a very fine film – particularly on Memorial Day.",Hacksaw Ridge,2119532
