,User_name,Review title,Review Rating,Review date,Review_body,Movie_name,movie_id
23,nogodnomasters,What is it you want of me?,10/10,2 September 2017,"The IMDb film description reads as follows ""WWII American Army Medic Desmond T. Doss, who served during the Battle of Okinawa, refuses to kill people, and becomes the first man in American history to win the Medal of Honor without firing a shot."" The film is biopic of Desmond Doss and not so much a story of Hacksaw Ridge. We only get his biographical background. The working title was ""The Conscientious Objector"" but war films market better. There is a teaser in the beginning and then the movie looks at the events that shaped Desmond's life and how a conscientious objector comes to serve in the army. He was hazed and beaten as a recruit and turned around and saved the lives of many of them who threw the punches. Don't want to say too much, just go see it.I am not really into war films, but this one grabbed me. Filmed in New South Wales, Australia.Guide: No swearing or sex. Male butt nudity.",Hacksaw Ridge,2119532
24,gregorysmith-82520,"Hacksaw Ridge: an emotional journey alongside the war-hero, Desmond Doss.",10/10,8 October 2016,"Hacksaw Ridge is not a film for the feint-hearted. Right away the opening scenes portray the horror of war, and the emotional journey is only beginning as the audience is led through the story of war-hero Desmond Doss. One of the great feats of storytelling from Mel Gibson (director) and Andrew Garfield (leading role, Desmond Doss) is to lead the audience along Doss' journey with a feeling of having experienced the journey as Doss, and experiencing the wide range of emotions endured by this heroic character along his journey.Neither war itself nor violence are glorified in the film, yet they also not derided. The elements of conflict that draw the storyteller – the heroism of overcoming adversity, the bonding of soldiers, and the brave resolve on which soldiers must rely to perform their duty amidst such chaos and terror – these elements are all present, but they placed alongside the horror, the madness and the terror of war, and used to draw in the audience for Doss' journey. The lasting psychological impact for those who survive conflict is well told by Hugo Weaving's portrayal of Doss' father, whose lines could serve as a mouthpiece for many veterans.The supporting roles add depth, with both script and performance making very few, if any, of the supporting characters two dimensional. Vince Vaughn's excellent turn as Doss' training sergeant provides both humour and pathos to bring laughs and pause- for-thought at well scripted points of the tale, allowing the audience to gather their breath.By the end of the film, audience members will leave the cinema feeling tired, worn out by having experienced Doss' journey of hope, innocence, love, confusion, anger, faith, and courage. Hacksaw Ridge is in no way a popcorn-lazy-Sunday-afternoon film; it is a journey.",Hacksaw Ridge,2119532
25,shoobe01-1,"Will you hold it against me if I say ""Hackneyed Ridge?"" Probab;y.",5/10,21 March 2018,"This film wants to be a bio of moral courage in the face of whatever. Sure. I can see how that was the point. But they lost it on the way. And in the end, to me, absolute and 100% failure. It Is A War Movie. Have no doubts. A lot of the movie is the fighting on Okinawa, from the point of view of the armed soldiers, and their officers and NCOs. Sometimes, briefly, from the POV of the Japanese. There are occasional cuts to little vignettes of our hero doing things. But they are disjointed and have no obvious point. And the whole opening, the first hour or so, is tragically maudlin. A trite aw-shucks love story/basic training thing that turns into a slightly put-upon then triumphant but boring victory. Boring is the deal. Sure the battle scenes are gory, but what's the point of it all? I mean, in the film, why are we watching this? Why does any of it inform anything we're supposed to understand about the morality or faith of our hero? It all feels like a TED talk. A PPT that tells a Heartwarming Story of Success In Adversity. Or if you prefer, a sermon with a great story. But film should show, not tell. And this thing tells you, repeatedly, what you are supposed to think, then goes off a plays video games for a while in between.",Hacksaw Ridge,2119532
26,redrobin62-321-207311,Mel Gibson sure has a lot of family members on IMDb,4/10,25 November 2016,"Did I see the same movie as everyone else? An 8.2 rating for this holier than thou, self righteous yawnfest? Movies like these make Slaughtered Vomit Dolls look like Oscar material. Never in my life have I ever seen a movie as manipulative as this nonsense. Flooded with scenes that could make a grown man hurl, this unrealistic claptrap of a film is only worth viewing once, and of course, that's for the intense and magnificently- rendered violence you can always count on Brother Mel to produce.I guess there were just too many scenes that were pilfered from other movies that made me groan. The influence of Saving Private Ryan, Thin Red Line, and especially, Full Metal Jacket, were WAY too obvious. Would it have killed Brother Mel to not portray the Japanese as one-dimensional, blood thirsty conquistadors? Left a bad taste in my mouth. Hacksaw Ridge. Sigh. A film only Donald Trump supporters could love.
                
                    63 out of 139 found this helpful.
                        
                            Was this review helpful?  Sign in to vote.
                        
                        
                    Permalink",Hacksaw Ridge,2119532
27,Tweetienator,Mel Gibson Fishing For Compliments,5/10,26 January 2017,"Well, the first hour of Hacksaw Ridge is very sloooow and of course the hero marries a beautiful nurse he met... Yawn. After that you get a long-stretched and far more brutal version of Forrest Gumps Nam-hero scenes, sometimes underlined with very cheesy emotional music. Well, after all the fuzz over Mr. Gibsons behavior he must ofc deliver something to get back a favorable public opinion. I liked Mel Gibsons The Passion of the Christ a lot, also Apocalypto, and ofc Braveheart, but compared this is rather a weak movie. I don't know why but between all the explosions and killed soldiers and the gore I don't see why this movie should be a new classic or Oscar material at all. Compared with (anti-)war movies like Apocalypse Now, Saving Private Ryan, Paths of Glory, Das Boot, Hotel Rwanda and the like I find this output of Mr. Gibson rather mediocre. Well, sure we get some fine action scenes and lots of gore but this imo don't defines a (anti-) war-movie as a good one, the story of this one is rather stereotypical and stereotypical told and not very interesting - I mean with or without gun, there were and are thousands of medics always ""in action"", without such fuss about having no gun or having a gun. A movie told about a unit of medics, that would have been something to honor those men (and women), but this movie is something about a stubborn Christian guy which in my view is not very likable (all ppl talking to and with god are in my view highly suspicious ;)) I will just raise one question - if those hero has the choice to grab a gun and shoot a Japanese soldier to save one comrades life - what would be his decision!? This movie gives no answer to questions like this and is therefore imo just sentimental and a praise of Christian belief without contributing anything new to the questions war and its realities raise.And the last ""heroic"" scene - our medic praying and the unit waiting for him to finish before to start the attack and then the attack in slow-mow with VERY cheesy music - this is just bad, a persiflage, a comical end to something who tries to be a movie about a serious matter. In the end our hero even plays football with nades... And ofc with help of the prayer of our hero and the help of the old god of Abraham the US boys beat the evil Japanese. No more to be said.note: the nades kicking scene raises in my view the question how many ppl our hero killed (friends and enemies) unintentionally in just kicking them away in an overcrowded battlefield like depicted ;)",Hacksaw Ridge,2119532
28,s3276169,A war film smothered between thick coatings of religious rhetoric....,4/10,5 February 2017,"I came to Hacksaw Ridge hoping for an interesting and realistic portrayal of the life of Desmond Doss, a conscientious objector, who saved the lives of countless battlefield wounded, as a medic.What you get instead is saccharine, hero stick, smothered beneath thick coatings of religious rhetoric. Its painful stuff, that had me squirming in my seat within the first five minutes of the film's opening scenes. Just as bothersome is the assumption its ""OK"" to be a behave like a nihilistic, cruel drunk (the father character) because ""hey, he served in the war"". This is such a common excuse, in US made war films and television that really does not hold up to close scrutiny.The war scenes in this film are well shot (it does come with a huge budget) and the acting is of a good caliber. That said, there's little of substance on offer here, aside from romanticizing brutal and awful events, that, in my mind, deserve a more somber, down to earth treatment. Four out of ten from me.",Hacksaw Ridge,2119532
29,art-miller,Comic book reality. They deserved better...,1/10,5 February 2017,"Although we have only just nudged our way into February I nominate this as a contender for Worst Film of 2017. It might even win.This is a film of two halves. In fact the transition between one and the other is so abrupt that you could be forgiven for thinking you are watching two different films. The first half is comprised of two acts.Act 1 sees us in Disneyland with a saccharine sweet love story told as only the Americans can do with a plethora of sickly smiles, gleaming perfect white teeth, pretty pastel colours and every damn country boy and country girl cliché in the teenage book of dreamy heart fluttering romance.Act 2 Army training camp. New wet behind the ears recruits and a sergeant major set on making men of them. Familiar territory. You know the score: the recruits will be wheeled out fully formed and ready labelled from the casting department.. The tough one. The farmer boy one. The handsome one. The oddly short one. The goofy one. And the evil one who from the off sets out to make our hero's life a misery. And the signpost also tells you that an hour down the line in this film they will be best buddies. The sergeant major now does what all sergeant majors do in every boot camp film you have ever seen he yells and screams bawls and bellows just half an inch from the face of every recruit. Of course he saves the best of his decibels for our hapless hero.Turns out our hero doesn't want to carry a rifle he just wants to be a medic. So instead of congratulating him on this noble and potentially useful choice of army career he gets bawled out and they treat him like something the sergeant major scraped of the bottom of his size twelve boots.But with the help of his demented dad and his pretty and expertly permed smiling gal our hero escapes a court martial. The gal gives her guy a bible. We saw that coming. Part Two: Our hero and his buddies are gathered at the foot of a cliff. The only way up to Hacksaw Ridge is via a single wide rope ladder. Atop the ridge are approximately a quarter of a million Japanese soldiers. All is quiet. And you can't help wondering why those evil Nips (their term, not mine) haven't simply chopped down the rope ladder or why they are not massed along the top lobbing mortars and grenades down on the troops below.But we have been assured at the start of this epic masterpiece that we are watching a true story so we have to accept that this is how it happened. But that rope ladder still bothers me.However...the troops clamber up the ladder and they are on top of the cliff – and all hell breaks loose after a bombardment from some offshore guns.Now let me state here that I have read about the battles against the Japanese for control of the Pacific islands and am fully aware of the terrible fighting that ensued. The Japanese fought with suicidal recklessness not seen since Medieval times. But in this film that fighting is presented in such an orgiastic way with almost pornographic detail of spilled entrails, pools of glistening blood, severed limbs, decapitated heads, mangled half torsos and spaghetti shredded legs that the suspicion is that the director and writers have intentionally set out to out-gore every war film that has gone before. Every time a soldier looks up a bullet neatly penetrates his helmet and skull. Every time there is an explosion three men are catapulted into the air by some clever hidden device. And then there is more blood and guts and half- men screaming for their moms. The tidal wave of Japs overwhelms the US soldiers and miraculously they all escape down the one rope ladder. It's not shown how they get their wounded down there but hey ho... What of our hero...? Well he is still up top – now alone with the dead and wounded that have been left behind. A few Japs take some pot shots at him but then they all disappear back to their tunnels for some chow.Leaving our hero free to drag the wounded to the cliff edge. This is an heroic task in itself but now he has to get them to safety. He proceeds to lower them down the two hundred feet sheer cliff face. Actually there are only two blokes down there, smoking and chewing the fat. But they do a sterling job sending the wounded back to camp. Oddly no-one thinks to send a soldier or two – or twenty – up the trusty rope ladder to help our hero. They just hang around below waiting for the next dangling hospital candidate.And so it goes on. When our exhausted hero does eventually fling himself down with a rope there just happens to be scores of his buddies waiting for him. Shame they didn't have the balls to go up and help him. But they all line up cinematically so that our hero can be led away.At the risk of upsetting the 'Special Relationship' we have with our pilgrim brothers and sisters on the other side of the pond – and I know my fellow countrymen will understand this – Hacksaw Ridge is just too American. A much better script and a British director would have delivered a subtle, more sympathetic film with less of your usual jingoism and more of the real drama and nuances of war.This is a true story. A story of towering heroism. Real men fighting real battles. But in this mess of a film that story has been reduced to nothing more than a comic book reality. And all concerned deserved better than that.",Hacksaw Ridge,2119532
30,kosmasp,War - The saviour,9/10,12 June 2017,"This is based on a true story, which makes it even more amazing when you think about everything that happens. Of course you could start to question the motives and the morale of the main character (real person). But you would derive yourself of a really powerful but also violent movie. Teresa Palmer and the personal life may seem like a footnote, but they also show a strong personality.And while we can understand why there are so many people who try to discourage our main hero, we get a bit of an inside what makes him tick. Very early on in his life he had an inciting incident. One that scares you for life, one that is really paving the way. So the set up is clear, the action scenes on the other hand are very dirty and very brutal. But that is war, it's not for the squeamish. And while you may have issues with Mel Gibson and his private life (decisions), you can't fault the movie ...
                
                    9 out of 17 found this helpful.
                        
                            Was this review helpful?  Sign in to vote.
                        
                        
                    Permalink",Hacksaw Ridge,2119532
31,george.schmidt,One of the year's best films; Garfield in a career defining performance of heart-breaking vigilance.,10/10,7 November 2016,"HACKSAW RIDGE (2016) **** Andrew Garfield, Teresa Palmer, Luke Bracey, Vince Vaughn, Sam Worthington, Hugo Weaving, Rachel Griffiths, Nathaniel Buzolic, Richard Roxburgh. Incredible true-story account of Desmond Doss (Garfield in a career defining performance of heart-breaking vigilance) a Virginia bred youth who enlists in WWII to become a field medic as a conscientious observer only to face a gauntlet of anger, indifference and resentment from the Army, his fellow soldiers and officers, while relying on his spiritual faith in God to get him thru literally a baptism of fire on the battlefield (skillfully and graphically recounted by Mel Gibson returning to form as a gritty filmmaker with no holds barred after a decade of personal controversy and questionable career choices). Well cast ensemble includes a funny and dedicated Vaughn as Doss' sergeant at arms/drill instructor, Worthington as his officer in command, Weaving and Griffiths as his loving yet troubled parents (Weaving is amazing as a demon-plagued alcoholic WWI vet who shows his true colors) and fresh-faced newcomer Palmer as his beloved fiancée. The war sequences are truly harrowing and give SAVING PRIVATE RYAN a run for its money on the bloodshed, anarchy and destruction embroiled on the big-screen. Epic filmmaking and a must-see to see what being a true hero is truly about thanks to a recognizable yet profound screenplay by Robert Schenkkan and Andrew Knight . One of the year's best films.",Hacksaw Ridge,2119532
32,somf,A triumph for Gibson,9/10,26 October 2016,"No matter what you think about Gibson, and I don't think much of him as a man. He is an elite director. There is a unique genius in how he handles this film. I hope this does not constitute spoilers, I don't think it really does, but the battlefield scenes are the most harrowing I have ever seen. There is nothing left to the imagination with shock after visceral shock coming at you for a good twenty minutes. The effect is an adrenaline surge as you feel like you are trying to survive with Doss and the rest of his troop. The payoff occurs after Doss does what he does and comes off Hacksaw Ridge. It is so emotional. The effect is amazing and it is all steered by Gibson's intense direction. You may even think, oh God, this is just too much, as you are watching the battles unfold, but it all results in a unique payoff.I like Garfield . He is a bit too goofy at the start and I feel like his hairdo makes him look more like the lead guitarist from the Spiders From Mars than a WWII hero. But once he gets in uniform his character really develops. Vince Vaughn seemed to love chewing the scenery as the Sarge, and Teresa Palmer was also solid.As an agnostic, there was one scene at the end that I felt was a little over the top, but the religious angle is handled beautifully and the power of faith is a great lesson for anyone. This is going to be a real crowd pleaser, but it is decidedly not a family film despite the theme. It is the most violent film that I have ever seen.",Hacksaw Ridge,2119532
33,lasttimeisaw,Mel Gibson still gets his faculties to produce a pleasing blockbuster,7/10,14 September 2016,"Ten years has fleetingly passed since Mel Gibson's last directorial outing APOCALYPTO (2006), HACKSAW RIDGE is his fifth feature in the director chair, just debuted in Venice, out of competition. It is a WWII drama about the US war hero Desmond T. Doss (Garfield), who is, quoting the film's tagline, one of the greatest heroes in America History never fired a bullet, is it an undisguised retort to Clint Eastwood's trigger-happy American SNIPER (2014)?Desmond's persuasion of refusal to kill people is ingrained by his religious upbringing and cemented by one childhood incident when he accidentally injured his brother during a tussle. In peace time, it is a precept without any question for every citizen to follow suit, but, not during wartime when massive killing obviously becomes a default means pumped up by jingoism and triggered by human's violent nature.Instead of being a conscientious objector, Desmond volunteers to join the army as many young men of his time, driven by patriotic enthusiasm, even though his father Tom Doss (Weaving, strikingly upstages his co-stars with searing potency) is a WWI veteran and has been traumatized by his encounter with savagery ever since. and doesn't think Desmond's ideology can find a toehold in the army. But Desmond has his own plan, galvanized by his romance with nurse Dorothy Schutte (Palmer), he decides to enlist as a medic, to save lives instead of taking them, so that he doesn't need to relinquish his principle.As one can imagine, his singularity is regarded as an unthinkable defiance in the eyes of his peers and his senior officials in the boot camp, he is picked on, verbally abused, beaten up, even subjected to imprisonment, simply because he refuses to touch a rifle or any lethal weapon. Against all odds, Desmond sticks to his guns, but it is Tom who pulls the strings, to seek permission to allow his son entering the battlefield without a weapon, which singles him out as the most conflicting character in a film suffused with one-note display of military discipline and war heroes.The next thing is the real deal, the close-combat between USA and Japan on the Hacksaw Ridge in Okinawa, Gibson doesn't refrain from bombarding his spectators with rousing spectacle where death and injuries escalating exponentially in both warring parties, bullets-flying, blood-spurting, limbs-flapping, hell couldn't be worse than that. After the failed attempt to take over the ridge, which costs US army grave casualties, Desmond, lucky enough to be alive-and-kicking at that point, receives an epiphany from God. He plunges himself into the combat zone again rather than retreating with his troop, taking advantage of the night time, under the eyelid of Japanese army, he begins to drag those injured soldiers one by one to the edge of the cliff and send them down to the ground in rappel, in one night, he heroically saves over 75 lives of his comrades (some Japanese too) and miraculously survives from enemy's scouting, which immediately revitalizes the dwindling esprit de corps, in the subsequent attack, they triumphantly conquers the ridge, Desmond is wounded by an explosion, but it is not lethal, later he is awarded the Medal of Honor.The movie sends his anti-war message lucidly with its no-holds-barred delineation of the visceral cruelty in the front-line and valiantly advocates Desmond's peace-loving philosophy which makes wonder in the face of extreme adversity. Andrew Garfield gives a commendable impression as the wide-eyed hero, gangly, unsophisticated, dogged in his belief, fearless when he is doing the right thing, the only gripe is that he seems to more like a poshly shoehorned exemplar of individual heroism, than a complex personage survived from the ordeal of war. Another gnawing fact is Mel Gibson's politically problematic treatment of the enemy side - cannon fodder plus emotionless killing machine, which fails to bestow this engaging war movie a discerning conscience, especially when a blatant white-flag hoax is intentionally orchestrated to underline the rival's duplicitous nature, it indeed boomerangs and undercuts the empathy of this hagiography. Mel Gibson still gets his faculties to produce a pleasing blockbuster, but if we want a pièce de résistance with enduring impact, in all likelihood, he might not be the one we can bank on.",Hacksaw Ridge,2119532
