,User_name,Review title,Review Rating,Review date,Review_body,Movie_name,movie_id
17,kosmasp,Claustrophobia (as in Horror),8/10,27 November 2017,"For over a year I had heard about this movie, so there was quite some expectation that build up, even before I watched it. And the only thing I knew was that very vivid poster. I didn't even see the cast list (Brian Cox? Very nice). So watching this without any real input, I could enjoy this (or be frightened by it) as much as possible.The acting is really good, which was to be expected with the people attached. Obviously there is nudity, though not titillating (at least it is not meant to be). And while there is horror, this tries not to score points with gore, but rather with an atmosphere it builds. The story may be slim, but the setting is so crystal clear, that you get into the mood and the mindset of the people involved. It really messes you up, in a really good way. The credit and the good word of mouth this received are very well deserved
                
                    8 out of 11 found this helpful.
                        
                            Was this review helpful?  Sign in to vote.
                        
                        
                    Permalink",The Autopsy of Jane Doe,3289956
18,sanjidparvez,Jane Doe is very much alive & creepy!,9/10,21 December 2016,"If you were pleasantly surprised with André Øvredal's TROLLHUNTER (2010), then you will regard him now as your new 'Master of Horror' - in this latest & his first English-language film The Autopsy of Jane Doe! Because, in Jane Doe, this Norwegian director applied almost each & every great craftsmanship of horror film-making so skillfully that you are not only going to see just another good or passable horror flick set around an awesomely interesting premise, you'll going to experience it! Through the effective use of half light, sound, smoke & shadow this time he created an utterly eerie & unsettling atmosphere by revealing not too much but keep toying with the viewer's imagination from start to finish. And the perfect cast & characterization also helps to fuel the unease feeling of an unknown terror – an untouched & unidentified corpse of a beautiful young female; the local cops discovered the body from a shallow grave under the basement of a house-where everyone was massacred! The best horror film of 2016 so far! A must see.",The Autopsy of Jane Doe,3289956
19,trashgang,creepy and gory,8/10,9 January 2017,The title is exactly what this flick is all about. At a crime scene the cops discover a corpse that has nothing to do with the crime. Body full intact it supposed to be an easy autopsy to find out who Jane Doe is.But it wouldn't be a horror if this doesn't turn out the way they should. This flick is so simple but slowly it moves into a creepy flick full with questions about the body. The effects used are stunning and the autopsy is shown in full bloom so it's gory as hell. But the use of the camera slowly zooming in on the face gives this flick a creepy atmosphere and the excellent performances makes it even better. This flick is another gem that's out there without any promotion. The thing is I can't go into the story not to spoil a thing but if you are in into an excellent gory horror then this really is a must see.Gore 4/5 Nudity 2/5 Effects 5/5 Story 4/5 Comedy 0/5,The Autopsy of Jane Doe,3289956
20,Lignin92450,A pretty good idea,6/10,28 January 2017,"This movie's story isn't actually a bad idea! I love the fact that it's about a topic that isn't too cliché, however, the small predictable scenes kind of ruined the fun. Things that didn't need to happen that did: - Girlfriend didn't really need to be accidentally axed to death, there was minimal reaction to this and it was so unrealistic - Cat didn't need to be found mangled, then within 2 seconds, receive a neck snap, no questions asked, again with no realistic reaction from characters - Morgue bodies didn't really need to start walking about again like zombies - Being trapped in a storm without electricity or signal on the phone (obviously)Things that needed to happen that didn't: - More history on the witch - More cool facts about the dates and possibilities of what happened to the witch - Tie the loose ends about her links with the characters she was involved withI loved the music, the unusual scenes, the CSI style findings and whatnot, I wish there had been more story and less jump scares.",The Autopsy of Jane Doe,3289956
21,faridat-91789,Creeeepy,8/10,21 December 2016,"How we long for an actual horror story, and how rare one comes along. Early on you know you are going for a ride.. a painstaking one. There is just a subtle sense that everything is going to build up right, disturbingly, later, and you cannot just see it. There's too much hidden you cannot point them out. How could you? It takes its sweet, sweet time before you feel virtually threatened in the once-comfortable safety of your own home.You are always one step behind. You just do not want to figure it out. Try not let the anticipation turn into a frustration, to not tilt your head to see a foot away into shadows behind the door, not to literally feel the pain, inflicted with an inconceivable harm so mental you are not sure if you want to escape or fight. Try to keep calm.",The Autopsy of Jane Doe,3289956
22,shadowfax73,One of the best horror movies in years,9/10,26 October 2020,"Father and son morticians have to autopsy the body of a young girl. The examination reveals how hard her death was and what was left inside her. The actress lies there on the autopsy table. Doesn't move a muscle. They open here eyes to check her eye color. Her eyes remain open as they carry on with the autopsy. There are lots of close ups of her face that linger for what seems like ages. You expect a jump scare. You don't know when it's coming but the girl is going to give everyone heart attacks....yet she doesn't. Throughout the film she remains motionless, dead. Yet strange things start to happen in the mortuary. The creepiness really ramps up and gets intense. It is one of those films that stays with you. As for me, I've watched it a couple of times and will watch it again. Still scary even though I've seen it before. Low budget, subtle horror done well is more scary to me that films like Haunted or Poltergeist, which are about as scary as a kiddies roller coaster. This film is a keeper, definitely.",The Autopsy of Jane Doe,3289956
23,aidanratesmovies,Surprisingly Excellent,9/10,18 September 2020,"Incredibly brutal without ever being truly gory, The Autopsy of Jane Doe may have some familiar elements throughout, but there is no doubt that it is one of the most stunning and original horror films I have seen in a long time. This film is truly original in many aspects, one aspect being its premise. From such a simple plot, you wouldn't expect something so complex without so much involved, but even as simple as it is, the film makes it work unlike any other, and is truly a great low budget success. The acting is surprisingly really good as well, with Brian Cox and Emile Hirsch providing terrific performances throughout. There isn't a huge cast, as most of the film focuses on the previous mentioned actors two characters, but that isn't to say that's a problem. The close and personal atmosphere between Cox and Hirsch makes for some of the films most suspenseful moments, and its shocking ways of revealing horror without seeing much of it first hand at all, is quite inspiring. The score is often phenomenal, as well as its cinematography and direction, as it not only acts so realistically, but truly feels that way too. There is a few lackluster moments throughout the film, although not many. A cheap jump scare once, a few predictable moments, and a few familiar ones as well here and there. In the end however, The Autopsy of Jane Doe proves to be one of the most clever and creative horror flicks in recent memory, and I praise it for its appeal of such horrific subject matter, with so little on screen and such a low budget.
My Rating: 9.5/10",The Autopsy of Jane Doe,3289956
24,nogodnomasters,We are way past possible,8/10,21 August 2017,"Tommy Tilden (Brian Cox) and his son Austin (Emile Hirsch) perform autopsies. Late one night, a Jane Doe (Olwen Kelly) is brought in. The sheriff (Michael McElhatton) wants a cause of death by morning. Austin, who has a date (Ophelia Lovibond) stays and helps his father rather than exercise his option to leave. As they start examining the woman, things on and in her body don't make sense. Soon father and son, are in a struggle for their lives as inexplicable things happen around them.About 49 minutes into the film, the scare factor intensifies and this thing becomes fun, like ""The Night Shift."" Emile Hirsch was unconvincing in his role while Brian Cox was excellent. Olwen Kelly did a great job of shutting up and being still. Best picture at Austin Fantastic Fest and Fantastic Fest Jury Award, plus a couple of more wins. Nice storm metaphors and good job with the radio.Guide: F-word. Olwen Kelly corpse nudity. No sex.",The Autopsy of Jane Doe,3289956
25,23stitches,One of the Scariest Horror Movies I Ever Saw,10/10,21 December 2016,"This particular flick restored my lost faith in horror movies. Creepy elements galore from start to finish. The idea of an animated corpse with a bell attached to its foot particularly was so hair-raising.There are no cheap scares in The Autopsy of Jane Doe. No cheap effects either. What's so nice about it is it scares the viewer from various angles -- from the claustrophobic basement setting to the fact that not much info on Jane Doe is revealed, which further fuels the mystery that pervaded the movie from start to finish.Both Emile Hirsch and Brian Cox gave stellar performances! Needless to say, The Autopsy of Jane Doe is one of the scariest, scariest horror movies I saw, and it's worth watching!",The Autopsy of Jane Doe,3289956
26,tchitouniaram,"One of the rare ,better ones!",8/10,5 September 2020,"Very well told unusual story,perfect mix of mystery/thriller with horror,good acting.Overall very satisfying experience!
                
                    3 out of 3 found this helpful.
                        
                            Was this review helpful?  Sign in to vote.
                        
                        
                    Permalink",The Autopsy of Jane Doe,3289956
27,shackledmuse,A Refreshing Change,8/10,31 December 2016,"I love horror movies. The sleek ones, the b-grade ones, the really crappy ones with bad acting and cheap thrills. I watch them all. This one? This one left me pleasantly surprised. The scares are carefully crafted, the acting is superb, and the atmosphere gets you before the walking dead does. As the case with most well made horror movies, it is that which you cannot see that frightens you the most. In some ways, the setting and atmosphere reminds of the movie Pontypool. Quick summary, here be spoilers: An unidentified corpse of a woman (Olwen Kelly) is found half buried in the basement of a house where a bizarre homicide has occurred. What stayed with me, was the contrast of the messy and bloody homicide scenes, and the cleanness of the corpse and her grave. Even though half buried, she didn't even have dirt on her. They take the corpse to father-and-son coroners Tommy (Brian Cox) and Austin (Emile Hirsch) Tilden. During their examination, they come to realization that they are dealing with something supernatural.A mountain of contradictions and inconsistencies arise. The corpse has no visible signs of trauma, no rigor mortis. The eyes are cloudy, something that only happens when the body has been dead for a few days. When they make the Y-incision, the corpse bleeds profusely, something that only happens when a corpse is fresh. Her tongue has been non-surgically removed, her ankles and wrists are shattered. One of her teeth is missing, which they later find in a hex bag in her stomach. Her lungs are charred, and her organs imply repeated stabbing. Her vagina is mutilated and when they pull the skin away from her rib- cage, they find strange symbols tattooed on her skin. The first half of the movie focuses on the various, sometimes chilling, aspects of the external and internal examination. The seconds half is when lights go off and things go bump in the dark. Øvredal succeeds superbly in first creating a relaxed atmosphere, with a small cast of characters, and then starts turning the discomfort levels and the creep factor up. I would have given the movie a higher rating, but the ending did not live up to the tone that was set throughout the movie. That said, I still highly recommend The Autopsy of Jane Doe.",The Autopsy of Jane Doe,3289956
28,BA_Harrison,A cut above the rest.,8/10,6 July 2018,"Father and son coroners, Tommy and Austin Tilden (Brian Cox and Emile Hirsch), attempt to find the cause of death of an unidentified woman found half buried in the basement at the scene of a multiple homicide. As they delve deeper and deeper, they discover a series of bizarre clues that point to a bone-chilling conclusion.In a genre saturated with mediocre movies, supernatural horror The Autopsy of Jane Doe stands out as a superbly crafted creepfest that delivers nerve-jangling shivers, while providing enough graphic gruesomeness for those who enjoy more visceral thrills.The film starts out as a fascinating study of a rather revolting vocation, as Tommy and Austin systematically dissect the 'Jane Doe' looking for answers, with director André Øvredal lovingly capturing every sloppy detail of the process. Things start to get seriously creepy once the pair start to reveal the truth about the woman's past, all the evidence pointing to the unthinkable, the action ultimately entering the realms of the fantastic.Øvredal expertly cranks up the suspense, using his shadowy morgue setting to great effect, gradually introducing more and more unsettling elements guaranteed to leave the viewer with sweaty palms and on the edge of their seat (there's something about a reanimated corpse with its eyes and mouth sewn shut that really gets the heart a-pounding, although its the simple sound of a ringing bell that generates maximum tension).Best watched alone at night with the lights out and the doors open, The Autopsy of Jane Doe is a good old-fashioned scary horror that rarely puts a foot wrong, and in these days, that's something to be celebrated.",The Autopsy of Jane Doe,3289956
29,SnoopyStyle,nice little midnight horror,8/10,22 February 2018,"The body of a dead young woman is found buried in the basement of a regular home. It is brought to coroners Tommy Tilden (Brian Cox) and his apprentice son Austin (Emile Hirsch). The sheriff is desperate for answers and Tommy decides to work thru the stormy night on the autopsy.This is a nice little midnight horror indie. It's got the great Brian Cox anchoring and Emile Hirsch shows up for an understudy role. The minutia of the autopsy is great and it turns into a solid haunting story. It's not necessarily ground breaking but it is very well made. There are a few good scares and generally good atmosphere.
                
                    8 out of 12 found this helpful.
                        
                            Was this review helpful?  Sign in to vote.
                        
                        
                    Permalink",The Autopsy of Jane Doe,3289956
30,christopher-underwood,you won't be able to tear yourself away,8/10,13 June 2018,"Impressive and very scary. It is particularly good for the first half when all manner of ideas are being thrown about whilst we try and understand what could have happened. The Jane Doe looks good all the time and is a constant reminder that something very bad has taken place. It is nice that we are asked to switch allegiances during the film but I would have liked to have left the basement once or twice. A little more exposition as to where the girl was found and the circumstances and/or more revelations of possible origins to the clearly sinister happenings. As it is it is pretty claustraphobic and just a tiny bit disappointing the way things turn out after such an horrific first half or so. Mind you, imperfect it may be but you won't be able to tear yourself away, even though you may want to.
                
                    8 out of 12 found this helpful.
                        
                            Was this review helpful?  Sign in to vote.
                        
                        
                    Permalink",The Autopsy of Jane Doe,3289956
31,ktmkamran,From a person who hates horror movies,8/10,30 December 2016,"Yes, I hate horror movies. I watched them in the past and I am usually disgusted by this genre of movies, rather than afraid of them. However, the title of the movie and the brief plot indicated that this should be a rather different and interesting horror movie - and it was! It was not one of those movies where seemingly smart characters make stupid assumptions or decisions, and the movie mostly kept you thinking what will happen next.The actors (including Jane Doe) were awesome 9.5/10 and the effects were good 8/10. The movie is only 1.5 hours long which is just perfect.Worth watching even if you are not a fan of horror movies!Spoiler: The only thing that I did not like was that it was clear from almost the beginning that the girl was a witch. The main characters found so much evidence that she was a witch and even listed all the evidences, but only later in the movie they admitted the fact.",The Autopsy of Jane Doe,3289956
32,nowego,Way Beyond Expectations,9/10,4 June 2018,"If you like horror then you are missing out if you give this one a miss.At 84 minutes including credits I did not expect much, but this blew me away right from the opening and it had me on the edge of my seat basically all the way through.The acting is simply sublime. Brian Cox, a long time favourite and Emile Hirsch do a superb job of carrying this one off. They are amply helped by good cinematography, music and sets.While somewhat predictable in places it still gave me a few unexpected frights.Very well done to all involved and highly recommended.Well deserved 9/10 from me and horror is not really my thing.",The Autopsy of Jane Doe,3289956
33,masonsaul,Incredible horror movie,9/10,30 September 2020,"The Autopsy of Jane Doe is an incredible horror movie that skillfully subverts expectations to deliver a suspenseful, unpredictable and disturbing experience despite some generic set up. Brian Cox and Emile Hirsch both give incredible performances with great chemistry. Andre Øverall's direction is fantastic, it's extremely well filmed with plenty of suspenseful and atmospheric sequences. It's superbly paced and the music by Daniel Bensi and Saunder Jurriaans is excellent.
                
                    7 out of 10 found this helpful.
                        
                            Was this review helpful?  Sign in to vote.
                        
                        
                    Permalink",The Autopsy of Jane Doe,3289956
34,ma-cortes,"Chilling and claustrophobic terror movie with thrills , suspense and supernatural events",7/10,27 June 2021,"In a mansion appears evidence of a cruelly murdered couple, both found by Sheriff Burke (Michael McElhatton), alongside the body of an almost intact and exceptionally preserved of a young woman in her mid-twenties. The Forensic crew formed by father Tommy (Brian Cox) and son Austin (Emile Hirsch) has to execute an urgent autopsy . Like father , like son , Austin follows teachings his daddy along the way the forensic practices . As Austin leaves his girlfriend (Ophelia Lovibond) with whom had amusement plans, deciding to stay with his father during the seemingly quiet night to carry out the autopsy due to the emergency of the case and amid a huge media frenzy. Things go wrong , when they discover cryptic marks , severed tongue , rare tattoos on the body of the young girl , as well as strange phenomenon and poltergeists successively happening. Body has a secret. Her curse lives deep within. Can they unearth pale Jane Doe's morbid secret?Horror fairy tale , being consistently paced, finely played by starring duo : Brian Cox, Emile Hirsch and with a lot of gore , twists and turns .Weird terror movie that's heavy on gory autopsy scenes with acceptable though completely interior production design , colorful cinematography and decent but no excessive special effects , incuding gruesomely vivid guts . A twisted plot in which father and son become involved into a supernatural intrigue resulting in plunging themselves deeper and deeper towards a world of impossible occurrences and equally inexplicable findings . It contains adequate cinematography by Roman Osin, as well as thrilling and suspenseful musical score by Danny Bensi and Saunder Jurriaans . The motion picture was competently directed André Øvredal. This is a good director with a short but interesting career with penchant for Chillers and Horror movies. This is André Øvredal's first English-language film. Andre is a craftsman who has made various nice films , such as : ""The Tunnel"" , ""Scary Stories"", ""Mortal"" , ""Troll Hunters"" , ""Future Murder""and some shorts. Rating : 7/10 . Better than average Terror movie in spite of developing itself at limited interior scenarios. Well worth watching.",The Autopsy of Jane Doe,3289956
35,saintcharlie,YEEEESSSSS,10/10,20 March 2019,"This movie was a fantastic watch. Did it get a little hokey towards the end? Sure. But did it give me goosebumps multiple times? Absolutely. In my book thats a win. The acting was fantastic, I cared about the characters, AND FOR ONCE in a horror movie, the main characters were never at odds. No stereotypical, ""I didn't see the creepy thing you saw so you must be lying!"". Seriously, the father/son duo worked flawlessly, and this is definitely a film I wish I could watch for the first time again.
                
                    21 out of 26 found this helpful.
                        
                            Was this review helpful?  Sign in to vote.
                        
                        
                    Permalink",The Autopsy of Jane Doe,3289956
36,billcr12,Bloody,7/10,21 December 2016,"Emile Hirsch and Brian Cox are the Tillson's, a father and son team of medical examiner's in a small Virginia town who seem to have a good time performing autopsies while listening to loud rock music. One day they are delivered the body of a young woman with no evidence of external physical injuries. Upon further investigation by the men, the clues grow darker and more puzzling. The leads are excellent, with good chemistry. I was captivated through the first three quarters of the film, but the final fifteen minutes were not as good, which make Jane Doe difficult to review. The script does have a decent sense of humor, along with some explicitly graphic scenes; so stay away if you have a weak stomach. Otherwise, sit back for an hour and a half for an above average horror movie.
                
                    11 out of 18 found this helpful.
                        
                            Was this review helpful?  Sign in to vote.
                        
                        
                    Permalink",The Autopsy of Jane Doe,3289956
37,WubsTheFadger,The Autopsy of Jane Doe,8/10,21 March 2018,"Short and Simple Review by WubsTheFadgerThe film starts of with a bang. It is grisly, graphic, and gory. The story is intriguing, interesting, and original. The film keeps the tension high and makes the mystery unknowable. The autopsy part of the film is graphic and detailed. This helps keep the film feeling like it is real. The ritualistic part of the film is eerie and creepy. The ending is haunting and stunning.The acting is superb. Brain Cox delivers a stunning performance. He usually is a side character in most of his movies but he takes the helm in this film with such power and emotion. He is truly an underrated actor. Emile Hirsch also delivers a good performance. His acting was slightly weaker than Brain Cox's and I felt that Cox overpowered him in many scenes. Although some might think it is far fetched calling it acting, Olwen Catherine Kelly portrays Jane Doe very well. She is creepy and has an omnipresent aura surrounding her. Ophelia Lovibond and Michael McElhatton both have small parts but do add to the story.The pacing is very fast. I felt that the story lost some power when they are first looking for a way out of the morgue but it picks up towards the end. The runtime is short.Pros: Grisly, graphic, and gory story, a great ending, the autopsy part of the film was great, amazing acting by Brain Cox, good overall acting, fast pacing, and a short runtimeCons: The story losses some power in the middle, Emile Hirsch was overpowered by Brain Cox in some scenes, and some parts of the story are left unansweredOverall Rating: 8.3P.S. This is a very good horror film. I would highly recommend it to any horror film fans.",The Autopsy of Jane Doe,3289956
