,User_name,Review title,Review Rating,Review date,Review_body,Movie_name,movie_id
0,claudio_carvalho,"Creepy, Claustrophobic and Scary",7/10,22 December 2016,"While investigating the murder of a family, Sheriff Sheldon (Michael McElhatton) and his team are puzzled with the discovery of the body of a stranger buried in the basement that does not fit to the crime scene. He brings the corpse of the beautiful Jane Doe (Olwen Kelly) late night to the coroner Tommy Tilden (Brian Cox) and requests to have the cause of death until the next morning to have an answer to the press. Tommy's son and assistant Austin Tilden (Emile Hirsch) is ready to go to the movie theater with his girlfriend Emma (Ophelia Lovibond), but he decides to stay to help his father in the autopsy. Along the stormy and tragic night, they disclose weird and creepy secrets about Jane Doe.""The Autopsy of Jane Doe"" is a creepy, claustrophobic and scary low- budget horror movie. The screenplay is very well-written and the tension increases as long as the mystery about Jane Doe is discloses by the coroners. The limited use of special effects is another plus in this little gem. My vote is seven.Title (Brazil): Not Available.",The Autopsy of Jane Doe,3289956
1,A_Different_Drummer,Creepy as Hell,9/10,21 December 2016,"And a simply wonderful throwback to the 1970s when horror was, well, horror -- and not based on gimmicks like ""found footage"" but rather genuine scene-setting, story building, audience engagement, and full-tilt creepiness.Probably destined to become a classic.Brian Cox is this generation's Donald Pleasence, that is to say, a character actor who could not give a bad performance if he tried yet is destined to never actually stand out in any single production because that is his style.Director André Øvredal is one of those rare finds -- an auteur with (so far) a small body of work who is producing better and better films. This suggests that over time he will probably give us bigger and better treats to come.And while Ophelia Lovibond does not get a lot of screen time, the exposure she does have will only add to her fan base. An American accent so natural you would think she was trained by Hugh Laurie and a performance so sweet you might not even recognize her (unless you looked twice) as the very same actress that underpinned an entire season of Elementary.Recommended? This is a must-see!((Designated ""IMDb Top Reviewer."" Please check out my list ""167+ Nearly-Perfect Movies (with the occasional Anime or TV miniseries) you can/should see again and again (1932 to the present))",The Autopsy of Jane Doe,3289956
2,Leofwine_draca,One of the freshest horror films in years,7/10,6 July 2017,"Stephen King did well to praise THE AUTOPSY OF JANE DOE, a low budget but effective slice of modern-day horror, because it does feel very much in the spirit of an early King effort. It features strong direction from the guy behind the exemplary TROLL HUNTER, and two decent performances from Emile Hirsch and in particular Brian Cox, excellent as an aged mortician about to perform his most bizarre autopsy yet.I do love a single location film that gets everything right and this is such a film. It's fast-paced, quirky, and inventive, and the corpse-focused mayhem that ensues is reminiscent of the highs of Asian horror such as MR. VAMPIRE or THE EYE. I steeled myself for some extreme gore but the film turns out to be not as gory or disturbing as I'd feared, but it is effectively frightening and the storyline feels fresh and original. If only they made more horror films like this these days!",The Autopsy of Jane Doe,3289956
3,Pjtaylor-96-138044,Genuinely unpredictable but wildly uneven.,6/10,12 January 2018,"The main thing this initially slow-burning horror has going for it is the fact that it is almost constantly genuinely unpredictable, but it's also one of the most uneven (promising) films of recent years; the best bit is the fantastically enigmatic, truly interesting first-half of the second-act in which the eponymous autopsy is carried out (with tangible grisly detail yet unexpected forensic accuracy) and the body's numerous mystifying mysteries are revealed, and the worst is pretty much everything after once it all goes off the rails and dips into more traditional, less engaging generic genre fare - it's a good job that the direction is pretty phenomenal for most of the piece and that the central father/son relationship is both believable and effecting, otherwise the whole piece would sink. 6/10
                
                    9 out of 9 found this helpful.
                        
                            Was this review helpful?  Sign in to vote.
                        
                        
                    Permalink",The Autopsy of Jane Doe,3289956
4,Anaslair,Utterley amazing... for the first 2/3.,7/10,13 March 2017,"The Autopsy of Jane Doe started SO freaking well. I was enthralled right from the opening scene, which first few seconds played with perspective and focus. We are carried from a peaceful environment to a grotesque scene where I jumped a little from my seat just by the exacerbated sound of a camera flash. The photography was stellar. The detail, the angle, the light, everything was superb and simply chilling. There's a lot of play with perspective and the close-ups of simple objects contribute to the eerie atmosphere. For me, it was easily worth 5 stars till then point.When we meet our two protagonists, father and son who will perform the autopsy on Jane Doe, I was still excited and in awe. The interaction between characters was believable and I enjoyed seeing how those two handled the work and each other, Austin his father's pupil, trying to learn his father's business as best as he could. The photography was still amazing and I was immediately hooked by how familiar the creepy workplace worked. These guys could not be more normal and this was their home. Sure, it had the potential to be creepy, but it felt safe and normal, if that makes any sense.Throughout these scenes there were several suspenseful moments where the director had me slowly nudging towards the edge of my seat. I never knew if something really bad was going to happen. And the fact is, it usually did not, not in the way I am used to. There were no easy scares up to this point. There were several freaky elements that contributed to a creepy atmosphere but all in all it was a serious approach to the reality of two coroners. The gross stuff came so naturally I didn't ever see it coming until it was in my face. The sounds were so graphic that I actually gagged on more than one occasion.I really enjoyed the movie till about two thirds or so. Then it all started going downhill for me. The father's theory about what was happening seemed far-fetched, Austin annoyed the heck out of me cause he kept putting his face in harm's way and the acting or script was just bad, I still can't figure out which. I mean, who (spoiler ahead) peeks through a hole, suddenly sees a corpse looking back at him, just nonchalantly begins to figure out the next step?(/spoiler) I am ashamed to admit I shrieked in that scene because I was firmly convinced nothing would happen, considering the previous setup, and that guy does even twitch. Eurgh.Towards the end I felt like such a great work of art was being mistreated for no good reason. The film just became a mockery of what it had been until then - even though the scariest scene of the movie, for me, came then. And when I thought I could not be more annoyed, the last second of the movie proved me otherwise.I don't get it. I swear I don't get how anyone could butcher such an awesome movie, a gem amongst all other horror stuff out there. So yeah, I am still a bit upset.",The Autopsy of Jane Doe,3289956
5,umme4uke,"If you like horror, see this",9/10,20 December 2016,"I'm a big horror fan and this is the best little horror yarn I've seen in ages.Well acted, with some recognisable faces. Brian Cox is great as the small town coroner that leads the autopsy on the titular body, in one scene he even managed to give me a sad lump in the throat which was an unexpected feeling during an unnerving horror flick. Emile Hirsch plays his son and assistant and though he's good doesn't have as much impact as Cox. Roose Bolton (Michael McElhatton) makes an appearance as the town sheriff.Where this film really succeeds is in doing something a lot of modern horror has forgotten about - it toys with the viewers imagination, creating an uneasy feeling out of the narrative, half light, sound and shadow. This is not to say you don't get to see anything grotesque or unsettling, as certain scenes are not for the squeamish.I don't want to spoil the story but will say this, the resolution is not quite as good as the build up. It's very hard for a horror film, especially one that plays on fear and the imagination, to deliver a conclusion that is suitably unsettling - this one half succeeds. But the ride is more than worth it and the ending is far from a failure.If you like horror, watch this.",The Autopsy of Jane Doe,3289956
6,pckq,just when you thought the genre had completely sold out...,9/10,20 December 2016,"Since wishi washi pseudo horror films ala insidious and co dominate the genre at the moment i never expect much when watching a new entry.And much to my surprise Jane Doe is a REAL horror film in finest John Carpenter b-movie tradition. Jane Doe starts out strong, builds atmosphere with genuinely creepy scenes and manages to keep its mystery and secrets just long enough to satisfy. Much of this is due to the moody music which probably made half the film!Sure there is the occasional i-already-know-whats-coming-next/ clichéd shock scene, but such sins are easily forgiven within seconds since the intense atmosphere of this film pulls the viewer back in mercilessly.If you appreciate classic oldschool flicks like John Carpenters 'The Fog', Jane Doe will not disappoint. Go see it!",The Autopsy of Jane Doe,3289956
7,spookyrat1,Initial Great Expectations Dissolve Into Dubious Unlikelihoods!,5/10,15 July 2020,"I have no hesitation in stating that the first half of The Autopsy of Jane Doe really did suck me in. The corpse of an unidentified young woman is found at the scene of a bloody multiple homicide, with no real clues to aid the local constabulary in solving the case. Local father and son coroners, played by Brian Cox and Emile Hirsch respectively are coopted by the town sheriff, to do an urgent autopsy on the corpse, so as to hopefully give the police some sort of lead to solve the murders.It's an intriguing set-up with 2 very experienced lead actors in Cox and Hirsch. Cox in particular is very convincing as a skilled small-town medical examiner, who we soon understand, won't be easily swayed from forensically seeking the truth behind mysterious deaths. Autopsy, though clearly not made on a huge budget, looks far superior in production standards to Norwegian director Andre Ovredal's earlier found footage films. It also boasts an excellent soundtrack and some realistic looking mortuary sets.But roughly at the half-way point of this compact story, things decidedly take a turn for the worst. Solving the mystery of Jane and the mysterious deaths, is relegated in importance, as we become immersed increasingly in a case of ""things going bang in the night"" and yes, zombies (of the non-flesh eating variety) suddenly appear, which are pretty common around the traps these days.From here on in, the narrative contrivances kick in, thick and fast to propel the story forwards. Tommy's and Austin's basement mortuary in their house, must be one of the few such facilities in the world that doesn't have a proper fire escape. It has an elevator, which we know won't work in a blackout and a weird spiral staircase to a trap door instead. Why? Because that might be needed later in the story. A supporting character is somehow able to gain access to the house and mortuary quite easily during a raging storm, when Tommy and Austin can't get out themselves. How? Don't even go there. All we find out is that ancient mumbo jumbo is able to control seemingly everything in the modern world; from the weather, to locks, telephone communications and even radio music programming.The second half of Autopsy is a real comedown. Tommy's and Austin's back stories, which aren't exactly deep anyway, we find have entirely no relevance to the final outcomes of the story and if viewers were waiting expectantly for an engrossing explanation to the first act discovery outlined above, I sincerely hope they are not holding their breaths. And then of course the final scenes leave open the possibility of a sequel, I don't think I'll want to see.I don't want to appear too down on The Autopsy of Jane Doe, but it just seems extra disappointing, when a very promising looking beginning, degenerates so swiftly into a second half of seen again morbid goings - on. I have to admit genuine surprise at the general high critical regard for this pretty average production.",The Autopsy of Jane Doe,3289956
8,fil-nik09,Quite good!,8/10,24 December 2016,"First of all, I will say that this is not really a horror film to me ( in its entirety) but rather the first half and bit more is kind of a thriller / suspense movie and the last 20 minutes is a mild horror.But even if it is a real horror ( as many would say - though maybe my definition of horror is rather narrow as I can not be scared easily) it does bring something new.This is why I am rating this as an eight!That new element to the horror is what makes it good: a beauty, a dead beauty that looks like a doll outside but hell inside... The inscriptions inside her body and skin is a very awesome detail. Maybe that is one thing that will stick with me when I think of the film ...The story is simple but appealing. The three actors + the girlfriend and the sheriff are all good. But really, all hail Jane Doe ( if it was a real person whole time).I recommend it!",The Autopsy of Jane Doe,3289956
9,Samirsbureau,Surpassed My Expectations !,8/10,20 December 2016,"After watching the trailer of this film i was just expecting another lazy cheesy horror film, and i knew it was a movie i'd skip. But after seeing some good reviews here and there about it, i thought i'd give it a try and watch it with an open mind.Turns out to be one of the best horror films to come out this year (Along with Lights Out, Under The Shadow and Don't Breathe)Just consider that this movie is not for the faint heart at all as it contains very graphic scenes that aren't suitable for everyone, but the title says it anyway it's an Autopsy.What I liked the most about this film is that it has everything horror fans would like to see in a movie, it has very disturbing scenes, top- notch suspense , good scares , an atmosphere that will suck you in and a creepy enough story that'll probably keep you up at night thinking about dead bodiesThe film starts slow with the horror but it never keeps you bored, it's always interesting and you always wanna know how things will go, and as you watch you'll notice it's getting weirder and weirder and then you'll feel so uncomfortable watching it until you reach the top speed of the horror and then it will come to an end.The ending could've been better (thought its a bit cheesy) but it hasn't ruined the experience for me, it's still a good watch for fans of the genre.Conclusion: If you're a true horror fan you can't miss this one, pretty sure it has many in it that will give you some good scares.",The Autopsy of Jane Doe,3289956
10,geraldohanna,The Autopsy of Jane Doe,7/10,20 December 2016,"After the police discover a corpse in a shallow grave, they take it to father-and-son coroners Austin and Tommy Tilden. During their invasive examination, the duo comes into realization that they are dealing with something supernatural.The Autopsy of Jane Doe - Was a visual treat to enjoy. I think if you are a fan of well paced films you will enjoy this one. Although it's being treated as a horror film - Which is not a problem unless you generalize this as the overall genre for this movie - Its more of a Suspense Thriller/Drama/Horror. This is not something I feel needs to be clarified, but understood as the film envelops all three entities.Emile Hirsch and Brian Cox are excellent as father-and-son coroners Austin and Tommy Tilden. One particular moment in the film allows the actors to reflect and truly shine in their respected roles.André Øvredal (Trollhunter) directs this close quartered film with limited room for our actors to breathe once the tension unfolds - He makes great use of this tension by placing the camera in dark areas allowing us to truly feel the weight of the actors.Screenwriters Ian Goldberg and Richard Naing craft a smart and well paced story with a few false scares, and flat third act leaving us yearning for more.Overall, this is a movie that deserves and requires your time :)",The Autopsy of Jane Doe,3289956
11,cattis26,Family Business,9/10,10 November 2016,"Saw this at the Night Visions festival in Helsinki, November 2016. What I expected was a lighthearted, ""father and son as morticians"" kind of movie. What I got was a movie that chilled even my horror movie veteran soul to the bone. To explain too much about this movie would spoil it, so I will not go into details. But the director succeeds wonderfully in first creating a comfortable atmosphere, introducing a small cast of characters and setting the scene, and then masterfully starts upping the discomfort levels of the situation, until you are sitting at the edge of your seat, biting your nails. Like in Øvredal's former movie, Troll Hunter, what you cannot see can be a million times more disconcerting than what is in plain sight. Although here he uses both.. Great characters, great atmosphere, an overall great experience. Even if at times I wished for it to end already, just because I couldn't quite bear all the anxiety. I hope this comes to Finland proper, so others can see it too! Quite possibly the best horror film I have seen this year.",The Autopsy of Jane Doe,3289956
12,mark-179-360743,Unexpected Gem,8/10,20 December 2016,"I've not seen an original horror this well done for a long time. The cast is strong, dialogue and acting good, the story is interesting, well paced and well directed.If you didn't know better, you may think after the first third of the film that you were watching a forensic crime, and would be quite happy to continue watching in that vein. Instead, an unsettling, atmospheric, claustrophobic tale of magic, sacrifice and revenge unfolds, which I was more than happy with. The direction is outstanding, your imagination does a lot of the work and the budget is saved for some very well done major scenes (and of course, quality actors - unfortunately rare in horror these days). Whereas it would have been wonderful to tie up the loose ends, see a bit about the Witch Trials history, give Hirsch and Cox a bit more to go on earlier in the film etc. With that said, it may have removed something from the very polished whole, and in all likelihood will yield a - well deserved - sequel. Jane Doe sure as Hell hasn't finished yet!It's got that ""Sinister"" vibe about it, and is certainly one of the best horror releases of the year. I challenge anyone to watch this and not feel impressed, satisfied and maybe just a little bit scared.",The Autopsy of Jane Doe,3289956
13,ramblingvagabond,Was hoping for so much more,5/10,21 May 2020,"I waited years for this to be on a streaming service so I could finally watch it. I looked forward to it as something new and original. But after watching it, I was disappointed.It started out great, a mystery that turns into a horror. That's the best way to evolve a horror movie. But then when the end started revealing itself, it was nothing more than your average, B rated cheesy horror flick. The final end was what we've come to expect from every single low-grade horror movie made in the last 30 years. It could have been great. But it was mediocre.",The Autopsy of Jane Doe,3289956
14,mathieu_felten,Excellent mix of mystery and horror,7/10,2 January 2017,"Without spoiling this movie, let me sum up my impression after I just finished watching ""The Autopsy Of Jane Doe"". I went out without seeing the trailer, so I thought it was a police/detective movie at first.But it didn't take long for us to realize it was a horror movie. Acting : excellent. Bryan Cox and Emile Hirsh play a very believable pair of father-son, working at the family morgue. Story : very different from the usual horror movies. I appreciated it, as I grew tired of the same ghosts, zombie, vampire stories.Directing : smart use of the shadows without being excessive. I highly recommend it.",The Autopsy of Jane Doe,3289956
15,wycherleyp-960-470658,Genuine terror,8/10,30 March 2017,"One of the best and most original thriller/horror films for a long long time.A farther and son who are both coroners have a unidentified body turn up at there morgue, the unidentified female was found at a mass murder scene by a local sheriff. The sheriff tells them he needs to know what happened to her by the end of the night so they get to work.With strange things that start to happen during the girls autopsy who has been labeled as Jane Doe this film develops into a horror mystery so much so you can't take your eyes off the screen.Brian Cox is excellent as well is Emile Hirsch, the autopsy of Jane Doe is how a film is meant to be made not some rubbish found footage but genuine real tension and horror. Quite possibly one of the best films out this year.",The Autopsy of Jane Doe,3289956
16,a_kick_en_los_huevos,A brilliant premise tackled by the visionary director of Trollhunter,7/10,4 August 2017,"The title and poster of the movie give a creepy and uneasy feeling to the prospective watcher, and the same creepy atmosphere is wonderfully evident from the start of this well-executed, well-acted offering from the Norwegian director who gave us the thoroughly underrated Trollhunter. This time, he opted for conventional filmmaking instead of the found-footage style he so deftly utilized in Trollhunter, giving us time to take in the brilliantly directed scenes which immediately thrusts the audience into the unsettling premise of a Jane Doe being autopsied by a father-and-son coroner duo. The dialogue between the leads in the beginning build character almost instantaneously, and they feel real from the get-go. Compared to the recent trend of horror movies eschewing character development for cardboard cutout jump-scare fuel, this movie comes as a nice and refreshing, almost surprising, change of pace. The father and the son have contrasting personalities regarding their approach to autopsies. I expected this brilliancy in dialogue and character development to carry the whole movie - and it immediately increased my expectations of the movie; I fully expected this to be an underrated horror gem of 2016.Alas, however, half-way through the movie the director's Conjuring-esque influences seemed to show through the cracks. Though not devolving straight into jump-scare territory, the movie dips its feet into schlock scares now and then, which has a very infuriating effect on the viewer who, until now, has been amazed by the movie's restraint. The character development also suffers, with some actions by the leads contradicting their motivations.However, the concept and execution need to be commended. The actors Brian Cox and Emile Hirsch do well to sell the dread and claustrophobia experienced by the characters. Special mention to Olwen Kelly, who gives possibly the best performance of the movie, despite having no lines, no action (she plays the corpse). Definitely one of the highlights of the movie was the synergy between the camera-work and the actress's facial expressions which do more to put the viewer at unease than minute-long scenes of staring into the darkness, fully knowing the movie is going to go for that cheap jump-scare. That being said, I would say the script was the weakest aspect of the movie, the ending just leaves you wanting a little bit more, and slightly disappointed. Nevertheless, the movie does its job of selling you the premise and executing it well enough to leave you unsettled for a few days.All in all, I would call this movie as a mixed bag, though I would give it a glowing recommendation as it is head and shoulders above the spate of incomprehensible scare-fests being offered by Hollywood these days. Great work, André Øvredal.Be sure to check out Trollhunter by the same director. Although not a horror film, it merges the found-footage genre with goofy mythical creatures to amazingly hilarious yet epic results.",The Autopsy of Jane Doe,3289956
