,User_name,Review title,Review Rating,Review date,Review_body,Movie_name,movie_id
69,I_Ailurophile,"Outstanding, smart, and genuinely hair-raising",10/10,16 September 2022,"I absolutely love 2010's 'Trollhunter'; I don't think it's unreasonable to say it's one of the very best examples of the found footage genre. I was already prepared to watch this based on a trusted recommendation, but to learn that 'Trollhunter' director Andre Ovredal was also behind 'The autopsy of Jane Doe' was a great boon. A key piece of dialogue at the close of the opening scene heralds strong promise for the story to come, and off we go. I had high expectations in the first place, and I can safely say that still this far exceeded them: it's wonderfully creepy, exquisitely well made, and altogether phenomenal.Between excellent production values, fine care for lighting, and Roman Osin's deft cinematography, the very image before us is lush and enticing, a notable contrast to the blood, gore, and other gnarly visuals. Substantial detailed attention is given to the arrangement of every shot and scene - basic set design and decoration, props and effects, costume design, sound effects, the autopsy, and of course the nastier business. That detail also extends to the screenplay of Ian Goldberg and Richard Naing, constructed with marvelous intelligence and deliberation. The active plot is relatively straightforward, but the background Tommy and Austin gradually discern of Jane Doe is deviously splendid. More than that, the film begins so simply, yet tension and unease builds and accumulates bit by bit until it's almost unbearable. That dark air is only amplified by the original score of Danny Bensi and Saunder Jurriaansis, exceptional and searing as it complements each unforgettable scene and bolsters the spine-tingling disquiet.Emile Hirsch and Brian Cox are both very well established players, and their acting here is as solid as one would assume. Yet Olwen Kelly is, surprisingly, a swell anchor for the feature. Performance art is as much about controlling expression as it is about pretending and emoting, and as the filmmaker himself has accordingly remarked, one can recognize the importance of having a real person in a scene and not just a fabricated representation of one. As such, Kelly's central role as Jane Doe is peculiarly fascinating - steady as a rock and unchanging, yes, but one can well imagine how difficult it is to be so completely still and stoic. Hats off to her and her co-stars for jobs well done.The end result of all this is tremendous. With a few keys aspects especially significant (sound and visual effects, blood and gore, editing, tight writing and direction), 'Autopsy' very handily crafts a movie with a superb, adept sense of dynamics that's critical to its success. From inconspicuous early scenes flows an unfaltering, mindful progression of more and more earnestly chilling sequences, a measured trickle that becomes a roaring river as the horror escalates. As much fun as the genre can be, there aren't necessarily all that many titles that can evoke major, memorable, visceral reactions, but mark this as one of them. At any given point the suspense and anticipation is as breathtaking as the smart payoff; whether one strictly agrees with broad high opinion of the feature or not, the hard work that went into it is undeniable, and I think the effort paid out handsomely.For my money this is surely among the best horror flicks of recent years, or putting aside such definitive language, it's unquestionably a sharp, fantastic thrill ride. Whether one is a casual fan or an aficionado, anyone with an interest in the genre needs to add this to their watch list. 'The autopsy of Jane Doe' is a masterful slice of supernatural horror, and is well worth your time no matter how you have to go about it.",The Autopsy of Jane Doe,3289956
70,trelinaporca,Meh,4/10,12 August 2017,"In the beginning I was surprised because the movie sounded very unique (at least I have never seen any horror movie that develops from the autopsy of q victims corpse) which I thought was hard for an horror movie as the genre feels like a broken record. However I was very disappointed at how it was all wrapped up, it's kind of lazy to wrap it up with witchcraft and call it a day. They had an original concept in my eyes, wouldn't be hard to make a crime scene reconstitution or something of the sort to make it more interesting. Also, the whole family story and cat thing seem very random and unnecessary to me, if it was to explain the fact that he volunteered to suffer for his son, well, the fact he is his son pretty much explains it, so the time spend trying to give the characters some dept wasn't used wisely.",The Autopsy of Jane Doe,3289956
71,bregund,Let's count the cliches,4/10,5 January 2019,"Flickering lights, a radio that changes stations by itself, a huge storm, looking at old books (which just happen to be on hand containing the exact information they need) to research whatever supernatural event is occurring, a beloved pet that dies, a secondary character showing up to scare one of the main characters, an elevator in perfect working condition becomes intermittently inoperable, cell phones don't work, the electricity goes out, it goes on and on like this, every horror film cliche you can think of gets attached to the next one in the chain. What happened to all the corpses that were walking around? Why is there no stairway in the house, presumably the morgue is inspected by some state agency, they would insist on safety regulations, ergo where is the stairway? Why bring only the girl's body to the morgue, don't the other victims deserve autopsies? Netflix should really dial back on their automatic five-star ratings of brainless, stupid, made-for-tv-quality films. It's quality, Netflix, not quantity.",The Autopsy of Jane Doe,3289956
72,Thanos_Alfie,The autopsy...,6/10,14 June 2020,"""The Autopsy of Jane Doe"" is a Mystery - Horror movie in which we watch a father and son doing an autopsy of a young woman but when they start, strange things start happening.I liked this movie because it was very interesting and scary as a decent horror movie has to be. The direction which was made by André Øvredal was very good and he presented very well the whole story behind the main characters and also he explained the story plot without leaving any doubt or creating any plot holes. Regarding the interpretations, Brian Cox who played as Tommy was for one more time very good and in combination with the very good interpretation made by Emile Hirsch who played as Austin, made this movie very interesting. I highly recommend everyone to watch this movie because it has a well-written script, interesting plot and some very good interpretations.
                
                    1 out of 1 found this helpful.
                        
                            Was this review helpful?  Sign in to vote.
                        
                        
                    Permalink",The Autopsy of Jane Doe,3289956
73,rmax304823,Witches -- Forgotten But Not Gone.,5/10,22 November 2017,"I was kind of hoping for a mystery. Okay. An autopsy. I expected the coroner or pathologist to uncover indication that the death was not was it seemed and this would lead to a policier in which the mystery of Jane Doe's death was unraveled and a villain manacled. Instead I got a zombie movie.The first hour or so is fine. The body of Jane Doe is brought in and the police officer says they need a cause of death by tomorrow. Brian Cox -- a good actor -- and Emile Hirsch play father and son coroners who aren't disturbed by chopping up and sawing at human remains. The autopsy shown is reasonably accurate. Cox does a decent job and follows the usual pattern, though he doesn't sniff the stomach contents, which is part of the ritual -- a ritual I'd be happy enough to ignore. In the autopsy I viewed, the face of the corpse was covered by a cloth, removing some of his humanity. I'm glad they didn't cover up Jane Doe's face. She's played by Olwen Kelly -- if ""played"" is the right word. She neither moves nor utters a sound. She makes an awfully good impression without them.Hirsch begins to suspect something is up when they begin extracting various exotic objects from the stomach -- Jimson weed (a hallucinogen), some kind of odd scroll, and on to other signs that this is a most unusual cadaver. In fact, it's not quite a cadaver yet, and whatever it is, it's highly miffed at the two guys whacking away at it, so PO'd that it causes all sorts of things to happen that logic is left behind in the dust -- or the peat, in this instance.There's a terrific thunderstorm, the radio sizzles for a moment and begins to play a song call ""Let the Sun Shine"" or something. The lights go out. Flashlights appear. The doors are locked and the elevator doesn't work. So father and son are locked in a morgue with a corpse that's animating the spirit world. It's a rather large morgue with a maze of hallways. The men are trying to escape the menace by hiding in the elevator with an ax. A figure approaches in the darkness and the flickering light reveals a decomposing old lady. The terrified Cox hacks it with a fire ax. It turns out to be Hirsch's girl friend, who expires bloodily on the floor.How Ophelia Lovibond managed to get into the morgue when all the doors were locked and the men couldn't leave, and why she approached silently and menacingly in the darkness without shouting a greeting is -- well, it's positively mystifying. So are a lot of other things -- doors opening and closing by themselves, voices from outside imitating the police, and the dead cat. So, after all this Schweinerei, do the guys manage to destroy the witch or at least appease the corpse? Nope. They both die, and the police, wanting to get rid of this odd body, have it shipped far away for burial somewhere else.I just got a whiff of a perfume whose base is cadaverine. Yes. I think I recognize it. It's called ""The Autopsy of Jane Doe II.""",The Autopsy of Jane Doe,3289956
74,DrCCat,Autopsy of Chliches,1/10,10 July 2020,"I went into this movie expecting a horror/serial killer/crime type of movie, but in reality it's lame super natural cringe fest. So as the movie marches it turns out to be an angry ghost is angry movie, packed with cliches.Once the protagonists cut into Jane Doe, she starts mercing people who hurt her corpse. No warning signs or hints of don't hurt my body or else. Foreshadowing is never established. Even the Egyptian Mummies had warnings.Cliche 1: pointless animal mutilation
She kills the family cat for....reasons. Why? The cat didn't hurt her. Killing of animals in a horror movie for shock value is over done and trite. Maybe the witch is a dog person? It severs no purpose other then to piss of animal lovers.Cliche 2: jump scares
When they give us our 1st jump scare (with the girlfriend) the audience is expecting it & becomes predictable and obvious. You can even set your watch to it.Cliche 3: unstoppable boo ghost
If everything the protagonists attempt end in failure, what's the point? They try to burn the corpse & even appease the ghost which all fail because she kills everyone anyway. Not to mention the ghost's powers seem to have no limit and she gains extra powers when called for by the script.Cliche 4: old switcheroo
The guy kills his g/f because the ghost girl switches a zombie with his girlfriend. How did the g/f get inside the room? There were only 2 entrances, the elevator which the protagonists were in, and heavy doors that were blocked by the fallen tree. Even the radio reports that roads will be impassable due to heavy rains.With all those factors, the g/f is Lizzie Bordened to death because the guy and audience believe that she was grandma stitch face who was chasing them earlier.Cliche 5: plot armor
Early in the movie we discover that smoke inhalation is a thing. Later on, Boo ghost Jane throws a light switch rave complete with smoke machine & blinky lights, but no dubstep. She accomplishes this by turning on the incinerator & filling the hallway with smoke, yet another power she somehow manifests. The protagonists walk through the smoke with no problem, except for a jump scare to contend with. No cough, blurry vision, dizziness...just another minor inconvenience.Conclusion: Discount Blair Witch is pissed off at the world & looking to get revenge on people that weren't alive when she tortured, like the movie audience. It would have been interesting if the protagonists were descendants from Salam witch judges, but this never explored.",The Autopsy of Jane Doe,3289956
75,KineticSeoul,Creepy B movie that carries some elements from Japanese horror,6/10,16 January 2017,"When I started this movie up, I was expecting another exploitation movie. Kind of like ""Deadgirl"" (2008) with a lot of nudity and sexual tones that leans towards it being controversial. But to my surprise this was more horror and supernatural over it being focused more on exploitation. Sure, there is a unidentified dead girl and she is nude most of the way through. But it didn't seem to exploit the actress with it constantly focusing on sexual aspects of it. As a matter of fact this was like watching a B movie with the vibe being similar to Japanese horror. I wouldn't have been surprised if this was done by a Japanese director. Because it sure seemed to have been inspired by Asian horror movies. So the story is about a father who is a cynical coroner and his son who is his assistant. That work with investigations through autopsies to figure out how some people might have died. And they are professional about their job but bizarre and strange things start to happen when they start to perform an autopsy on a unidentified girl. The actress did a professional job, it must not have been easy pretending to be dead for long hour while being nude. What stood out about the characters is how the father is very cynical about everything, even when strange subtle things starts to pop up. So he is dismissive about every weird occurrences until things start to escalate. The horror elements isn't anything all that new, but the atmosphere is shot very well and the setting is grimy and gruesome looking. The stench of dead bodies seemed like was coming out of the screen. Even the music was creepy as hell, especially when it came to the songs from the radio. It sounded like it was something out of the ""Silent Hill"" video games. Like one of those happy go lucky songs that sounds very creepy while having that happy tone to it. Overall, this is a okay movie if you are in the mood for a alright horror flick.6/10",The Autopsy of Jane Doe,3289956
76,THE-BEACON-OF-MOVIES-RAFA,UK ( A+ Movie) My Ratings 9/10,10/10,2 September 2023,"RESERVED FOR HORROR FANSI admired the mix of the very different topics of horror mixed here: The world of autopsies and the world of witches. Excellent movie in less than 90 minutes. Very good watch. It's rare to find a unique horror film nowadays, but this film sets itself apart from an otherwise tired genre. For the most part, it's difficult to see what comes next, it's difficult to distinguish what is real and what is not, and it kept me interested from beginning to end. If you're a horror fan, I strongly recommend giving this a watch. Incredibly scary and well done, highly recommend. Great story mystery!",The Autopsy of Jane Doe,3289956
77,danielmanson,It's almost a great film,5/10,19 January 2019,"As you can tell by the title, this film had such potential to be fantastic and for the first half it really was. I was constantly sat on the edge of my seat nervous, yet intrigued to know what will happen. The plot and the great acting really draws you in.And then the 2nd half of this film just completely let itself down.
Full of horror cliches (looking into a hole and someone appearing) etc. Certain death scenes are just so pointless to the cause. Someone dies, they mourn for about 0.3 seconds then it's back to normal again. The entire ending just felt overly rushed and forced out. Like I said, there was so many different avenues to go down for the ending and this should not have been one of them. Very poor execution.Is it worth watching? Maybe, if you are running out of horror/thrillers to watch then stick it on. Like I said it's definitely not classed as a poor film, it is just massively let down by the second half of the film.",The Autopsy of Jane Doe,3289956
78,Gigantoscula,One of the better ones,8/10,5 June 2018,"The movie is good. However, i must place a disclaimer here, you need guts to watch this until the end, speaking of which, there are a lot in this movie.
I didn't feel bored throughout all of it, the pace was nice and the scares were not only made from cliches like suddenly appearing thing in your face. Mostly the tension gave me the fells and it did a very good job. I liked the symmetry of the beginning of the movie and the ending of it. The ""Jane Doe"" gets 'transferred"" to the next victim, similarly to another horror movie ""It follows"".
8/10 with a huge recommendation for enthusiasts of this genre",The Autopsy of Jane Doe,3289956
79,bryank-04844,Give me an 'Autopsy of Jane Doe'!,8/10,23 January 2017,"I'm always a sucker for pretty much any horror movie. Rarely though, horror films tend to stick in my mind long after viewing that have a lingering haunting effect that will cause me to sweat or choose not to walk down a dark hallway. I'm happy to say that the fresh and original horror film 'The Autopsy of Jane Doe' will terrify me for the coming weeks. Directed by André Øvredal (Trollhunter), and starring Emile Hirsch and Brian Cox, this horror masterpiece goes down some dark alleys while a father and son try to reconnect after a death in the family.Set inside a family owned morgue and autopsy center lab, father and son Tony and Austin Tilden (Cox and Hirsch respectively) tend to the recently deceased bodies in their seemingly small town. The local police officer brings a new body of a young woman down to the morgue late in the night that causes Tony and Austin to stay after hours and find out the C.O.D. or cause of death for this dead young woman. They soon find out that there are no marks on her body or evidence that she is actually dead.After cutting her open and inspecting her insides further, a sinister presence enters the picture into some truly terrifying clues as to just what's setting off the strange things that happen to Austin and Tony. Underlying the horror of it all is the relationship between father and son, as they both try to cope with moving on from a close one's death. André Øvredal has perfectly crafted his camera to pick up every nuance of horror around every corner here, whether it be a being lurking around the corner, footsteps behind a door, or some fleshy gore – it all looks phenomenal and scary-as-hell.Hirsch and Cox turn in excellent performances too that allows you to bond with this father and son instantly with their charm and pranks. There is a genuine love between the two throughout the movie, which makes it more difficult to see them go through what the end up being in the middle of. 'The Autopsy of Jane Doe' is one horror film that will last forever and scare the hell out of you.HIGHLY RECOMMENDED!",The Autopsy of Jane Doe,3289956
80,youngcollind,Intriguing set up leads to somewhat typical ends,7/10,29 December 2021,"For as common as it for a horror movie to end up at morgue at some point, I don't believe there are many that play out exclusively at one. This is an interesting backdrop for sure. At first, it makes you consider the strange reality that this is a totally normal vocation for millions of people. Kinda like an extended cut of that inevitable sequence in every SCI, they treat the onscreen gore with such clinical coldness that it almost becomes palatable, though it will no doubt still leave many quite squeamish. Then when things take a turn towards the spooky, they've already established an incredibly creepy place for horror to unfold.For much of it's run-time, the film admirably opts for a less is more aesthetic, letting the creeks and shadows in the eerie setting speak for themselves. As the scare factor heats up, a couple horror clichés seep in. A jump scare here, an evil creature slowly coming towards you there. It's not reinventing the wheel, but the build up did need a payoff, so they were sort of painted into a corner. The production value and performances are all on point though, so it successfully delivers on it's intentions, even though they often border on being somewhat run of the mill.",The Autopsy of Jane Doe,3289956
81,hakobyanhakob81,"Scary, gory and original!",10/10,1 May 2017,"Surprising how some horror movies have their ways of boosting spirits with their precision. Autopsy of Jane Doe starts off pretty effectively and promising. From the main titles, it's obvious the film is very neatly edited and puts the sound to good use. It's richly colored with smooth beautiful photography, fast-paced and subtle. You can clearly feel the passion of the crew behind it. On 33rd minute into the film, I must say I haven't been this thrilled for quite some time. Having me on the edge of the seat, it delivers more and more surprises by every minute. A non-stop suspense, very well combined with gore and scares. In addition, the film doesn't much rely on jump scares, making it even more original, but the atmosphere and the plot are pretty spooky. I'm loving it! I just wish it was a bit longer. I would love to see what happens next. Needless to say a sequel would be nice. Absolutely fabulous! See this movie!
                
                    6 out of 11 found this helpful.
                        
                            Was this review helpful?  Sign in to vote.
                        
                        
                    Permalink",The Autopsy of Jane Doe,3289956
82,detroiters,Worthless,2/10,12 May 2020,"I thought two big well-known actors in a movie I never thought these two would ever be in surprised me but the ratings were so good I watched it and the first 30 minutes were pretty cool in the last hour was unbelievably stupid it's just another worthless dumb horror movie
                
                    12 out of 22 found this helpful.
                        
                            Was this review helpful?  Sign in to vote.
                        
                        
                    Permalink",The Autopsy of Jane Doe,3289956
83,phenomynouss,mostly positive,8/10,17 December 2017,"It had a great concept and kept a low, creeping profile, focusing the majority of the film on an autopsy on a body that is disturbingly well preserved, while internally is a disgusting horrifying wreck.
I feel that the creepiness of the body being clearly abnormal in a potentially sci-fi/supernatural sort of way could've carried the film on its own, but the genre it chose (Horror) would demand more action and terror on top of that, so there are horror sequences with occasional jump scares and implication of haunting.the revelation at the end seems to me to be something that might be controversial, with some viewers thinking it incredibly stupid or awesome. Personally I thought it could've used just a bit more insight, but at the same time realizing that too much exposition or fixating on the reveal might ruin it.
without spoiling, the ending was a significant let down compared to the rest of the film, but it wasn't enough to sink the film, making it definitely worth viewing",The Autopsy of Jane Doe,3289956
84,jdring2007,"gripping first watch; great premise, suspense, and acting; a bit over the top on music",8/10,17 January 2022,"My first time watching this, it really blew me away. And at the same time, had me at the edge of my seat - at other times, sinking into it. Most of the jump scares got me, hard, and even by my third watch a couple still did, or at the very least sent chills through me. The movie absolutely achieves an uncanny level of eerieness, suspense, and mystery. Well, the mystery of Jane's history seemed predictable to me, yet I was thrilled to see my beliefs come together when the reality is revealed, but even still, it has some entertaining twists which caught me off guard. The effects department did their job to a T, as did Olwen Catherine Kelly, who portrayed Jane, her cadaverous inactivity disturbingly realistic. Brian Cox is excellent as always, and Emile Hirsch who I've always loved was superb in this. A prequel or sequel, in the right hands, would be awesome My only gripe is the music, which is gratuitously loud at times, intermittent and often cutting into quieter dialogue. A small complaint pacified by having subtitles on and dumbing the master volume, but nonetheless worth mentioning. Overall a cleverly written and filmed, claustrophobic horror flick.",The Autopsy of Jane Doe,3289956
