,User_name,Review title,Review Rating,Review date,Review_body,Movie_name,movie_id
20,zardoz-13,"Pathetic Compared to Spielberg's ""Jurassic Park"" Entries",2/10,22 June 2015,"""Safety Not Guaranteed"" director Colin Trevorrow's summer blockbuster ""Jurassic World"" surpasses director Joe Johnston's lackluster ""Jurassic Park 3"" (2001). Comparatively, Steven Spielberg's infinitely superior ""Jurassic Park"" (1993) covered most of what transpires in Trevorrow's new the monster-run-amok-in-a-theme-park movie. Despite its attractive cast and scenic jungle locations, ""Jurassic World"" delivers considerably less suspense in its standard-issue shenanigans about juveniles in jeopardy. If you haven't seen the first and second entries in the ""Jurassic Park"" trilogy, this franchise reboot with its polished production values and robust 3-D might amaze you, especially if you're sixteen years old or younger. Size is the primary factor ""Jurassic World"" contends with, and Trevorrow shrewdly addresses this liability during the first half-hour. The female protagonist who manages the dinosaur park concedes, ""No one's impressed by a dinosaur anymore. They need to be bigger, louder and with more teeth!"" Indeed, the new hybrid dinosaur that a fiendish scientist has concocted represents a leap forward. Nevertheless, this 50 feet long and 18 feet high monster doesn't really emerge as that monstrous. The Indominus rex in ""Jurassic World"" could serve as ""Godzilla's"" seeing-eye dog. Moreover, ""Jurassic World"" appears to have been designed to sell plastic toy dinosaurs. The dinos themselves display a clean-scrubbed, laminated look. When the franchise first rampaged across screens with ""Jurassic Park"" (1993) and its sequel ""Jurassic Park: The Lost World"" (1997), nothing looked either more realistic or intimidating than those truculent dinosaurs, especially the Raptors. Unfortunately, the time when ""Jurassic Park"" set new benchmarks for CGI is long past. The people who made ""Jurassic World"" must have ignored Peter Jackson's ""King Kong"" (2005) as well as ""Godzilla"" (2014). In an arena with either of those, the welterweight Indominus rex in ""Jurassic World"" wouldn't last a minute. Meantime, scenarists Rick Jaffa &Amanda Silver, who did such a praiseworthy job with ""Dawn of the Planet of the Apes"" and ""Rise of the Planet of the Apes,"" along with writer Rick Connolly, and Trevorrow, have drummed-up a 'so-so sauraus' saga. The logistics of the plot don't hold up to scrutiny and the action is outlandish. Worse, the scripters have contrived one-dimensional characters who often behave idiotically in formulaic predicaments. For example, Bryce Dallas Howard, who was such a revelation as a villainess in ""The Help,"" spends her entire time charging around in high heels either in the jungle or on asphalt! Chris Pratt plays a former Navy troubleshooter who doesn't have a lick of sense. He totes around a modern .45-70 lever-action carbine reminiscent of Buffalo Bill, when he should be armed with something more substantial, like a Kalashnikov AK-101 assault rifle with 40mm GP-30 under-the-barrel grenade launcher. One Jurassic World security trooper wields a powerful M136 AT4, a Swedish-made single-shot 84mm unguided light anti-tank recoilless rocket launcher. He takes aim with this fearsome weapon at the genetically modified dinosaur. Naturally, like all myopic, action movie villains, none of these expendable troopers can hit the broad side of a barn, much less a gigantic, galloping dinosaur! Meantime, since the dinosaurs have neither slippery lawyers nor treacherous laboratory employees to gobble, the writers have substituted a different villain, a security specialist who dreams about adapting these carnivorous Raptors for real world combat against terrorists. Not surprisingly, everything about this lightweight, family-oriented, PG-13 rated epic is immaculate. Bloodshed is restricted to a drop or two of runny ketchup. Sure, you see the dinosaurs munch on many adults, but the two imperiled children suffer no broken legs, no sprained ankles, or lose any limbs. Specifically, anonymous bystanders are the only ones that are crunched, scratched, or traumatized. So forget about suspense and tension.Over twenty years ago, in the original ""Jurassic Park"" (1993) based on Michael Crichton's bestseller, genial billionaire John Hammond (Richard Attenborough) fantasized about opening a dinosaur park on a remote island near Costa Rica. Initially, everything went fine, but then some predatory velociraptors and a cantankerous Tyrannosaurus rex ruined it for everybody. Now, twenty years later, Indian billionaire Simon Masrani (Irfan Khan of ""Life of Pi"") has taken over Jurassic Park as the new owner, and he has committed himself whole-heartedly to perpetuating Hammond's dream. He wants both the dinosaurs to enjoy quality of life while the visitors to have a blast. Conversely, Masrani's workaholic chief of operations, Claire (Bryce Dallas Howard of ""The Help""), struggles to maintain that profit margin. This means the Park must constantly add new attractions because new attractions spike attendance. When fiendish but taciturn scientist, Dr. Henry Wu (B.D. Wong of ""Focus""), devises a new dinosaur, he refuses to share his secret formula with Masrani and Claire. Predictably, chaos ensues with disastrous results. The Indominus rex is smarter than the average dinosaur, and this creature fools everybody, including the impertinent but heroic Owen Grady (Chris Pratt of ""Guardians of the Galaxy""), who struggles to train a quartet of beady-eyed Velociraptors. Using prehistoric lizards like bloodhounds is preposterous but amusing, and the bond Grady develops with these overgrown kangaroo-like predators is unconvincing. Eventually, Grady pursues the Indominus with them, while the Indominus kills on other dinosaurs and crashes into the park's pterosaur aviary to free flocks of their airborne predators.Before he helmed ""Jurassic World,"" Colin Trevorrow directed some Internet shorts, a made-for-TV movie, and a superb little 2012 indie flick entitled ""Safety Not Guaranteed"" with Mark Duplass. ""Safety Not Guaranteed"" was an amiable character-driven comedy of errors. In ""Safety Not Guaranteed,"" a couple of journalists investigated a crackpot who has published a newspaper ad soliciting partners to accompany him on a trip back in time. These time travel candidates are advised to bring their own weapons. Reportedly, movie mogul Steven Spielberg liked Trevorrow's film enough to sign him up to direct ""Jurassic World."" If you're a parent, ""Jurassic World"" serves not only as ideal entertainment for kids, but also a great way to interest them in dinosaur memorabilia. Otherwise, as far as adults are concerned, the pedestrian ""Jurassic World"" exemplifies a case of suspense not guaranteed.""",Jurassic World,369610
21,TheOneThatYouWanted,Entertaining and awesome.,8/10,1 May 2016,"I just got done watching Jurassic World for the second time. The first time I watched it was last year when it first came out and I loved it. And upon viewing it a second time, I still love it. It has great action, characters, dinosaurs and more or less a smart plot. Let us not kid ourselves, we all watched it for the dinosaurs and the action; and that is all fine and good. But people complain about the movie not being as deep and thought provoking as the original film. To those people I say, go back and watch the original movie. Think about it, if they remade this to mirror the original film then it would be boring. Sure, the film does match the original film but it is very much its own movie. Basically, those hating on the film are trying to hate it. The rest of us are just enjoying the show. It isn't rocket science, so just shut up and enjoy the ride.",Jurassic World,369610
22,PedroPires90,"Great reboot, great film",8/10,10 June 2022,"I love this one even more than I thought. I loved to see that park alive for the first time, I loved to see so many action scenes, I loved to see so many monstrous scenes with big combate scenes and I really like the main cast (yeah, don't care a bit about what Pratt does on his private life), with jokes in the right place and an almost perfect combination of serious stuff and camp scenes.It's the best JP sequel and a fantastic reboot. Missed just a bit of that directorial perfection (Spielberg can create engaging scenes and use the sets like no other) and the teenager was well annoying, but love all the horror scenes. All those people being attacked and eaten alive? Perfect!!
                
                    3 out of 3 found this helpful.
                        
                            Was this review helpful?  Sign in to vote.
                        
                        
                    Permalink",Jurassic World,369610
23,oscaralbert,This fourth installment of the JURASSIC PURGE series . . .,8/10,17 June 2015,". . . could not be timed better. Russia has proved that if a country has a yearning for another peninsula, it can just snatch the one of its choice and no one else will do anything. Therefore, if you read between the lines, JURASSIC WORLD is suggesting that America and\or its multinational billionaires should latch onto an island few people would miss, such as Costa Rica or Hawaii. Step Two would be reviving new and improved dinosaurs through gene-splicing. (This is NOT far-fetched. Today's frequent deconstruction of robed people roaming the streets of yesteryear by means of drone-fired ""Hellfire"" missiles--as in the current flick GOOD KILL--is far scarier than the most frightening UFO flicks of a few years ago.) Finally, as this movie states, ""No one's impressed with dinosaurs anymore."" But JURASSIC WORLD shows us that the average T-Rex must eat 30 or 40 people daily to survive. Since China and India each have a billion folks to spare, plus umpteen millions of excess Americans, soon we can expect an internet gold mine to be in operation live-streaming the daily arrival of 20,000 ""Guests"" for feeding time on a real JURASSIC WORLD island.",Jurassic World,369610
24,genebathurst,The franchise has had a lobotomy,4/10,30 March 2019,"Dinosaurs. Amusement Park. Tourists. Disaster.Jurassic World has them all.Naturally, I had to see it.The beginning holds much promise, and it gets your hopes up for the disaster to come. When it does, there are some great action sequences, especially ones with the glass ball containing the soft, chewy child centre.Unfortunately the final act unravels into outright farce.Chris Pratt is great as the affable yet bad-ass Raptor Whisperer. He's got an easy going charisma that could easily carry an iconic character like Indiana Jones.Bryce Dallas Howard plays Claire Dearing, the uptight park manager, who initially clashes with the laid back Owen. Of course you know where the tension goes.The film tries to flesh out Claire's character by throwing in her two nephews (someone and another kid), who do double duty as McGuffins.Vincent D'Onofrio shows up as Hoskins, a villainous representative of the military-industrial complex angling to weaponize velociraptors. He's all sneers and scenery chewing, so obviously evil he's got a goatee. D'Onofrio does it well but the evil plan he's been saddled with by the writers makes no sense at all.The director, Colin Trevorrow, said in interviews that he wanted the dinosaurs to act like real animals, not cartoon monsters. Quelle surprise! I had no idea, as he has well-fed winged dinos (or near enough to dinos) go on a crazed orgy of violence against hapless tourists. Why? Because cool action sequence!One poor soul is even treated to the most outlandishly elongated death sequence I've ever seen, all to no end. It didn't justify anything, paid nothing back, offered no comeuppance. It was just gleeful indulgence in sadistic torture of a minor character. It was an Itchy & Scratchy moment.Which brings us to the final act: turn off your brain before it begins.The first movie proved you could have a smart script and dinosaurs in the same movie. After that, the IQ of the series dropped with each outing. The first one had chaos theory and amber and DNA extraction and cleverness up the whazoo. It was AWESOME.What does this one have? Hackneyed evil plans, a clunky plot, and characters so smart they run from T-Rex's in high heels.The franchise has had a lobotomy.",Jurassic World,369610
25,rkoch1,Unrealistic and a Horrible Mess,1/10,25 February 2016,"Let me just start by saying, I don't think this movie deserves a score of 1, but I had to rank it that low because currently the score is a gross misrepresentation of reality. This is not a movie which deserves to be compared with all of the great cinema masterpieces mankind has made.I just watched the semi-new Jurassic Park movie and I must say, I thought it was very, very stupid. I hate the trend in modern movies where everything bad that happens is always caused by people being stupid and doing stupid things. Like literally people making 10-20 Darwin Award ideas every movie. Literally in this movie, there is a big ""Super T-Rex"" dinosaur which is running around, and someone thinks that the proper move is to release a bunch of smaller Raptors to go hunt it down... like... what the hell...? You MUST be kidding. Raptors are PREY for T-Rex. It is a smaller predator which presents ZERO threat to the T-Rex, but MAXIMUM threat to humans. No human being who doesn't have a permanent retard helmet strapped to their head would have ever made that ""executive decision"". That's as stupid as sending a bunch of hunting dogs to go kill a Lion which is on the loose. Or a bear or something. And we are all little furry bunnies or something, so the dogs could easily just kill us for fun anyways. It is obvious that Raptors are only effective at killing small, human-sized prey... it just makes no sense. It is nothing but FRUSTRATING for the viewer, we're sitting here frowning and saying to ourselves, ""nobody would EVER do that!"".Anyways, MAJOR PLOT decision by the producing team... and it was a total disaster.. They should have gone back to the white board and came up with another plot idea.Another thing I hate are those STUPID ANNOYING scenes where everyone is running and frantically screaming in fear all around you, but the main characters are just standing there talking to each other like nothing is going on, just having a little chit-chat while there's dinosaurs running around, and people dying. Or when the two boys were running away from the T-Rex and then they got to the edge of a waterfall, but instead of jumping without hesitation like any normal person who is about to die would have done, they turn to each other and say ""Are you ready to jump? Let's do it together, OK? On the count of three, one... two... THREE, JUMP!"" Seriously, F that scene. That sh*t pisses me off so much.Stuff like that just makes a movie seem silly and stupid to me. I can't get ""drawn in"" where I feel the tension, and feel like I'm right there experiencing the adventure with the characters. Instead, I'm constantly reminded that I'm watching the product of mega-producers and corporations, who think the general population is only interested in special effects and explosions and beautiful people saying stupid lines. I remember watching the first movie, and as the final scene was closing and they were flying away from the island, I breathed a heavy sigh of relief, because I felt like I had JUST BARELY escaped the same dangers as the main characters had. I felt like I was there the whole time. But when I finished the newer, more ""modern"" JURASSIC WORLD, I felt zero emotion, absolutely nothing as the movie was ending. Instead, I just thought to myself ""Well, those were some really cool special effects, the movie sure had a large budget!"" In order for a movie to be captivating and really give the viewers a unique experience, you must mesmerize them and put them in a trance where they forget they are watching a movie. All those STUPID, HORRIBLY UNREALISTIC lines, actions, and mistakes made by the cast throughout the entire movie do nothing but slap me on the face each time it happens, only to remind me that I am, in fact, watching a movie.I would watch the first original Jurassic Park movie 10 times before I watch Jurassic World again! >:[",Jurassic World,369610
26,brando647,It Wasn't What I Hoped; Shallowly Entertaining,8/10,28 March 2016,"The original JURASSIC PARK is and always will be one of my favorite movies. I even enjoyed THE LOST WORLD more than most people. I've read Michael Crichton's novels more times than I can remember. So yes, I am a fan. I wasn't thrilled at the idea of reopening the movie franchise more than a decade since the third film solidified my belief that the series had run out of steam. I was cautiously optimistic when I read that Colin Trevorrow, director of the fun SAFETY NOT GUARANTEED, was brought on to helm the project and I was even more excited when Chris Pratt was cast in one of the lead roles. Trevorrow was loud and proud about his love for the original '93 film, so I began to believe he might do the series justice and somehow reinvigorate it. JURASSIC WORLD seems to ignore the previous two sequels, setting it in an operational and mega-successful park built on Isla Nublar. Claire (Bryce Dallas-Howard) is the operations manager, whom we meet when she's balancing a busy schedule of shuffling off her visiting nephews onto her disinterested assistant and presenting the park's newest attraction, the Indominus Rex, to potential investors. Meanwhile, former Navy SEAL and Ingen contractor Owen (Pratt) takes a break from training a team of velociraptors to inspect the Indominus's pen for safety concerns; in what should come as a surprise to no one, the Indominus outsmarts Owen and the park crew and escapes from its pen, endangering the lives of thousands of park guests as it murders its way across the island.Trevorrow was not lying when he expounded on his love for the original film. In fact, JURASSIC WORLD is his love letter to it and it's probably the film's biggest flaw. You can't go more than a few minutes without some sort of reference to JURASSIC PARK. The visitors' center is featured in a sequence where we see the ""When Dinosaurs Roamed the Earth"" and skeletal remains from the climactic moment. We see a night vision headset (twice!), famous from the T-rex escape sequence. There's little nods scattered around in the background (visual and audio) and even a character in the Jurassic World control room (Lowery, played by Jake Johnson) who seems to encapsulate Trevorrow's own raging fandom. A few references would've been fine but, by the time the film was halfway over, it just made me wish I was watching the original film. I wanted JURASSIC WORLD to be its own film, reminding us why we loved the '93 film without constantly nudging us with its elbow, winking, and murmuring ""Remember that part? It was cool, wasn't it?"" Even the core plot is pretty much a slightly modified version of the original: dinosaurs get loose, rational man who knows what he's doing makes it his mission to bring two key children back to safety, big climactic moment to close it out. Except the characters in the original film always felt as if they were in constant danger. There was suspense. JURASSIC WORLD isn't all that suspenseful. Maybe it's because the dinosaurs are 99% CG now. Sure, they look pretty good but, no matter how many people the Indominus swallows whole, it's never as scary as the T-rex was in the first film. The lack of suspense could also be attributed to the hollow feeling behind the action. Most of the deaths are nameless extras, be they asset containment crew or park guests. The moment when I knew this would never live up to JURASSIC PARK: when a helicopter crashes in a fiery, gratuitous, unmotivated explosion just so it can happen with the Indominus roaring in the foreground for that perfect ""trailer shot"". It was almost offensive in how cheesy that moment felt.Speaking of cheesyhow about that final confrontation with the Indominus? I'm not going to lie. That whole sequence had me rolling my eyes. Especially at the end. Not going to spoil anything here, but you'll probably know what I'm referring to. I'm being sort of hard on JURASSIC WORLD but that's only because I wanted it to try harder. It's not a bad film. It's still pretty entertaining. It's got some great casting (Pratt, Johnson, Irrfan Khan as the park owner, Vincent D'Onofrio as a nefarious Ingen overseer) and I loved the concept of setting the film in an operational park. On the topic of D'Onofrio's character and the whole subplot of ""trained"" velociraptors: I was wary at first but I thought it was done well. If anything, I think it should've been the main plot the film or, at the very least, saved for a sequel. The sequence in the middle of the film where the raptors are given a field test (which is glimpsed in the trailer with Pratt running with the pack on a motorcycle) was probably the best part of the movie. Overall, I felt JURASSIC WORLD was a tad overrated and, while it was an entertaining couple of hours, teamed with AGE OF ULTRON to jumpstart the ""Summer of 'Meh'"" (a term I've come to use for the summer blockbuster season of 2015 where I was continuously underwhelmed). Based on the money this film raked in (all of it), a sequel was guaranteed and, just as I was for JURASSIC WORLD, I'm hopeful. This spent too much time pining over the franchise's glory days but there were some promising nuggets in there. For anyone who for some reason hasn't seen it already, it's worth a watch and you'll probably really enjoy it. Personally, I'm more interested in where the franchise goes from here.",Jurassic World,369610
27,j_a_newton,Megacraptor Rex,1/10,30 October 2015,"Two decades after the original Jurassic Park, the company behind it is overcome with greed and decides to capitalise on the dinos once again, but since everyone has seen Whatevertheirnameis-sauruses by now, they need to create new monsters to keep the ""Wow"" factor up.So it decides to produce the movie Jurassic World, in which, two decades after the original Jurassic Park, the company behind it is overcome with greed and decides to capitalise on the dinos once again, but since everyone has seen Whatevertheirnameis-sauruses by now, they need to create new monsters to keep the ""Wow"" factor up.It's either an irony of fate or a sly jab at the ever-fossilising motion picture industry that the storyline of the film and the narrative of its conception are so strikingly similar. And I'm afraid I'm not inclined to thinking it was intentional.As ridiculous as the premise of the film is – fill Dino Island with people, let a number of scary ones loose, and then indulge in blood and screams and make sure the obligatory two lead kids get away in the end, where on Earth have we seen that before? – as poorly written the script is. Apparently, the first draft only took three weeks to throw together. I'm surprised it didn't happen in three hours. Loose ends are dangling all over the place like severed sinews from consumed tourists, the archetypal characters are nothing but a poor joke of the ones in the original trilogy (geeky and untidy computer nerd, lone hero scientist who understands that life doesn't follow spreadsheets, greedy business execs who want to make money from the monsters, and lo and behold, the Nasty Military Man who wants to weaponise them, et cetera ad nauseam), and when characters actually have to TELL each other to ""RUUUUUUUN!"" instead of standing still, waiting to become a quick snack, palm goes firmly on face, at least for this reviewer.You're-a-sick World indeed. Could someone please apply a suitably large nuclear bomb onto Isla Nublar, so that we won't have to endure a Jurassic 5.",Jurassic World,369610
28,Richie-67-485852,What a world...what a world,6/10,13 June 2015,"Seeing Dinosaurs on a large screen do things...any things is fun and entertaining. In this case...Its the actors and the story that distracts and takes away. The movie starts out and at some point builds an interest and even a tension. Why? You cant wait to see the Dinosaurs! Then, what will they do and when starts to present itself. Then, and I wont say when, the ability to critique this movie presents itself. I wonder what people in the business are thinking when they have a successful formula and don't bother anymore to make it special. Why? What so hard about making something so good that you want to see it many times and buy the DVD too. How hard is it to write a decent two hour story? To see this movie once, on the big screen is worth the ticket price but no memories after that. Once is enough. There are still a few people out there in that enjoy a good story. Don't forget us or we may forget you. At the theater, definitely a popcorn move, tasty drink and a snack to be sure
                
                    131 out of 262 found this helpful.
                        
                            Was this review helpful?  Sign in to vote.
                        
                        
                    Permalink",Jurassic World,369610
