,User_name,Review title,Review Rating,Review date,Review_body,Movie_name,movie_id
55,RforFilm,Manchester by the Sea is a realistic movie about realistic people that you'd find in the Boston area,8/10,5 January 2017,"What's odd about 2016 is that we've gotten a bunch of films about grief. Summertime gave us Captain Fantastic and December was Collateral Beauty. The good news (which is ironic given it's subject matter) is that there is always an audience for them as people die all the time. Death can be a tough subject that changes lives, especially to the living of those close to them. So why are a lot of people unprepared when the ticking moment finally happens? Probably because we don't like to think about it and what troubles it could bring us. Most of us would rather enjoy the happy moments if there are any. Though the idea is scary, I have sat down with my parents to find out whose going to take care of whom. Whose going to deal with the financial stuff and what about the house? These were legitimate concerns that I wanted to get a better understanding of. Sometimes, people are given responsibilities that their not even ready to get. This might include a house they can't get to or a collection they can't sell. Maybe even possibly custody of a child. The latter is explored in Manchester by the Sea. Lee Chandler (played by Casey Affleck) is a janitor working in Quincy, Massachusetts who is introverted and is quick to action when confronted. He gets a call one morning about his brother Joseph (played by Kyle Chandler) being in an accident. After driving up north to see what the deal is, Lee finds out that Joseph has died from a heart attack. He then heads to the town of Manchester-by-the-Sea to tell Joseph's son Patrick about his fathers passing. We're shown initially that Lee used to be close to his nephew, but after a tragedy happened, they've haven't spoken in a while. Going into town, Lee sees that Patrick (played by Lucas Hedges) is now sixteen and happens to be a popular student. He tells his nephew of his fathers passing and vows to stay with him until the funeral. This seems to be a set back as Lee discovers that Joseph had set up his will for Lee to be Patrick's guardian. Lee doesn't feel like he's up for the responsibility, as he is still keen on returning to his old life. Patrick isn't too wild about the arraignment either as he would rather stay with his mother, who Lee has shunned. Lee also faces his ex-wife Randi (played by Michelle Williams) who may still have feelings for him.Manchester by the Sea is definitely not a fun movie to sit through. It is, however, a really good drama to witness. For a story about an adult having to look after a child, you'd think that I would go into a route where a lot of stereotypical stories like this go. The good news is that the stories handles itself very maturely, and seems to Segway like something that would happen in real life. I could see something like this going they way it's going, especially in the northeast. If there's something that this movie proves is that the Affleck family is really talented. Casey Affleck is the perfect actor for this kind of role. He looks like a person whose been carrying a lot of weight on his shoulders for a long time. Though their not in the movie that often, Kyle Chandler and Michelle Williams leave some heavy footprints with their performances. Though Manchester by the Sea is set in the gloomy winter, it's still photographed beautifully, giving a lot of the emotion both scope and claustrophobia. I'll give this eight boat motors out of ten. Manchester by the Sea happens to be real story about real people. I'd say that if your looking for something more fun, your not going to find it here. But it is engaging and deserves to be one of the best of 2016.",Manchester by the Sea,4034228
56,yusufpiskin,Lonergan,9/10,4 December 2019,"Ever had a lump stuck in your throat for 2 hours?Ever held in a scream you wanted to scream but couldn't because you were afraid you couldn't stop?Ever seen an actor not acting, not performing, just being?Ever seen a director do his utmost to tear out your soul, stomp on it only to rebuild it in the most bitter sweet way imaginable?Ever lost someone, wanting them back so badly, living becomes a chore?Ever grieved?Ever felt so much love and responsibility it becomes unbearable?Manchester by the Sea shows us a life, a real life, in all its ugly beauty. It uses the power only the most exemplary pieces of art possess, the power to confront, to resonate and to emote and it does so with restraint and respect.To me, the utter humanity of it all makes this film a singular masterpiece. I allowed its weight to wash over me, to take in the unbelievable performances only to end up feeling grateful to have been part of this gut wrenching glimpse into a tortured soul.Allow this film in and you'll have an extraordinarily humbling experience",Manchester by the Sea,4034228
57,jadepietro,All in the Family,9/10,12 December 2016,"(RATING: ☆☆☆☆½ out of 5)  THIS FILM IS HIGHLY RECOMMENDED.   IN BRIEF: Superb acting and an honest insightful screenplay make this  family drama all the more memorable.   GRADE: B+   SYNOPSIS: A family tragedy impacts a solitary man who must now suddenly  rearrange his life and priorities.  JIM'S REVIEW: Everyone and everything has been estranged from Lee  Chandler. Divorced, content to do menial work, devoid of close family  ties and dear friends, Lee is a solitary figure ill-prepared for life.  A sudden family tragedy leads him back to his nephew, Patrick, a  confused and angry teenager. Forced into the father role, a role he  personally disdains, Lee must come to terms with his family obligations  in Kenneth Lonergan's powerful drama, Manchester by the Sea.  Written and directed by Mr. Lonergan, the film is an insightful  character study, not only of one man and the challenges he faces on a  daily basis, but of the entire Massachusetts community that he calls  home. We meet his fragmented family, including his brother (in  flashbacks), his ex- wife, and other colorful townies. Not much is said  directly, yet much is inferred as they all allude to Lee's deep dark  secret at various times and we slowly begin to piece together Lee's  broken life and intangible dreams.  The ensemble cast is wonderful. Casey Affleck is mesmerizing as the  desolate Lee. His is an introspective restrained performance. He shows  a man filled with hopelessness and pain, quiet in his words, even if  his actions seem violent and uncontrolled at times. Watching the actor  react with subtle glances away from loved ones or downcast stares to  hide his sorrow is so heartfelt and real. Abandoned by his  dysfunctional parents, Lucas Hedges also brings a nuanced and sincere  portrayal of a teenager left to fend for himself. Giving more than  ample support are Kyle Chandler, Gretchen Mol, and particularly  Michelle Williams as Lee's ex-wife. While her part does not share  enough screen time, her scene confronting Lee is raw and moving and  sure to earn her some award recognition.  The film has nary a false note, its dialog capturing the real life feel  of a middle class town and its vivid characters struggling over hard  times. The film is all drama without a shred of melodrama or artificial  theatrics. There are some minor directorial missteps however:. Some  intrusive classical music never quite gels with its surroundings and  that mournfulness is far too manipulative and overt, Also, in a small  role, Matthew Broderick suddenly appears. His recognizable screen  persona seems too jarringly out-of-place with the gritty realism of the  film.   That said, Manchester by the Sea is a bittersweet story (with an  emphasis on the first syllable). It is bleak, sad, and melancholy,  perhaps the feel-bad movie of the year. Yet it shows irony, humor, and  love so candidly. Mr. Lonergan's film depicts our flaws, our awkward  moments, our inability to communicate and simply express our emotions.  But, more importantly, his film shows truths that are generally ignored  in today's cinema.   Manchester by the Sea is one of the best film to convey the meaning of  family and all of its complexities in a totally honest and refreshing  way. It is one of the year's best.",Manchester by the Sea,4034228
58,framptonhollis,cinematic perfection,10/10,13 January 2017,"Few films of the 21st century (so far) can even come close to the breathtaking power of ""Manchester by the Sea"". It's a film that depicts grief and one's inner demons in a painfully powerful way, showcasing the greatest acting of the year. Michelle Williams is especially dazzling, despite her brief role. It's a film that made me tear up at multiple point, a film with a heartbreaking power that only the strongest films can have. It's a tragedy. It's a really, really intense and depressing and emotional tragedy. However, it is never boring because of the masterful direction, acting, and script. The film uses both extreme emotions and subtlety. The classic ""show, don't tell"" rule for cinema had been taught time and time again in every film school across the globe, and this film utilizes that tool brilliantly. The film is never overly simple, and it is not afraid to challenge the viewer. A film like this is unpredictable, therefore making it more suspenseful and, indeed, watchable. The characters are all fully developed and you grow to love and care for them. Information is revealed without it being rubbed in your face in pathetic, poorly written dialogue. Instead, much of it is conveyed through images or implying conversations. The cinematography is beautiful. The bleak, winter scenery is used to full advantage and adds to the films beautiful realism. There is not a fake second in this film, it knows how people really talk and act. The conflicts are always believable and engaging, no matter how depressing they may be, and much of the simple dialogue is fantastic due to it being filled with emotion and (believe it or not) a lot of humor! I must admit, despite this film being a tragic, emotional journey through grief and death, it is quite funny, even hilarious, at times. The humor helps us get through some of the more tough scenes, despite the film never holding back.This is a risky masterpiece. It's beautiful, realistic, human, funny, emotional, and profoundly moving.",Manchester by the Sea,4034228
59,bkoganbing,Chandler Family Values,8/10,23 April 2017,"A whole lot of pretty New England seacoast scenery is lovingly and exquisitely photographed in Manchester By The Sea including the title town. You might even get inspired to take a vacation there after seeing Manchester By The Sea. But there's far more to this film than beautiful scenery.It's the story of the Chandler family uncle and nephew. Lee Chandler lives and works in Boston quite humbly as a janitor when he received the word that his brother Joe just keeled over and died. The family knew this brother had a weak heart and that this could happen. All but one member of the family. The exception being Lucas Hedges his teen son. He's a jock kid, a hockey player with a bit of attitude. But he's quite vulnerable and the father who was played by an actor named Kyle Chandler provided in his will that his brother Lee played by Casey Affleck be the guardian of his kid. The mother who is Gretchen Mol has been separated for years from the father and she's an alcoholic. Another brother has moved to Minnesota.The problem is Affleck left Manchester By The Sea after a mind numbing tragedy of his own that may have been the result of his own carelessness. Casey was and is quite the party animal which was part of what caused the tragedy. In any event he wants nothing to do with Manchester whatsoever.Putting it simply Affleck just never quite got around to growing up. And Hedges is in some critical years and in need of a father, the last thing Affleck wants to be.Writer/Director Kenneth Lonergan took his time and drew some deep and rich characters for his Oscar winning original screenplay. You really think this is a real family struggling with some serious family issues, no actors involved here. Almost like what reality TV should be.The other Oscar that Manchester By The Sea won was for Best Actor for Casey Affleck. Director Lonergan got a great performance that struck all the right notes, where Affleck has to be contained he is, where he explodes with emotion it's the right amount. Credit has to go for his instincts as well.Lucas Hedges was nominated for Best Supporting Actor and I'm sure we'll see a lot from him as well. See the travails of the Chandler family as real as cinema gets.",Manchester by the Sea,4034228
60,tigerfish50,Love and Loss in Lobsterland,1/10,12 December 2016,"'Manchester by the Sea' is set in a similar demographic to Lonergan's earlier film 'You Can Count On Me', which depicted a couple of New England siblings struggling to deal with emotional turmoil caused by some of life's everyday problems. Manchester's plot is relatively simple - a reclusive, short-tempered handyman called Lee is entrusted with the unwanted guardianship of a teenage nephew after his brother's sudden death, and this upheaval complicates his dismal existence.Michelle Williams and the support cast do a decent job creating the Massachusetts coastal community surrounding Lee, but Casey Affleck's one-note performance is too stubbornly dour to sustain interest in his lead character over a two-hour film. The camera trudges after Lee throughout the proceedings, revealing a monosyllabic, hard-drinking sourpuss. Eventually, through flashbacks, it shows how various intoxicants combined with a minor oversight cost him his sense of humor and much else besides. By the time this revelation has arrived, it's become hard to care overmuch for the surly protagonist, his sorry tale or how he resolves his current dilemma. Manchester would have probably been a more memorable story if Lonergan's script had chosen to follow the path of Michelle Williams' sharp-tongued Randi.",Manchester by the Sea,4034228
61,masonmorgan-92917,A beautiful story of love and hope when we needed one the most,8/10,4 January 2017,"Kenneth Lonergan's Manchester by the Sea has been one of the year's most acclaimed films and all that Oscar buzz is certainly justified. Manchester by the Sea unapologetically explores themes of grief, family, teenage youth and just general daily inconveniences. Along with phenomenal performances from the main cast, Manchester's incredibly intimate and personal story will resonate deeply, and differently, with every viewer, not only making this one of the year's best films, but one of the year's most human films.Casey Affleck has only yet been nominated for the Best Actor Oscar, but it truly wouldn't be too naive to say that he has already won. His performance may be seen as lacking of any emotion, but within the context of the film, his emotional subtlety and understatement makes him just as real as anyone in the audience. While it is easy to dismiss him as emotionless, the grief that his character has been subjected to more than excuses his lack of social skills and general introvert nature. The rest of the cast is simply fantastic as well. Michelle Williams is perfectly damaged and Lucas Hedges is believably juvenile, making the entire cast of characters feel like real people, which is just about the best compliment an actor can receiver for his/her work. The story is very well told, despite some admittedly borrowed ideas. No matter who you are, there is guaranteed to be something within Manchester by the Sea that you can relate to on a personal level. Whether that be hitting your head on the freezer door, forgetting where you park your car or awkward family dinners, the screenplay features many little details that all work in part to make Manchester a completely immersive and human story. There is always a sense of heart within the film as even the darkest and most emotional moments are all handled sensibly leading to some beautiful sorrow and hilariously dark humor. The tone is quite inconsistent but it never becomes too distracting as new layers of meaning and emotion are revealed throughout. There are scenes of gut- wrenching tragedy and ironic comedy within seconds of each other, making for some choked-up chuckles, but nonetheless a memorable experience.Sometimes hilariously insensitive, sometimes emotionally devastating and always engaging, Manchester by the Sea tells a story that anyone can relate to at some point during it's run-time. It's at its strongest when it serves as a window into a life not too far from the viewer's. It may not be life-changing or endlessly re-watchable, but Manchester by the Sea is guaranteed to evoke emotion from any viewer, whether it be through laughter, tears or the painfully accurate and relatable actions of the characters. Most importantly, it serves as a beautifully human beacon for a year that was at times seriously lacking sympathy and love, making Manchester by the Sea feel like a warm hug when comfort was most needed.",Manchester by the Sea,4034228
62,Screen_Blitz,A spellbinding emotional roller-coaster with a tremendous performance by Casey Affleck,9/10,26 February 2017,"Nearly everyone faces an unspeakable tragedy at least once in their lives, and many film have deeply reflected on this emotional phenomenon. Unfortunately nowadays, many of these films tend to fall victim to manipulating audience's emotions with hokey sentimentality and melodrama. Luckily, this film directed by Kenneth Lonergan is not one of those films. Centering on a story of man shattered with grief and tragedy, this film places Casey Affleck in the driver's seat of this powerful emotional roller-coaster and transpires to a riveting tale of a man facing his past and learning overcome a tragedy that puts a gash of the man he once was. Shedding away the use of emotional manipulation and a sappy music score, Kenneth Lonergan draws a path to a heart-wrenching story that rarely feels cinematic but very real in nature. By the end credits, it should come to no surprise if you find yourself using a tissue or two. This film stars Casey Affleck as Lee Chandler, a sulky loner who works as a handyman in Boston isolated from his family and friends. One day, when his older brother Joe (played by Kyle Chandler) dies of a heart attack, he returns to his hometown of Manchester to look after his 16-year old nephew Patrick (played by Lucas Hodges). Upon his return, he is shocked to discover Joe has placed him as Patrick's legal guardian. Haunted by his tragic past, Lee begins wrestling with the decision to either take Patrick with him to Boston, or stay in his hometown -- a place he never wanted to return to.Kenneth Lonergan takes his film in a direction not intended to blackmail viewers in shedding tears but to tell an honest tale about how tragedy can tear not only one person, but an entire family apart. By all means, his effort lands with near-perfection. From the opening minutes of the film, we are introduced to Casey Affleck's Lee Chandler who's definitely not a easy guy to like, he has a sore attitude and at one point, gets in a petty fistfight at a bar. But as the story unfolds, the film proceeds in-and-out through a long series of solidly edited flashbacks that retread unpleasant events from his past that lead to the downfall of his relationships with his family and friend and eventually prompted him to leave the hometown he once new. By his point, your apathy for this character evolves into sympathy as he reveals to be not a bad guy but a man strangled with a brooding past. Before the halfway marks, it becomes clear that the lead character is not the only who's completely broken, his whole family including his nephew Patrick and ex-wife (played by Michelle Williams) are shattered as well. And the story leaves only a small room for occasional humor and levity. There's one scene with Affleck and Michelle Williams late in the film that's tough to sit through and a flashback scene with him and Kyle Chandler early on that pulls at your heart strings. And there is rarely a moment that feels a hokey tearjerker ripped from another cinematic entity.Casey Affleck takes the daunting task of carrying the film on his shoulders, and with a performance so tremendous and powerful; he greatly succeeds. This actor proves capable of carrying on sufficient emotional gravitas and honest sentimentality. Every minute he comes on screen, this talent shines like gold. If this isn't the best role of his career, I don't know what is. Supporting him by his side is Lucas Hodges playing his troubled teenage nephew who struggles trying to maintain a gripping relationship with his uncle who's plunged into sorrow to open with his nephew (or anyone for that matter). His performance stands strong especially for an actor in his late teens. Kyle Chandler, who's appearance is limited to various flashbacks is also quite powerful and worth admiring. Michelle Williams plays Casey Affleck's ex-wife and does not get a great amount of screen time beyond seven minutes or so, does a great job especially in an aforementioned scene with Affleck towards the end. Gretchen Mol does a fine job as Patrick's mother as does Matthew Broderick as her soon-to-be husband, but like Michelle Williams, not a lot of screen time. While the film shines with a diverse cast of powerful performances, it is Casey Affleck who becomes the pedaling force of the film's riveting atmosphere.Manchester By The Sea is a powerful, heartrending film bound with riveting performances by an awe-inspiring cast and a thoughtful direction by Kenneth Lonergan. It is a movie destined not to sweep you away with emotional devastation but a thought-provoking story about family, love, and sorrow that feels thoroughly honest. In a triumphant achievement, it stands tall as one of the most powerful films of 2016.",Manchester by the Sea,4034228
63,george.schmidt,Affleck is Oscar bound in one of the year's very best films. A must see.,10/10,28 November 2016,"MANCHESTER BY THE SEA (2016) **** Casey Affleck, Lucas Hedges, Kyle Chandler, Michelle Williams, CJ Wilson, Gretchen Mol, Matthew Broderick, Tate Donovan, Josh Hamilton, Kara Hayward, Anna Baryshnikov, Heather Burns. Affleck gives an Oscar worthy performance in a career defining performance as a New Englander handyman, Lee Chandler, who prefers to keep others at arms' length in an everlasting downward spiral wrestling with personal demons that comes to a head when his beloved brother Joe (Chandler) suddenly dies leaving him as guardian in trust to his nephew Patrick (aspiring newcomer Hedges who gives good thrust and parry with Affleck in dynamite chemistry) who also is dealing with his teenage hood and growing pains. Filmmaker Kenneth Lonergan (who has a funny cameo as an insulting bypasser) truly gets at the heart of what it means to grieve in piercing, poignant aplomb while letting his actors get at their inner core of feeling. Gorgeously shot with picturesque cinematography by Jody Lee Lipes suggesting Norman Rockwell's America and an unlikely source for one's personal hellish homecoming. Remarkable in its relative low-key balance and appreciative peppering of much welcome humor to an otherwise glum storyline. Affleck is truly remarkable and his reunion with Williams is one for the film vaults; one of the year's very best films and a must see.",Manchester by the Sea,4034228
64,rjk541,Critics Completely Missed on This One,3/10,11 January 2017,"""Manchester-By-The-Sea""...don't bother...wait for twenty years until it comes out on an old time movie channel at around 2 am and you need something to put you to sleep. The script is bad. The direction is bad. The make-up is bad. The sets are bad. The costumes are fine, because they are everyday clothes of working class people in the Northeast (Boston and other areas). I found Casey Affleck's performance to be the only redeeming quality in this overrated piece of digital media. He (Affleck) portrays a brooding, jack-ass, violent, bully of an alcoholic very accurately...almost as if he were one or was a another victim of the Hollywood hamburger machine(I applaud him..not standing ""O,"" but polite applause because everything else in the movie was BORING). About that corpse (yes, there's a corpse in one scene): Not a corpse. Not a dead human look-a-like...but a live person trying to pull it off. It doesn't work. How was this evident? The cheeks and face were still naturally pink and flesh tone. There was a popping vein near the temple area. Really? Did you studio execs really think no one who would see this ""movie"" would have seen a real corpse? Come on. If you have seen dysfunctional, violent alcoholics who attack people in bars who they think are staring at them, or are smaller than the drunk, and families who have a hard time handling ""life,"" in real life, you have seen this movie. Three stars because of Affleck's performance. Zero for the movie as a whole.",Manchester by the Sea,4034228
