,User_name,Review title,Review Rating,Review date,Review_body,Movie_name,movie_id
42,artmania90,A spiritual experience that is one of the great movies of the 21st Century,10/10,16 January 2017,"One of my all-time favorite movie scenes is in 1980's ""Ordinary People."" The story follows Conrad, a high school student who is dealing with the sudden death of his brother and living with two parents who have no idea how to cope. Behind a picturesque middle-class facade, things are slowly unraveling. The final moments of the film, after we learn that Conrad's parents have decided to separate, shows him and his father in a quiet and cold backyard. Even though these two have rarely seen eye-to-eye, and in a conclusion where everything seems hopeless, Conrad simply tells his father ""I love you,"" and in response his father breaks down and says the same. I think the reason I love this scene so much is because it offers a movie so full of darkness the slightest suggestion of hope. It suggests that the love of family is still stronger and cannot be overcome.I only mention this scene and ""Ordinary People"" in particular because almost 40 years later here is a movie that is a spiritual equal. ""Manchester By The Sea"" is a massive undertaking that deals with loss in such an intimate way that it would be hard to call it anything but profound. There is something entirely universal everyone can grasp and yet watching this movie feels like a peek into a very real life of a family.Lee Chandler (Casey Affleck) is a man whose life is stagnant. He works as a handyman in a series of apartment buildings, fixing leaking pipes and whatnot. He lives in a basement studio apartment that is sparsely decorated and lifeless. He drinks by himself, and he is rude to those around him. In the first half of this film, Lee is not a character we understand or even like. In fact, he is oftentimes despicable. He gets into bar fights and swears at women. When he takes a phone call to learn of his brother's sudden death, he calmly says he will get there within the hour.Manchester-by-the-Sea (the town's actual name) is where Lee seemingly grew up, raised a family, as evidence by many flashbacks that pepper the film with glimpses into his memory. We recall the moment when his brother, Joe (Kyle Chandler) was first diagnosed with congenital heart disease, or when he took his nephew Patrick on a fishing boat. Now in the present time, Patrick is a high school student with no mother and only Lee as his seeming guardian.The movie becomes an evaluation of the stages of grief and we focus on the relationship between uncle and nephew. Lee, who remains shut off from the community, and Patrick, who invites friends over for pizza and stories on the very day his father died. No one is to say which way is the preferred method for mourning, and of course the emotions begin a series of highs and lows as the two men begin the process of moving on with life. Lee, who is adamant about living in Boston, faces pushback from Patrick who is adamant about finishing high school in Manchester among friends. Here, he has a boat, friends, a band, and two girlfriends (I know). In Boston, all Lee has is a sad apartment. There's no arguing there.What is surprising about the film (where can I start) is the stark humor that comes amidst moments of such melancholy. This is easily a story that could have sunk into our hearts and left us feeling cold, but there is a joy that comes from the way these characters talk to each other and interact. There is an established history that is evidence in the writing. What else is mesmerizing is a score that incorporates classical pieces as opposed to an original soundtrack. There is something so powerful about the contrast between the New England setting and such complex music. Maybe more impressive still is the tight structure of the script, which weaves back and forth through time and gives us such a sense of depth and backstory. Kenneth Lonergan (the director and screenwriter) has surely written the favorite for an Oscar nomination.Casey Affleck, an actor of considerable talent, seems to have finally become his own person outside the shadow of his brother. His performance is quite simply jaw-dropping. Closed in and reclusive and yet with hints of a broken heart, there are glances and gestures that are so nuanced that you can't help but think that this could be the best performance of the year. As with Michelle Williams playing his wife, this could very easily be her best role to date. Her brief screen time in all but 4 or 5 scenes encompasses the themes of the film and reveal the deeper heartbreak just below the surface of their relationship. The same can be said of Lucas Hedges playing Patrick, a young actor full of promise and grace.There were several scenes when I found myself genuinely moved, mouth agape at how honest this movie actually was. When Patrick finally comes to term with his father's loss while looking for a snack... When Lee and his wife exchange a hug at the funeral and a surge of emotion sweeps through both of them... A scene where Lee picks up a gun... These are candid moments that are so real, so perfect, I can't help but think that ""Manchester by the Sea"" is the year's best film.",Manchester by the Sea,4034228
43,kvmarcin,Affleck's acting is excellent but screenplay is half-baked,5/10,18 December 2016,"I've very much enjoyed other Kenneth Lonergan films, and I've admired Casey Affleck's acting gifts for a long time. Because of the rave reviews, I was looking forward to seeing this. Unfortunately, the film went into production with a half-baked script. It probably needed another 5-6 rewrites to make the characterization more layered, develop the subplots more, and get to the pith of the central conflict, which was extremely weak.The story didn't really get off the ground until the last third of the film. It's a testament to Affleck's acting, not the story, that the film managed to sustain my interest. The only thing I'll say about the music is that the classical music was used in a very ham-handed fashion to manipulate the audience's emotion.Affleck plays a character named Lee, who has suffered a tragedy from which he can't recover. He does his best with an taciturn, undeveloped character whose aims are vague and is so caught in depression and grief that he displays little outward emotional expression. The other major character is Patrick, a teenage boy whose father, Affleck's brother, has died suddenly.One of the big wrongs in the screenplay is that we don't get any sense that Patrick is grieving or even in shock about his father's death until a contrived scene later in the movie about a refrigerator that is a weak, unconvincing attempt to show Patrick has feelings about his father.The relationship between Lee and Patrick is meandering and with mild conflict here and there. It's supposed to be the spine of the movie, but it's so flaccid that the film often lacks focus.I think this movie has something to say, but it's not fully articulated, because the film was shot before the script was fully ready for production.",Manchester by the Sea,4034228
44,areinhol,It didn't work for me,5/10,6 January 2017,"Our hero is an angry man who can't seem to hold it together. Through a series of flashbacks we learn why: a great tragedy has traumatized him. But this is not just any tragedy, I can't think of anything worse that could happen to someone. Oedipus Rex plucks out his eyes with less cause. So there is plenty of motivation for him becoming an angry loner, but his past could motivate any dramatic outcome, celibate monk, mass murderer, iconoclastic artist, CIA assassin, raving lunatic. Call a suicide prevention hot line with his backstory and they might direct you to a right-to-die website.Psychotherapy is apparently never an option in the townie macho culture the film depicts; the local police have a very strong reason to get him counseling, but there is no indication they ever do. Self-medication with alcohol is the only succor he gets. OK, so I understand why our hero is angry, but why are most of the other characters attempting a Boston accent so touchy? The accent-free characters in the film never get upset. Despite the portentous music, the film's front story is not so tragic. (A different score could turn this glass-half-empty downer into a half-full feel-good charmer. Some film school should do the experiment.) Our hero realizes his limitations and makes some reasonable choices. The brilliantly acted and Oscar-headed moment when his ex-wife tries to help made me wonder just how she managed to get over it so well.An inability to control his fists is our hero's one shortcoming. Watching a seething Casey Affleck staring out his late brother's bedroom window, my immediate reaction was at least he isn't punching his fist through the glass, and then, a second later, he does. No angry-male stereotypes were harmed in the making of this movie.My takeaway? Check your smoke detectors regularly.",Manchester by the Sea,4034228
45,classicsoncall,"""I can't beat it. I can't beat it.""",7/10,29 December 2016,"My theater crowd sat in stunned disbelief when this was over, stunned that it went absolutely nowhere. There were actually audible gasps here and there. The assortment of Kleenex I brought in anticipation of the warnings posted by other reviewers was never in serious jeopardy of leaving my pocket. And this wasn't just my reaction. I attended the film with three women (I'm a guy), and none of them had a positive response to the picture.I'm guessing the tear jerker moments consisted of two emotional scenes that in another picture might have gotten to me, but here were tempered by other considerations. The first was the flashback of Casey Affleck's character recalling the tragedy that destroyed his family. The other was the intense confrontation between Lee Chandler's (Affleck) ex-wife Randi (Michelle Williams) and Lee himself, in which she pours out her heart over her own grief and love for him. A well played scene but unmoving on the part of Chandler, so the pathos over what might have been didn't have a chance to resonate with this viewer.With all that however, I can't take exception with the Screen Actors Guild nomination for an Outstanding Performance by a Cast in a Motion Picture. All the players did do a good job, it's just that none of their performances went anywhere, nor did the story. One thing that affected my viewing might have been the sound quality of the picture, as the others in my party also had some trouble with the dialog. So I'm not opposed to a second viewing when this eventually comes out on DVD with captioning available. Even so, the accolades for the picture by the critical intelligentsia escapes me. One plus - the cinematography that captures the environs of Manchester by the Sea is stunning. It kind of makes me want to visit.",Manchester by the Sea,4034228
46,ritera1,Profoundly poor,5/10,26 December 2016,"And just a general bummer.Granted, Affleck's performance was very good. And the kid was likable. But there wasn't much of a road traveled. It was just walking back and forth on the same street. Very repetitive. I believe it took 45 minutes to get to when Affleck finds out he's the guardian. Way too long. Just a lot of regular people being regular people in the midst of a tragedy that was likely to happen eventually. I found it very odd how the kid takes the death of his father for granted. Sure, there was one panic attack very late in the movie, but it really didn't seem genuine.And everything was very repetitive. Many different ways on how the kid wants to have sex with his girlfriend. For some reason this is very important to him, even though he's having sex with another girl. Doesn't really make him likable. I really didn't find that it would be difficult to find time to have sex with either of them.Then several instances where Affleck and the kid have back-and-forths that were funny, but were numerous. No real reason why the kid had an attachment to Affleck being that he was absent a vast majority of the time. It was odd that the dead father completely prepared for his death but there was no money left over for an engine for the boat. And it was just a bummer. Affleck failed at the task at hand. He could not move forward. He was an aggressive drunk at the beginning and the same at the end. He did not overcome anything. Life just went on. How cheery!",Manchester by the Sea,4034228
47,michael-kerrigan-526-124974,An acting masterclass,10/10,19 November 2021,"I just watched Manchester by the Sea for the second time. Wow. An emotional rollercoaster of a film. It was even better on second viewing because you could understand the acting nuance in its context from the start. Casey Affleck is unbelievably good. Should be oscar winning performance. Went from 8 from first viewing to 9 on second. It is so thought provoking - especially if you've had painful experience of family dying too young. If you haven't seen it, you must. Keep your tissues close by. It is a masterpiece xx.
                
                    2 out of 2 found this helpful.
                        
                            Was this review helpful?  Sign in to vote.
                        
                        
                    Permalink",Manchester by the Sea,4034228
48,beglenrice,It's good but why all the..,6/10,19 December 2016,"This is written for people who have already seen the film. Holding the audience captive in suspense as to what is the dark beyond in the main character's life does nothing. It slows down the movie and makes it tedious. When writers contrive these flashback-to-present scenes, it has to have a big payoff, or what's the point? In general, telling this story mostly chronologically would have served the pacing and sense of the film much better. After an hour or so into the film we finally know 'what happened' and finally we can really just watch the movie. The movie is about how a guy recovers from a tragedy by facing the prospect of becoming his nephew's guardian. But you don't get to be in on that until it's almost too late. It's stupid. The relationship between the uncle and nephew does turn out to be quite interesting and worth watching once you get there. Before then it's a conceptual writer's device to jump back and forth in time to somehow make the movie more suspenseful or something. Once the tragedy is revealed the movie becomes much more cohesive and for me, a pleasure to watch. Overall I think it is good, it's just perplexing as to why writers go to such great lengths to invent concepts that don't serve to tell the story well. Being artistic is mistaken for contriving conception. Oh well. It's still pretty good, with solid acting compensating for writer/director ego.",Manchester by the Sea,4034228
49,chaitov,This film another reason to be turned off Hollywood,1/10,5 February 2017,"Besides the rants of so called Hollywood ""stars"" like Madonna,Ashley Judd, Cher,Whoopie Goldberg,Manchester By The Sea has confirmed my belief that Hollywood movies have reached the lowest denominator in years. I expected a great movie considering all the acclaim by reviewers.It is a boring,unimaginative,slow moving,depressing,film that a middle or high school student could do for a class project to show how not to make a movie. Casey Affleck is a terrible actor.Most of the time he stares into space with little dialogue.And suddenly he's smashing someone in the face.There's no depth to this script and no character development either. I kept yawning about to doze off and looking at my watch. The cinematography is good but if I wanted a travelogue about the Boston & surrounding towns in winter,this would be appropriate for that alone. The baroque music just added to the depressing qualities in this film. It never lets up.There are no redeeming features for this film. It should be tossed in the garbage heap never to be heard from again.Please ,don't waste your money & if curious watch it at home on Netflix.",Manchester by the Sea,4034228
50,ElMaruecan82,"A haunting and emotional tale of guilt, family ties and redemption...",10/10,19 February 2017,"Whenever I see someone being uncommunicative, acting unfriendly or being plain rude, my immediate reflex is to give this person a respectful benefit of the doubt. This presumption of inner goodness is essential because seriously, how many people we know in our lives have gotten such a bad break from life that they can't manage not even to fake happiness? A lot and we know it, life can be tough in the blindest and meanest ways, so no one can be offensive and happy. As a matter of fact, no one can hate people and love himself; unhappiness is deeply rooted in guilt and low self-esteem. This is the core of ""Manchester by the Sea"", Kenneth Lonergan's powerful family drama starring Casey Affleck, Michelle Williams, Lucas Hedges and Kyle Chandler. Lonergan wrote and directed the film and it's simply one of the rawest and most authentic portrayal of the way family ties can be profoundly affected by tragedies, and the way relationships, mostly those where love is taken for granted, are undermined by the very lack of love directed to yourself. But I'm making the film sound too complicated while it's about a rather simple but harrowing journey. Lee Chandler (Affleck) learns about the death of his brother Joe (Chandler), he informs his nephew Patrick (Hedges) and learns that, according to his brother's will, he'll be his guardian until his eighteenth birthday.When this happens, the movie has already been on for one hour, and so far, what we discovered from Lee is that he's a reclusive and secretive janitor and handyman and whom likability isn't the strongest suit. Patrick on the other hand is a teenager who doesn't strike as a very troubled one, pleasantly far from the usual archetypes, he's articulate, sarcastic but rarely in a hurtful way, he's in good mental and physical shape: he's in the hockey and basket teams, he's in a band and he can also afford the luxury of two girlfriends. The reason why he keeps himself so busy becomes clearer as we get more insights about his childhood, raised by a positive father figure who divorced from his alcoholic wife. But Patrick never resented his mother and kept in touch with her.One of the merits of ""Manchester by the Sea"" is that it never really tackles its subject with the usual material, we do have death, alcoholism, loneliness and bar fights, but the characters make it look fresh and unusual in a realistic way. For all the demons that inhabit them, they also act like normal, ordinary family members, skipping some subjects, commenting on trivial stuff, many things are left unspoken but with such a rich subtext we never need to know more. This is a triumph of screen writing and I'm looking forward to seeing Loneegan win the Oscar for Original Screenplay. And it's also a great piece of storytelling, because a linear narrative would have made things clear from the beginning, but for such a tremendous loss in emotional impact.Indeed, we've got to follow Lee for one long and painful hour, ignoring a woman who's obviously trying to make out with him or punching one guy because he didn't like 'his look' but then after one hour, and a few flashbacks, we finally get his ""problem"" and we understand why he's acting this way, he earns our immediate empathy, it's not just an 'attitude'. Never underestimate the many moments of quietness the film offers, they might the silence before storm of devastatingly poignant resonances. And without relying too much on the good old ""you'll laugh! You'll cry"" tag-line trope, but this is also a screenplay that injects a good deal of comedy sometimes, in order to remind us that even in the most dramatic situations, there's room for a little smile.""Manchester by the Sea"" belongs to that so unfairly overlooked family drama genre that produced masterpieces like ""Terms of Endearment"" or ""Ordinary People"". There are actually ordinary people in this film with their flaws, their lack of obviousness, so to speak, and on that level, while everyone deserves the praises and I'm glad that both Hedges and Williams were Oscar nominated but Casey Affleck gives one of the most authentic performances ever. It's simple, you never feel like he's playing, many times, he's like hesitating, neither happy, nor sad and I wondered why he picked that angle in his performance. Well, because Lee doesn't know, he's figuring out what to say. An actor who's learned his screenplay knows exactly what line he's going to say, but Affleck has this incredible ability to make a situation feel as awkward as embarrassing as if it was real. And the authenticity he pulls in his performance is so great, you don't feel like watching a film but eavesdropping.I hope to see this film win at least two Oscars, and one of them is for Affleck. But even without any awards, this is a powerful story that will resonate in the hearts of many people who had their tough deal in life. There's no message, no point except that one ""can't just die"", no matter the problems that poisoned your life, if you're alive enough to think about them, you better get busy doing something else and loving yourself a little, because otherwise, you're screwed. Both Patrick and Lee get busy living but their experience allow them to learn one thing or two about life, and so do we. And by closing the film with a shot similar to the first, less optimistic but with a bittersweet quality on its own, Lonergan tells us that there's always a gateway from social exclusion and a time to get rid of our demons and come full circle.And in this melancholy time where it's ""finito"" for IMDb message boards, I dedicate this review to their memory and the great time I spend there. It's been a privilege and it's been fun.",Manchester by the Sea,4034228
51,wd-8,Astonishing and wonderful. A beautiful surprise. 10/10,10/10,14 March 2021,"What an extraordinary film, what a surprise. Casey Affleck is incredible, a joy, a masterwork.Must see!
                
                    4 out of 5 found this helpful.
                        
                            Was this review helpful?  Sign in to vote.
                        
                        
                    Permalink",Manchester by the Sea,4034228
52,W011y4m5,Capturing humanity with an observant gaze,8/10,24 March 2019,"Manchester By The Sea is a lovely little indie feature which aims to intimately capture the essence of everyday lives of normal, working-class people across the country - their mundanity, flaws & tragic beauty - taking the time to simply observe one particular family & the impact a relative's unexpected death has on those around them, it deals strongly with repeated occuring themes of grief & how multiple individuals choose to deal with it. Its brutally honest & simplistic depiction of events also grounds the film in a reality which feels reassuringly familiar to those watching & the beautifully understated, subtle performances gift the characters with a poignancy & undeniable relatability - meaning however slow or monotonous their days progress, you can't help but be emotionally invested in their engaging stories, regardless.
Casey Affleck is incredible & must also be acknowledged especially for the stunning job he did with this movie too. His acting was absolutely outstanding.
                
                    5 out of 8 found this helpful.
                        
                            Was this review helpful?  Sign in to vote.
                        
                        
                    Permalink",Manchester by the Sea,4034228
53,areatw,"Raw, realistic and powerful",8/10,9 August 2017,"In a year dominated by the likes of 'La La Land' and 'Moonlight', 'Manchester by the Sea' went very much under the radar to start with, but is now rightly getting the acclaim it deserves. This is an excellent film and in many ways a fascinating character study of someone going through a life tragedy. It's raw, realistic and powerful, and benefits from some outstanding acting performances.Casey Affleck is an actor I hadn't seen too much from before this film, but his performance in 'Manchester by the Sea' was masterful. He got his character in this film spot on. I also think that Lucas Hedges deserves a mention for such a mature and realistic performance as Patrick. He sure has a bright future ahead of him if this film is anything to go by.'Manchester by the Sea' is one of the best films of 2016. It's a depressing picture with some dark themes, but is truly engrossing and beautifully shot. 'La La Land' and 'Moonlight' were both great, but if I had to pick a film to recommend from 2016, it would probably be this one or the overlooked 'Captain Fantastic'.",Manchester by the Sea,4034228
54,Prabhuraj,Mesmerized,7/10,25 December 2018,"GREAT ! One of the best films ever. Phenomenal charactarisation and acting especially from Casey Affleck. I was mesmerized by this film. I felt like I was reading a novel, there was so much to contemplate and digest. I did not know what to expect or where the plot would lead. Captured the complexity of life and tragedy in a masterful way. Excellent.
                
                    22 out of 39 found this helpful.
                        
                            Was this review helpful?  Sign in to vote.
                        
                        
                    Permalink",Manchester by the Sea,4034228
