,User_name,Review title,Review Rating,Review date,Review_body,Movie_name,movie_id
47,planktonrules,"Some very interesting plot twists and originality, though it's a bit grim and lifeless",7/10,17 January 2010,"After seeing that this film is in the IMDb top 100, I thought it was a film I must see. Now that I've seen it, I feel a bit disappointed. Now I must admit that the film was terribly original and had some odd twists, though the film overall is awfully grim and lifeless--mostly because it was hard connecting with the characters.Christian Bale and Hugh Jackman play magicians who are partners. Things go very well for a while until Jackman's wife is accidentally killed doing a dangerous trick. Jackman blames Bale for this and you really can't tell if Bale did anything wrong or if it was just a sad tragedy. Regardless, Jackman spends the rest of the film persecuting Bale and trying to destroy him. After a while, Bale begins fighting back and it's an all-out war with horrible consequences. I won't say more--because I don't want to spoil the film. However, I will say that it gets really, really, really weird when Nicola Tesla (played very well by David Bowie) enters the fray--creating the ultimate magical box for Jackman.Aside from the magic box being ridiculously anachronistic, the film is so slow and hard to love--despite it's wonderful twists. It's hard to like either of the magicians (particularly Jackman) and after a while I lost interest--mostly because of the pacing and disagreeable characters. Overall, I greatly respect the film but also didn't particularly enjoy watching it.",The Prestige,482571
48,andrewchristianjr,FULL OF TWISTS.,8/10,9 April 2019,"Honestly, this film is one of the most complex characters out of all of Christopher Nolan's films. Really thought provoking. Full of twists. Great performances by Bale and Jackman.
                
                    5 out of 8 found this helpful.
                        
                            Was this review helpful?  Sign in to vote.
                        
                        
                    Permalink",The Prestige,482571
49,blufrog49,Do We Like These People?,7/10,30 January 2018,"The answer to that question is ""no."" Although I found the story quite fascinating and overall, the film well done--another great performance by Michael Caine--in order for it to really work, the audience has to be rooting for someone. As the movie progresses, we find each of the 2 magicians and the women less and less likeable. A look at illusions and magic ""backstage"" was educational, and I certainly was not bored. However, the conclusion that one magician used cloning was a disappointment as it is impossible, at least in the way it was done in the film. But the worst pill to swallow: although I haven't read ALL the reviews here, I haven't found anyone who addressed the callousness of a twin sacrificing his brother's life as one of them did in the story. And do we REALLY know which one survived?",The Prestige,482571
50,preppy-3,Intelligent and incredibly suspenseful,10/10,15 April 2008,Drama about two magicians in England in the 1800s--Robert Angier (Hugh Jackman) and Alfred Borden (Christian Bale). They perform together and Angier's wife (Piper Perabo) is accidentally killed during an act--or maybe not. Angier blames Borden--Borden denies it. They then start competing acts and try to sabotage each other--and things get deadlier and the stakes higher.This was a box office bomb and that's a shame. It is a little too long and it keeps you guessing--that's why people probably stayed away. This isn't a movie you can relax with--you have to pay strict attention to figure out what's going on. The movie has many ingenious twists and turns and constantly keeps pulling the rug out from under you. You always think you know where it's going--but then it veers off completely in another direction. Some people hate challenging films like this but I was fascinated. The acting is just superb across the board. Jackman and Bale have never been better--they come tearing out of the movie at you. Even the supporting roles are well done. Michael Caine (playing sort of a Greek chorus) pops up and Rebecca Hall and Scarlett Johansson are also very strong. And wait till you see David Bowie as Tesla! Also the direction by Christopher Nolan just adds to the film immensely. He was one of the co-writers so he knows what he wants.Ingenious drama--beautifully acted and directed and full of twists and turns. One of the best movies of 2006. A definite must-see!,The Prestige,482571
51,tburke85,The Prestige An Entertaining Thriller,9/10,16 May 2009,"The Prestige is an entertaining thriller from writer/director Christpher Nothan the man behind films like Memento, Insomnia, Batman Begins, and The Dark Knight. The Prestige is about two magicians Robert Angier and Alfred Borden whose friendship turns into an intense rivalry that leads them on a life long battle for supremacy. Hugh Jackman stars as Angier and Christian Bale plays Borden who also worked with Nolan on Batman Begins and The Dark Knight. Jackman and Bale are great in their roles portraying men who are driven to be the greatest magician in the world. Michael Caine is fantastic as always playing Cutter a man who builds and constructs illusion tricks. Scarlet Johannssan is strikingly beautiful as both Angier's and Borden's lover assistant Olivia. She brings a lot to the small role she does have in the film. David Bowie also does a solid job with his role as brilliant scientist Nikola Tesla. The rest of the cast including Piper Perabo as Angier's wife Julia, Rebecca Hall as Bordens wife Sarah, and Andy Serkis as Telsa's friend Allie are believable in their supporting roles. Director Christopher Nolan does a great job with the period setting and the mood of the film. Even with a running time of 130 minutes the film is never slow which helps draw the audience into the story. The plot for the most part is complex but never complicated but does require a couple of viewings to full understand what the movie was all about. From the twists and turns to the superb acting The Prestige is an entertaining thriller that is sure to please anyone looking for a good film to watch.",The Prestige,482571
52,dbborroughs,Wonderful story of magical rivalry is best seen knowing as little as possible,9/10,3 November 2006,"The second magic related stories to be released in just over a month.Christopher Nolan has constructed an elaborate puzzle box of a movie thats a really good thriller. This is the story of two magicians who attempt to out do each other. The hatred is the result of a tragedy that happened years before on stage. Told in a series of flashbacks the film is a search for the secret of each man's version of the teleported man.Superbly acted, this is one of the rare recent films where the actors, even when big stars like Hugh Jackman and Michael Caine completely disappear into their roles. Its clear why everyone was involved with this film because everyone gets real meaty roles. David Bowie appears as Nikola Tesla and has the best role he's yet to appear in. You really must see this film for the actors if nothing else.You have noticed that I'm rather light on details and thats intentional. This is the sort of movie that is best taken on its face value. You'll want to see the twists and turns of its plot for yourself and not have them spoiled by reviewers and friends who feel the need to tell you too much about the story. What Nolan has constructed is a complex little thrill ride. What I will tell you is that he does play fair, in the end you will know all.For me this is going to require a second or third viewing. Its one of those movies where I'm in love with the construction of the film so much that I have to see it again to see if the thing is as good on an emotional level, I think it is but I'm still distracted by the ""sparklies"" of the box.Go see this film if you like good twisty stories with more than a hint of real magic in them.",The Prestige,482571
53,sj_elliott,"I love long, dark, well-acted and intelligent films but not this one",4/10,20 November 2006,"I love a film that doesn't spoonfeed the plot and the story and the interest in it to the audience. This one takes you along if you are smart enough to go and if you are not so dumbed down by most entertainment that you can stay steadily involved.I wanted to love it to death...it has everything I think a film should have, including a wonderfully rich atmosphere, a great cast and excellent direction. Through most of it, it dares the audience to be intelligent and to have an attention span longer than a fruit fly. It had all the makings of a great film, but I kept looking for (and longing for) the greatness to impact me. It never did.It fell flat for me by the end. I really didn't care about any of them by then. I wasn't even sure I cared about the little girl. I certainly didn't care how anyone did any of the illusions; I was sick to death of their obsession with each other and just wanted them to move on already. Although there would be no film without it, it all seemed to be 'too much trouble to go through' and obsession is about getting caught up in it...for me, I couldn't get caught up in itnor could I quite get their obsession. Although Iam a big fan of the long, thinking person's film, I have to say I thought it dragged on and on by the end and I just wanted it over. It definitely did not leave me wanting more. I just wanted different.I had paid attention all along, I was impressed with the film and thought the acting, the cinematography and the direction were all superb. Even though some of the twists seem unnecessary, I thought many were brilliant and I kept trying to will myself to care about it, to care about them, but I didn't.It was a very good film in a detached sort of ""viewing art"" way but as far as feeling ""wow""'d by the end, not so much.",The Prestige,482571
54,gettodamoofies,"""Are you watching closely?""",9/10,17 July 2023,"FILM: 9/10.Christopher Nolan's 2006 film, The Prestige, is just as mind-bending and captivating as I remember it. From the very first scene, I found myself completely drawn into the intricate battle of wits between Christian Bale's Alfred Borden and Hugh Jackman's Robert Angier. The film's narrative structure, with its Nolan-trademarked non-linear storytelling, adds an extra layer of suspense and keeps you guessing until the very end.One of the highlights of this rewatch was David Bowie's portrayal of Nikola Tesla. Bowie's performance is nothing short of excellent, capturing the enigmatic nature of the legendary inventor. His presence on screen is magnetic, and every scene he's in becomes instantly more intriguing. It's a testament to Bowie's talent as an actor that he seamlessly fits into the already stellar cast.Another standout aspect of The Prestige is David Julyan's score. It's sparse, yet incredibly effective in building tension and enhancing the film's mysterious atmosphere. The haunting melodies perfectly complement the story, and the score's minimalistic approach allows the performances and plot to take center stage. It's a masterful work that lingers in your mind even after the credits roll.As I followed Borden and Angier's rivalry, I became engrossed in their obsession with magic and the lengths they are willing to go to outdo each other. The film delves deep into themes of sacrifice, loyalty, and the consequences of one's actions. Each twist and turn in the plot challenges you, and the final revelation still leaves me in awe. The Prestige is a testament to Christopher Nolan's storytelling prowess. His direction is flawless, and he effortlessly weaves together themes of obsession, sacrifice, and the nature of illusion.The Prestige is a cinematic gem that combines a compelling story, brilliant performances, and a touch of magic. Christopher Nolan's direction is impeccable, creating a visually stunning and thematically rich experience. This rewatch reminded me of why I fell in love with this film in the first place, and it has only deepened my appreciation for its intricacies. If you're a fan of mystery, suspense, and thought-provoking narratives, The Prestige is an absolute must-watch.FORMAT: 4K Ultra HD Blu-rayVIDEO: 8.5/10.Native 4K presentation, Detail level: Good, Colour reproduction: Excellent, Level accuracy: Excellent, Encode: Excellent, Master condition: GoodAUDIO: 8.5/10.DTS HD-MA 5.1 audio, Dialogue reproduction: Excellent, Soundtrack & effects clarity: Excellent, Dynamics: Excellent, Surround sound presentation: Good, LFE content: GoodMOOFIEMETER: 9/10.",The Prestige,482571
55,joachimokeefe,"Atrocious acting, preposterous plot, sadly not a joke",1/10,25 January 2012,"'Prestige' starts as Jules Verne and ends as Star Trek on a bad day.Atrocious acting: Ever heard of 'Mummerset? It's the word used to describe the ridiculous accent that actors use to indicate they're from the English countryside, the sort of 'ooh-arr' sound that Robert Newton makes in 'Captain Blood'. In 'The Prestige', the ridiculous accent used is 'Mockney', the one actors use to sledgehammer that they're from London. Luckily for Michael Caine, he was born an East Londoner, but the rest of the troupe in this pile of tripe look and sound like they're auditioning for 'Eastenders' (a dreadful UK soap), trying to out-gorblimey each other. Caine does his usual reliable turn as the worldly-wise buddy who's powerless to stop things going wrong, as seen in 'The Man Who Would Be King'. And go wrong they do. When David Bowie is the actor giving the best performance in your movie, you're in trouble. The interchangeable cardboard magician's girl assistants do not manage the transition from TV acting to big screen at all. Caine once did a TV 'masterclass' about screen acting, the upshot being that you shouldn't blink in closeup - note how all the other actors fail to observe this rule, and it shows Caine was right.Preposterous plot: The movie opens with the death of Jackman, where Bale is on Death Row for his murder, and is told partially in flashback to when Bale and Jackman are rival magicians. Bale, for some reason he can't remember, contrived to cause Jackman's wife to die in a trick, so that naturally Jackman is obsessed with revenge. He's also obsessed with discovering the secret of Bale's 'Transported Man' trick, where the magician instantaneously moves from one side of the stage to another. Now at this point, about an hour in, I thought I'd guessed the ending. Jackman has to hire a double in order to pull off Bale's transportation trick; the only problem is that he ends the show beneath the stage while the drunken, stroppy double gets all the applause. (Somewhere along the way, Jackman acquires a wooden leg, which appears overnight, but doesn't seem to inconvenience him beyond a slight limp). Of course, I thought - Jackman eventually gets the double to perform the 'Pledge and Turn' (the opening premise of the trick), so that the double is the one who gets drowned in the tank placed below stage by Bale. I was wrong. We are eventually asked to switch from a reasonably atmospheric period melodrama (think 'The First Great Train Robbery') to schoolboy science fiction. Jackman, at vast expense of which we get no explanation, buys a cloning machine - yes, a cloning machine - from real-life distinguished inventor Nikola Tesla (Bowie). Every time he performs the trick, Jackman dies and is cloned back to life, in the traditional 'Star Trek' transportation manner. What? WHAT? Just as well Tesla's machine didn't work, or he'd be back to give Christopher Nolan a piece of his mind. Sadly not a joke: if 'Prestige' were even just a little tongue-in-cheek or camp, you might be able to feel that your intelligence was not being not just insulted but placed in the stocks and pelted with rotten vegetables, ordure, and pseudo-science as seen in ads for hair conditioner. No, 'Prestige' is deadly serious about itself as a history lesson and as a drama. Starting as Edgar Allen Poe meets Jules Verne, it ends up as Doctor Who meets Star Trek, and it's a train wreck. A terrible film.",The Prestige,482571
56,ajaws4ever,The best movie of the year! (minor spoilers),10/10,30 October 2006,"The Prestige is awesome! You have not seen a better movie in years! Hugh Jackman, Christian Bale, and Michael Caine are going to win some awards, let me tell you. And so is the screenplay. It's completely astonishing! The whole movie is! Robert Angier (Jackman) and his assistant, John Cutter (Caine), are into magic. Robert is the illusionist, and John is his assistant with building and testing illusions. When a man picks two volunteers to tie a woman (Robert's wife) to bind her in ropes so she cannot possibly escape the water cage (like one of Houdini's escape tricks), it all gets interesting. The two volunteers were Robert Angier and Alfred Borden (Bale), who didn't even know each other until that day where that woman -- who was Angier's wife -- drowned in the water cage all because Alfred Borden tied the knot in the assistant's hands wrong. She couldn't slip out of the knot. She died.Now Robert is angry. He shoots Alfred's hand later on in the movie, losing two of his fingers. Now, they are fighting at each other, not physically, just apart. THE TRANSPORTING MAN ILLUSION is a wonderful illusion that Alfred Borden made up, and now Robert is trying to steal his secret. He has become obsessed. So, he makes it better. BUT THERE'S TOO MUCH! JUST SEE THE MOVIE! Oh, and for those who pay attention to music in movies, you'll be disappointed. There's not much music to pay attention to. There's just some violins and other orchestral instruments here and there and occasionally there's a, ""BOOM"" of a timpani when you're supposed to be shocked or surprised at something.Sorry if I gave too much away, just PLEASE agree with my comment. I don't get any people who agree with my comments. I would greatly appreciate it.My MPAA rating: PG-13: Thematic Material, Some Very Startling Scenes of Violence, and Disturbing Images My Canadian rating: 14A: Frightening Scenes, Mature Theme, Violence",The Prestige,482571
57,cgtam,Great acting & cast; plot has few big holes to make this a fantasy film,7/10,25 September 2023,"Enjoyable film IF viewer ignores obvious plot flaws. Hugh Jackman is born in ""top class"" in England, meaning he would speak, & have an affluent aura during this time period. He would be forced to act, speak, eat & posses the mannerism of a low class working peasant, which would be exhausting and a magic act in itself.The other big flaw is Bale's double & all prosthetics he wears as disguises. Caine's character is a master & experienced ""magician engineer"" who creates doubles. How can Caine & Hugh NOT see all the fake disguises on Bale's secret double, especially after capturing & interrogating him? Hollywood mission impossible style facial make up wasn't invented yet. Even if modern disguises were used, in real life, one can spot such disguises, especially bc they're BOTH magicians. Viewer gets to see plethora of facial fake parts in Bale's home, & they look truly fake. Last, Caine switching allegiance because he sees the truth at the end- Jackman has so much $$ & freedom due to his birthright, he could have kept his secret from Caine & the ending would've been very different.Acting is excellent from entire cast. If one can not dwell on obvious plot flaws, this film is enjoyable & rewatchable.",The Prestige,482571
58,wolcottalexander,Absolutely Terrific,9/10,7 August 2021,"It doesn't rely on special effects at all so it does not age in the slightest. Just a unique story with excellent writing, professional directing, and wonderful acting from an all-star cast, which never gets old. This was a great movie when it came out 15 years ago, is a great movie now, and will be a great movie 30 years from now too. My only knock is that it requires some intentional ""suspension of disbelief"" in a few spots in order to make it work, but otherwise it's perfect. It is so good that it merits multiple viewings and I still look forward to watching it again. I put it in league with ""The Sixth Sense"" where the first time you watch it is superb but you have to watch it at least twice in order to really appreciate how good it is.
                
                    4 out of 5 found this helpful.
                        
                            Was this review helpful?  Sign in to vote.
                        
                        
                    Permalink",The Prestige,482571
59,The_Void,Mystifying modern film-making at it's very best!,8/10,21 June 2007,"The Prestige is quality modern film-making at its very best. Christopher Nolan has proved himself to be a director to watch after his successful reinvention of the Batman series, and now this film; different in theme and tone to Batman, and for my money, much better! The brilliance of this film comes from many different areas - the acting performances and the professionalism of the film shown throughout go a long way towards ensuring that The Prestige is an excellent film, but really it is the story that makes this one stand out. The film is based on a novel by Christopher Priest and focuses on magicians in nineteenth century London. Robert Angier and Alfred Borden are magicians and friends working as assistants to another successful magician. Their friendship turns sour, however, when Alfred makes a mistake that leads to the death of Robert's girlfriend on stage. This leads to a fierce rivalry between the two magicians, and after each one sabotages the others' magic show; the rivalry takes a new turn as they battle to see who can carry out the greatest magic trick...The plot doesn't develop linearly, rather Christopher Nolan chops and changes the exact point in the story where the film is running from, and this works really well as everything always feels fresh and inventive and Christopher Nolan is clearly a director capable of handling this sort of feat. The Prestige features an all star cast, and all perform excellently. The male leads are obviously the main standout. Christian Bale has really proved what a great actor he can be over the past couple of years, and his performance here still works despite the fact that he sounds a lot like Grant Mitchell from Eastenders. Hugh Jackman is good also and he gets to show more of himself than he did in the X-Men films, while the likes of Michael Caine and David Bowie fill out the supporting cast. The cinematography on display is absolutely fantastic, and the film does an extremely good job of recreating nineteenth century London. The special effects are good also, and the scenes involving Tesla's machine are all standouts. It all boils down to a terrific and suitably mystifying conclusion and overall, I really recommend that everyone takes the time to see this film. The Prestige really is one of the best modern films I've seen in years.",The Prestige,482571
60,nickmesafilms,The Prestige (2006) - Are You Watching Closely?,10/10,2 June 2011,"Christopher Nolan, the master of tricking the mind, comes back with his biggest hit since ""Memento"". ""The Prestige"" takes place in the Victorian era, where two rival magicians battle it out for each other's magic secrets, to create a more better magic trick, which will soon lead to serious consequences. The movie leads into unexpected moments, serious flashbacks, and edge-on-your-seat thrills. This film really tricked up my mind really well. There were many scenes in the movie that lead to twists and turns later on. Christopher Nolan is the only person that has a mind to trick the audience, and has a power to make a difficult puzzle of a movie that entertains audiences, and make them watch it over and over to understand the concept. The effects are glorious, the performances were superb, the music is dark, the film editing is super, the art direction is superb and the cinematography is golden. With a brilliant cast portrayed by Hugh Jackman, Christian Bale, Scarlett Johansson, Rebecca Hall, Michael Caine, & David Bowie, a mind-bending script by the Nolan Brothers, and a powerful plot containing twists and turns, ""The Prestige"" is a marvelous Nolan masterpiece, and it never disappoints! ""The Prestige"", in my review, ""A mind-bending puzzle that's fun to watch again and again"".",The Prestige,482571
