,User_name,Review title,Review Rating,Review date,Review_body,Movie_name,movie_id
21,ElMaruecan82,"""The Prestige"" starts well but cheats with its own premise...",7/10,25 May 2018,"There are many kinds of magic: wizardry à la 'Harry Potter', illusions or hallucinations, or entertaining shows: mediums, rabbits in top-hats, women sawed in half, bag-content guessing, magic cards etc. Speaking of cards, Christopher Nolan's ""Prestige"", made between two 'Batman' movies, lays its cards at the first voice-over monologue where we immediately recognize Michael Caine's smooth voice. It's about the third kind of magic and provides the three structural rules of an act: it starts with the Pledge: you show something normal then the Turn, you make it do something extraordinary... but there's an element of expectation and the higher your reputation goes, the more sophisticated the public. In fact, there's got to be something unpredictable, so it all comes down to the Prestige, the trick no one sees coming and will earn magicians applauses and guess what? prestige.Then, the least you can expect from the film is to follow these three rules even in the loosest possible way if it means wowing you with a spectacular surprise. And given that it's a Nolan film about the deadly art of illusion, much more opening with the killing of a magician, the imprisonment of his rival whom everything accuses, your twist-radar is set from the start, so not any twist will do. Whatever the prestige will be, if it's not venturing in the realm of feasibility, something will have been missed. We're dealing with magic after all, not fantasy, not sci-fi. I insist on the sci-fi element because the film opens with some electrical contraption that shakes its credibility from the start until a reassuring trap door shows and we can let a sight of relief go.French called electricity a Fairy so it all makes sense that magicians would use it as a device for generating illusion, just like rivals Edison and Tesla were perceived as wizards. After all, it's also established that magic is about what you see and what you don't and the use of lights and darkness is integral to the act. Still, I didn't like that machine. It felt incongruous and weird in a period drama and I was afraid Nolan would end up inserting some Batman-like device. And when he said in the ""making of"" video that he wanted to portray magic according to his personal vision of film-making, I thought ""no kidding?"", I'm pretty sure everyone got the parallel, especially when magical acts use special effects worthy of a Spielberg film. So Nolan gets a little carried away at the end while the first two acts of the movie had really gotten me involved, I mean the escalating rivalry between the two magicians Alfred Bowden (Christian Bale) and Robert Angier (Hugh Jackman) and their attempts to destroy one's act or find one's secret. What Nolan got right is that the rivalry mostly works as a foil to plunge us in the world of magic and know all the tricks. After all, that's the greatest thrill about magic, seeing how it works. For instance, the way a magician puts a dove in a cage and then flattens it to magically making the dove reappear under a handkerchief always made me scratch my head... but in this Dickensian universe where there's no pity for little children, why should there for innocent animals?The trigger of the rivalry also helps to understand how one of the most famous magic tricks, the ""escape from the tank water"" that made Houdini's reputation, is indirectly explained. Working as false audience members, Bowden and Angier are assigned to tie the magician's pretty assistant (Piper Perabo), one of them makes the kind of knot that doesn't leave any chance for the poor girl, who happens to be the other's wife. We gather that from then, it's personal. Another pivotal moment occurs when one conceives his masterpiece, an act that consists on getting in a door and coming out of another. He calls it ""The Transported Man"", for us, it looks like teleportation and it justifies why the rival is devoured by jealousy, although Caine's character can only see one explanation: there must be a double.At that point of the review, it's impossible to go further without spoiling the film. It's engaging enough to make you forget there's a twist but it's not spoiling the film to say that there's a twist, since it's the essence of magic. You've got to wow the audience with a surprise at the end. With the seemingly death of a character right at the start of the film, the battle to know everyone's tricks and the existence of a double, anyone could reassemble the pieces of the puzzle. But you know Nolan has more than a trick in his sleeve and that's both a blessing and a curse. Granted anticipations are to be toyed a little to be emotionally rewarded, all he had to do was working on the narrative structure to make what we know first a more effective reveal or a shock.Instead of that, Nolan relied on a far fetched revelation combined with an implementation that destroyed the whole atmosphere built throughout the film. From the start, we follow magicians who are dedicated to their passion, which is good, but the escalation toward sadism and some ends-justifying-the-means means made their whole approach to their art debatable, leaving no room for sympathy. In this cruel battle of wits, women are reduced to disposable pawns (Rebecca Hall and Scarlett Johannsen would get more dimensional roles in a certain Woody Allen's movie). The first two acts, we can call them 'pledges' and 'turns' are great but then the film goes downhill. One thing for sure, I hated that Tesla Machine, and no offense to David Bowie, but Tesla was quite a handsome fellow whom I doubt spoke with such a heavy British accent. Nolan wanted his film-making to echo magic, but he let the reverse thing operate.",The Prestige,482571
22,AlsExGal,Does anybody look better in a top hat and tails than Hugh Jackman?...,10/10,10 February 2019,"... but I guess that is really beside the point.Christian Bale and Hugh Jackman play two young British magicians - Alfred Borden and Robert Angier - trying to learn the tricks of the trade, somewhat even allied at first. Borden is a common Londoner, but Angier is to the manor born, using an alias in his magic work so as to not to embarrass his rich Victorian family. In the pursuit of a more fantastic trick a terrible accident occurs and Angier loses somebody close to him, vowing revenge against Borden, whom he holds responsible.These two are both the Roadrunner and Wiley Coyote to one another. Each one tries to sabotage and learn the other's tricks, make each other look
ridiculous, etc. Angier is the more dangerous of the two because he is truly intent on killing Borden when he infiltrates his ""catch the bullet"" act early on in the film and, instead, maims him. The rivalry ratchets up
to increasingly dangerous proportions. It is ultimately a fine piece of drama as to how far these two are willing to go in their obsession and for their art, with them both ultimately living tragic and miserable lives in the process. So much sacrifice for what most people would consider a trivial pastime. It is madness beyond obsession.This is a very entertaining and thought provoking film, and there is plenty of foreshadowing. Watch closely and watch it twice. I honestly don't think Christopher Nolan would be capable of linear storytelling if his life depended on it, but he is a master of this adapted material. At the end I could only go - ""Brilliant"".Scarlett Johannson plays Angier's lover who has a pivotal role in how the final act plays out. Rebecca Hall is Sarah, Borden's wife, who can't figure out why her husband seems to only love her on some days. David Bowie lends a real air of mystery to his portrayal of Nikola Tesla. But who else but Bowie could believably introduce his character by walking through lightning? Yes, the Tesla-Edison feud gets incorporated into the film and even a sci-fi angle is thrown into the plot. Michael Caine, as Jackman's magician mentor, seems to be playing his Alfred character from The Dark Knight. He has a supporting role, but watch him carefully, he has some of the most important lines of the film. And his final decision - do you think it was correct? Did two wrongs make a right in this unique situation?I wish I could tell you more, but I would give away the plot if I did. This is truly one of the better films made in the 21st century, and I largely don't like films made after 1960. Highly recommended and a real head scratcher, especially given the last line of the film.",The Prestige,482571
23,benm-41751,"Great entertainment, though it pigeonholes itself there",7/10,13 February 2018,"This movie is very engaging and intriguing. You are presented with a complete mess of scenes which go back and forth through time and are needlessly confusing, yet the core story and the characters were compelling enough to keep me interested and paying attention. The cinematography, the sound, the acting, and the visual elements are all perfectly in place, and overall its very entertaining.My only concern is that the film prevents itself from achieving greatness by relying heavily on a very cheap, shallow plot element. It becomes science fiction, which is fine but a bit strange after spending so long convincing me the characters are real. This is something I find with all of Nolan's movies, that they present themselves as being mysterious and secretive but fall a little flat if you apply any brain power to them.Still, I think this movie is worth watching if you're looking for something a little suspenseful, a little creepy, and very entertaining. Maybe the movie's ultimate goal is the same as a magician's, as said in the movie: that one moment where the audience is in awe and disbelief.",The Prestige,482571
24,classicsoncall,"""It is very rare to see... real magic.""",8/10,27 November 2011,"Oh man, this one had me right up to the part with the transporter/duplicator machine. Until then it was a compelling and complex tale dealing in murder, mystery and intrigue with a clever backdrop of magicians attempting to outdo each other with the grandest illusion of all time. What I'm not going to do is go back and watch this three times in a row like I did with ""Memento"" because when all is said and done, I won't be any better off. In a way I felt cheated that an 1880's era film would bring in a fictional sci-fi element the way it did. It seems to me the story could have gotten around that contrivance to come up with a more realistic resolution that confined itself to existing science and techniques of illusion. Then, when Borden (Christian Bale) had his final showdown with Angier (Hugh Jackman), he could have caught the bullet to end the picture on a more promising note. I don't really mean to sound so harsh on the film because like I said, up to the Tesla part this story was going great guns. Maybe because the guy portraying Tesla looked so much like David Bowie, it kept me off stride for a while as well. Then it turned out to be Bowie when the credits rolled, and I was back to thinking about that business with the cats and the hats. Maybe the whole thing was an illusion.",The Prestige,482571
25,girlwithpen,This movie fills the screen and your mind.,10/10,21 October 2006,"I couldn't help myself. I just kept saying ""wow, what a beautifully crafted film,"" all the way home, and around my house when I arrived home. I have not been so captured and entertained in a long time. I was especially enamored with the screen writing and how tightly and beautifully the visual metaphors tied in with the writing, and with the impact of the human message about obsession, competition and retribution carried to the extreme. One can relate to this personal human struggle for victory over another at all costs on a much grander scale, as the two magicians could easily be symbolic of how leaders of countries come to blows with each other, at the expense of their women and children -- something we struggle with right now in our world. There are deeper layers of this film that will be uncovered over time.Hugh Jackman, Christian Bale and Sir Michael Caine all contributed stunning, emotional performances. Rebecca Hall, who played Sarah to Bale's Alfred Borden, turned in a highly charged performance as well, making Scarlett Johansson's Olivia flat in comparison. And although some people thought the plot line a bit tedious, I found it to be refreshingly complex and engaging, while not being so complex as to lose you. If you can't follow this one, you've been watching television too long. And who cares if the illusions are mundane or scientifically unbelievable? Isn't that what both movies and illusions ask us to do? To suspend disbelief? Meantime, there's a message in its madness. Hello.The film is visually moody and evocative, easily transporting you into the time period. What more could you ask for? A film is a visual medium and this one is a visual ten. The acting is superb as well as the plot. It keeps you interested; it keeps you guessing right to the shocking but most appropriate end.It asks you, what is one willing to sacrifice for the ""prestige?""I think this one's an Oscar definite.",The Prestige,482571
26,kosmasp,(Magic) Layers,10/10,19 October 2010,"I really don't know where to start. The great production design, the fabulous acting, the great cinematography, the superb writing, the awesome directing ... I really don't know. But I do know, that this is another Nolan movie. Which kinda is a trademark or became one for me. That is why the number one movie I was looking forward in 2010, was ""Inception"".But I will get into that other movie on its own page. If you haven't watched any Christopher Nolan movie yet ... well it's almost not possible. Even if you got away from all the buzz Memento created, it's almost impossible, that you haven't seen at least one of the Batman movies he made. Then again you might not be into that sort of movies. And that's the great thing about Nolan. Making entertaining movies, that have substance.Maybe Insomnia is his ""weakest"" movie (if you count the reception it got) and ""Following"" was just a student film, but even those two are a showcase of his talent. But then again, I might be just a fan-boy drooling about achievements that you think are not worthy mentioning. You have to make up your own mind ... start with this mind-boggling or with any other of his movies ... Repeated viewing is almost necessary! And you will most likely want to anyway!",The Prestige,482571
27,The-Sarkologist,The Magician's Secret,8/10,7 April 2022,"Well, I have managed to get around to watching this film, which I believe is the last of the Christopher Nolan films that I have to watch, and sure enough, it is as impressive as pretty much all of his other films. While on one hand it just seems to be a film about a couple of stage magicians who are bitter rivals, there is actually much more going on, and of course the time line doesn't move in a linear way either, which is something that Nolan definitely seems to like doing in this films.It opens with a court case, where one of the magicians is on trail for murder. The idea is that one of the cases, namely a case that is full of water, and there is a catch on the case that allows it to be opened from the inside. However, it locked, which meant that the magician that was in the case of water ended up drowning. It seems to be pretty clear cut, but it turns out that there is much, much, more going on. In fact, the film jumps between what is happening during the court case and afterwards, and the events that lead up to the court case.The concept of the prestige is that there are three stages to a magician performing his act, and the prestige is the one that is left for the end which completely astounds the audience. Of course, such acts involve a lot of slight of hand, and of course there is this idea that a magician never reveals his secrets. However, rival magicians are always trying to find out what is going on in the background, so that they can mimic the trick. The situation here is one of the magicians is much more of a showman than the other, however the other magician has a much more impressive trick which he is trying to replicate.The interesting thing is that we have Nicola Tesla in the film, who is commissioned to build a machine that will allow the trick to be performed (and I don't want to give too much away considering that it is all a part of the suspense). As such, there is some science-fantasy elements in this film as well, so it is more than just a lot of slights of hand. Well, there is that as well, because as the film progresses, and of course reaches the end, which you could consider to be Nolan's prestige, everything is revealed, and it is definitely quite shocking.Another thing are the actors that appear in this film. We have Michael Caine, who happens to be a staple in pretty much all of Nolan's films, but there is Hugh Jackman, Christian Bale, and surprisingly David Bowie as Nicole Tesla. Apparently it was some effort getting Bowie into the film, namely because Bowie tends to pick and chose the roles that he plays, but when he does appear in a film, it is absolutely outstanding, and this film is definitely no exception.This is definitely a film to watch, especially if you appreciate Nolan's work. Mind you, it did take me a bit to get around to watching it, but when I started watching it, it was really hard to tear myself away from the movie, but then again Nolan's films are definitely a lot like that as well.",The Prestige,482571
28,artistgp,Masterfully Handled!!!,10/10,23 February 2012,"I continue to be blown away at how fantastic this film is. It is executed with extreme precision. Every aspect of the film, all the way from visuals to the character development, is masterful.I'm not sure how it fared awards wise upon its release, but it should have racked up quite a few. The story is wonderfully layered, the acting is superb, the directed is spectacular, etc. I can't find anything about this film that I would change.Congratulations to the entire team that put this project together. I consider it one of the best films of all time.If you have the opportunity I strongly urge that you check this film out. I think you'll be glad you did.
                
                    24 out of 37 found this helpful.
                        
                            Was this review helpful?  Sign in to vote.
                        
                        
                    Permalink",The Prestige,482571
29,ceeingred13,Remarkable. Nolan's best,10/10,29 February 2012,"This movie was truly a game-changer for me. I initially saw it simply because I enjoyed some members of the cast so much (Bale, Caine, Bowie), but I left the theatre in awe. It is such a well-written, layered, intense, character driven story on par with Faustus or Jekyll and Hyde in terms of characters that are overly driven by their obsessions. It invites you to watch in the first lines of dialogue and from that point forward, you hardly have a choice. One of Nolan's strengths is that he doesn't shy away from difficult stories to tell. None of the characters are entirely likable. It's hard to pick someone to root for, but that is one of the things that makes them so human. Jackman and Bale are both fine actors that attack their roles with tremendous capability and Rebecca Hall is one of the best discoveries I've had in movies. Even Johansson, who is easily the weakest link, was used sparingly and didn't detract from the movie. The plot is fascinating and leads to an immensely satisfying ending. I can't watch this enough times.
                
                    18 out of 25 found this helpful.
                        
                            Was this review helpful?  Sign in to vote.
                        
                        
                    Permalink",The Prestige,482571
30,cogleone,I'm addicted to it,10/10,18 July 2007,"Every so often I see a film that I get addicted to. As soon as I watch it in the cinema I know I'm going to buy it the day it comes out on DVD.Well The Prestige is the latest of these. This film gets better and better with each viewing. Hugh Jackman should have won many awards for his role. People say ""Oscar"" but there are better awards out there than that, the Oscars are about as representative of what's the ""very best"" as the IMDb's Top 250 list is.People have told me that they predicted the end, well that's their funeral, I never clicked until it was revealed for me, so I got much more value for my money.Christopher Nolan is a master. Even though he seems quite humourless in his DVD extra interviews. He makes extremely entertaining films that are well cast and superbly executed, just as the Prestige is. All those who never liked the film should be rounded up in a field and used for crazed scientific experiments, we could use Tesla!",The Prestige,482571
31,majikstl,Now you see it ... Now you wish you hadn't,5/10,30 October 2006,"Sometimes I think movies are losing their magic. Over the years I have learned so much about the movie making process -- about how stunts and special effects are done -- that movies just don't amaze me quite as much any more. It takes a movie made with remarkable skill to make me forget the process that goes on behind the scenes to make the movie magic believable.To a great degree I suppose that is also true of magic as a performing art. The levitation trick or the sawing-a-woman-in-half bit may be eye-popping to one as a child, but eventually the magic of magic comes from learning the secret of the trick. The irony, of course, is that learning the secret usually destroys the magic. Knowledge is the natural enemy of illusion and magic (cinematic or sleight of hand) can only dazzle if it is so skillfully performed that the technique outweighs the mechanics. In short, achieving the ""Wow!"" before facing the question of ""How?"" THE PRESTIGE understands this, and yet it doesn't. It is, for most of the way, a flamboyant display of magician's showmanship, yet it builds up to a revelation of ""How?"" which comes off as something of a cheat. When the film gets around to revealing the secrets of its tricks, the reality seems far less credible than the illusion of supernatural power. The fake reality of illusion is explained with an even faker illusion of reality.The film deals with two turn-of-the-century London magicians whose rivalry as competing showmen is fueled by ever-escalating acts of revenge. They strive to not just top each other as performing artists, but to sabotage each other as hated enemies. Hugh Jackman and Christian Bale play the competing wizards (Robert ""The Great Danton"" Angier and Alfred ""The Professor"" Borden), who form an emotional juggling act, constantly tossing back and forth the roles of villain and victim. Like a magical coin, sympathy for either man disappears and reappears at unexpected intervals. Likewise, director Christopher Nolan keeps all of his balls in the air, telling the story with flashbacks within flashbacks in a way that is not nearly as confusing as it could have been. All in all, a very intriguing concept for a movie.Unfortunately, the filmmakers become would-be escape artists and place their film and the two protagonist into traps from which they can't seem to logically escape. Both magicians focus their attention on ""The Transported Man"" trick, which would appear to require the trickster to be in two places at once. But after promising not one, but two elaborate answers to how they did it, the film builds to a pair of shaggy dog endings, neither of which play fair with the audience. Alfred's secret seems so obvious in retrospect that viewers should have complete permission to slap themselves on their collective forehead for not seeing it coming a mile away. But the film cheats; revealing the secret early on by denying it as a possibility.On the other hand, Angier's secret takes a totally unconvincing sci-fi twist that not only doesn't play fair with the concept of magic as the art of illusion, but also defies the basic laws of physics. The story doesn't just cheat, it tries to change the trick in the middle of the performance. You don't leave the film feeling amazed; you leave feeling vaguely insulted, like the master illusionist has played you for a chump.Though lacking in humor (a vital distraction in creating illusion), THE PRESTIGE is a grandly played stunt, full of craftsmanship, showmanship and style. But it is like watching a magician who promises to produce a tiger out of thin air, but can only conjure up a kitten. The result isn't either ""Wow!"" or ""How?"" but ""Huh?""",The Prestige,482571
