,User_name,Review title,Review Rating,Review date,Review_body,Movie_name,movie_id
71,pyrocitor,Are you watching closely?,10/10,21 October 2006,"2006 has certainly been the year for very similar movies being released in pairs. First both Hollywoodland and The Black Dahlia slunk onto mainstream screens, both having almost identical plots set in the same time frame. Then came Infamous, another take on the Truman Capote story, which won Philip Seymour Hoffman the best actor academy award last year. And now, the theme of deception and magic seems to have infiltrated the screens, with the emergence of The Illusionist, starring Edward Norton, and... Christopher Nolan's The Prestige, detailing the story of two rival magicians constantly competing to upstage the other, their deadly game reaching increasingly higher stakes. Although comparisons between The Illusionist and Prestige may seem inevitable, safe to say that both are very strong films with admittably incredibly similar plot lines, but in terms of a superior, in areas where Illusionist stumbles, The Prestige seems only to soar, seeming to surpass all audience expectations. Just when the audience feels like they have figured out every last trick The Prestige has to offer, Nolan pitches them a new handful to wrack their brains over. Rather than getting caught up and getting lost in this convoluted structure, the film seems to revel in it, each twist seeming to only improve the quality and intrigue of the film. It's a testament to Christopher Nolan's incredible skill as a director and writer that he has shown such a run of success in film-making, having had arguably nothing less than a hit thus far, starting with his barely financed but incredibly successful thriller Momento, all the way to last year's incredibly well made Batman Begins, one of the strongest superhero films to date. Nolan seems to really thrive on unusual plot structures, showing a tendency to start the film right before the end of the story, then flashback throughout the course of the film, with occasional jumps back and forth in the storyline to keep the viewers watching closely. (Batman Begins also used this exact structure) It also goes without saying that Nolan retains his usual eye for costumes and set design, and the Victorian age has never looked so sumptuous as under the eyes of Nolan. He is without a doubt one of the most innovating and interesting directors around these days, and we can only hope a Batman sequel is indeed in the cards for him.Another major aspect in which The Prestige surpasses all potential peers is in the phenomenal cast. If such a cast has been assembled anytime of late, it is unlikely it was to such powerful effect, as each cast member contributes a simply wonderful performance to an already astonishing film. The casting of Hugh Jackman and Christian Bale alongside each other is already enough to provoke mouth watering in about 98% of the population, whether admiring them for talent, looks, or the prospect of Wolverine and Batman sparring off. Either way, they are easily the acting standouts, and both deliver Oscar nomination worthy performances endowed with incredible charisma and skill. (Jackman comes across as the stronger, seeming a bit more emotionally genuine, but it's debatable as to which is the more acclaim worthy as they both deliver such sublime performances) Michael Caine is a classy and brilliant touch as the engineer Cutter, and a rare appearance from David Bowie as electrical inventor Nikola Tesla is a perfect piece of casting, as Bowie's appearance in the film seems to rival that of his character: elusive, exciting and and mysterious. Scarlett Johansson delivers a fine performance as Jackman's character's stage hand, despite several cringe-worthy slips of her Cockney accent, and Rebecca Hall has a somewhat repetitive role to deal with as Bale's character's wife, but still gives a great performance in the end. And of course, it's always great to see the vastly underrated Andy Serkis give yet another top notch performance as Tesla's assistant. All in all, The Prestige is an incredibly classy and powerful film event - packed with more twists and turns than any viewer, no matter how clever would be able to predict, and fueled with an astonishing cast giving wonderful performances, headed all the while by careful yet powerful writing and directing, on the part of Nolan, who can seem to do no wrong. We can only hope that more movies of this caliber come to theaters soon, as The Prestige is one of the most interesting, genuinely gripping and entertaining thrillers in recent film history. -9.5/10",The Prestige,482571
72,pinkliz41,Real Magic!,10/10,3 August 2008,"The Prestige is significantly brilliant. From the tense acting to the beautiful directing, all the aspects exceed my expectations. Christopher Nolan (Batman Begins, Memento and The Dark Knight) continues to pursue brilliance. And quite literally has reached it. All of his films are of such perfection that no other director that i can think of could ever come close. His efforts in creating The Dark Knight for example are beyond anything i have ever seen before.Christian Bale (American Phyco) and Huge Jackman (X-Men)both play rival magicians. But when Alfred (Bale) performs the ultimate magic trick, his former friend turned enemy Robert (Jackman)tries to find the secret in the trick. Each twist and trick leaves the audience wanting more and when the credits roll you would feel like this film is deserving need of the best picture Oscar. And quite rightly so.",The Prestige,482571
73,Tweekums,Rivalry and obsession in the world of magic,9/10,26 May 2016,"This film tells the story of two rival magicians, Robert Angier and Alfred Borden, in late Victorian London. After a brief introduction we see Angier drown as a trick appears to have been sabotaged by Borden and the latter in put on trial for his murder but are things what they seem? The story then unfolds from the time they were friends to the final revelation concerning what really happened in that opening scene.Angier and Borden's friendship is irrevocably broken when Angier's wife is killed when a trick goes wrong; Angier is convinced that it was Borden's fault. The two go their own ways and put on rival magic shows. Angier sees a chance for revenge when Borden attempts the famous 'bullet catch' trick; he hides himself amongst the crowd then volunteers to be the man who pulls the trigger, slips a real bullet into the gun and pulls the trigger; Borden survives but loses two fingers. Time passes and Borden develops a new trick; 'The Transporting Man'. This seemingly impossible trick sees Borden enter one cupboard then emerge from another almost instantly. Angier is desperate to replicate the trick but can't figure out how it is done. His ingénieur (trick creator), Cutter, is certain that it must involve a double but Angier is certain that the only man on stage is Borden. He performs his own version, using a double but is unsatisfied; determined to learn the truth he sends his stage assistant, Olivia Wenscombe, to pretend to work for Borden to learn the secret; she steals his notebook but it is encrypted. Angier forces Borden to tell him the key word (Tesla) and this leads him to search out scientist Nikola Tesla in Colorado to get the equipment he needs this ultimately works but not in a way anybody would expect.Anybody familiar with the films of director Christopher Nolan will know to expect the unexpected and shouldn't be put off by the non-linear narrative it isn't just that the story is told in flashback; instead it moves back and forward revealing aspects of the story. This isn't just a gimmick as it works to make things interesting. The way the two magicians' rivalry escalates perfectly encapsulates their obsessions; not just to be the best but also to destroy the other. The cast does a fine job; most notably Hugh Jackman, Christian Bale and Michael Caine who play Angier, Borden and Cutter respectively. They are ably supported by Rebecca Hall and Scarlett Johansson as Borden's wife Sarah and Olivia Wenscombe, there is also an enjoyable cameo from the late David Bowie as Nikola Tesla. The final resolution is rather surprising; largely because it is blatant science-fiction rather than a magic trick this might disappoint some viewers although others will enjoy the dark twist when they realise the secret behind Angier's version of 'The Transporting Man'. Overall I'd certainly recommend this impressive and intriguing film.",The Prestige,482571
74,Quinoa1984,"a basic tale of one-up-manship, but done in a great fashion of professional storytelling and acting",8/10,29 October 2006,"The Prestige is like a machine of tricks and wonders, and it ends up pulling off a lot more than it might have not been able to chew. Co-writer/director Christopher Nolan is very much in his territory here with this picture, and the sort of jigsaw-figure-out effect he had on his breakthrough Memento is redeployed here in a style that is never too deterring. He focuses so well on the two main characters, and the people focused around them, that there's no need to really feel as if one is being pulled away from the real emotional drive of each character. It's basically one big game that becomes something very dangerous once obsession becomes part of it (as Michael Caine's character notes is what children do). But all the while I went along totally well with what the story went through, in all its twists and pulling seemingly simple little turns out of a hat, because Nolan made the storytelling seamless and has actors that are utterly dependable and pitch-perfect in their roles.Christian Bale and Hugh Jackman play the magicians, who start out as partners under the tutelage of Michael Caine's Cutter, who perform acts of not-totally-simple 'magic', which follow three main principles which are listed by Cutter at the start and end of the picture. After a tragedy that befalls their assistant (Piper Perablo), the rivalry and, more crucially, the aims and wills of each side is put into play. On one side is Bale's Borden, who is, according to Jackman's Angier, living his entire life as a trick, which may not be far from the truth (hope that doesn't spoil things). On the other is Angier, who becomes involved with the burgeoning technology of Nikola Tesla (David Bowie, who is one of the lesser factors of actors in the film), who may be able to figure out how to make something truly unbelievable. Their fates become entangled in each side's pursuit to out-do the other in the public eye, with Cutter and the change-around mistress (Scarlet Johanssen, in a spiffy English accent that works), on the sidelines.What makes a lot of this more compelling that it almost has a right to be is how much we're steeped into the mind-sets of these characters, who they get fractured by their own separate ambitions amid their skills. One is a better magician, while the other is a better showman, and each can't stand the other's talents in the midst of being somewhat intrigued and drawn to a kind of madness. And yet at the same time the personal also finds its way into the trickery of the film, and actually grounds things- seemingly of course- particularly with Borden's wife (Rebecca Hall, one of the best in the film acting-wise) who feels betrayed by the pack of lies and secrecy. The fates then of both characters becomes that of dealing with mortality, and how one can cheat death or not, or again, and again. Towards the end it does teeter much on becoming one extra ending that might not be needed, or a couple of minutes that feel packed in too tight.But all the while Jackman and Bale are constantly compelling, with little things they have in their characters that make them very much real for us, and then makes the final twist not too unworthy of what led up to it. It's like a twist mountain, or rather, a prestige. It might not be the best kind of 'prestige' I've seen, yet I still highly recommend it as a cool treat of splendid storytelling in a story that teeters on leaving the audience with too much of a gasp in the extraordinary, and has just enough to pull back and have a few good surprises. It's one of the best productions to come out this season.",The Prestige,482571
75,jon.h.ochiai,The game for the young,10/10,22 October 2006,"Before Rupert Angier (Hugh Jackman) travels to Colorado to find scientist Nikola Tesla (David Bowie), Cutter (Michael Caine), magician mentor, tells Angier, ""Obsession is the game of young men"" In Director and Writer Christopher Nolan's ""The Prestige"" obsession spirals into deadly rivalry. The Prestige refers to the Third Act of a magic trick. In Act One: The Pledge shows the ordinary. In Act Two: The Turn, the ordinary becomes extraordinary. In Act Three: The Prestige, the twist occurs and we see something shocking. Writers Christopher and Jonathan Nolan's ""The Prestige"", based on Christopher Priest's novel, embodies these three acts. The third act of ""The Prestige"" is a shocking surprise. While watching ""The Prestige"" I guessed half of the twist, but not everything, and was completely mesmerized by the end. ""The Prestige"" starring Hugh Jackman and Christian Bale is an engrossing dark tale of revenge that is one of the year's best.I had read that Priest's novel had an innovative narrative style where the story is retold by the rival magicians Angier and Borden, wherein the truth is revealed. Christopher Nolan and Jonathan Nolan unveil a captivating yarn through exchanged diariessee the movie. We are clued in from the on set, when Alfred Borden (Christian Bale) instructs us, ""Watch closely"" In the beginning Angier (Jackman) and Borden (Bale) are young magicians under the tutelage of Cutter (Caine). Angier's beautiful wife Julia (Piper Perabo) is a magician's assistant. However, in a magic trick turned fatal, Angier and Borden transform into enemies obsessed with revenge. Their obsession escalates into apparent murder. ""The Prestige"" perfectly casts with Hugh Jackman and Christian Bale. Jackman and Bale are among the screen's most powerful actors. It is interesting and not coincidence that Jackman and Bale have achieved acclaims playing superheroes: Jackman as Wolverine in the ""X-Men"" movies; Bale as Batman in ""Batman Begins"". However, there are no heroes in ""The Prestige"". Director Nolan brilliantly leverages their contrasting styles and intensity. Tony Winner Jackman plays the brilliant showman Angier, who is talented, but smart enough to sense that Borden may be the more gifted magician. His hatred for Borden is boundless, even dismissing his assistant and lover Olivia (very good Scarlett Johansson) to discover Borden's secrets. Borden (Bale) is the brooding pure student of magiche has the eye. Borden marries Sarah (Rebecca Hall), and they eventually have a daughter Jess (cute Sammantha Mahurin). However, good woman Sarah suffers in the relationship of secrets. Borden becomes a star with his ""Transported Man"" trick. The jealous Angier believes that Borden is performing true magic. After several twists and turns, Angier is convinced that his own quest for 'true magic' lies with Nikola Tesla (Bowie), the Father of Magnetism. The true magic he seeks is apparently, science.Christopher Nolan (""Memento"", ""Batman Begins"") infuses a sense of wonder and tragedy in his dark tale. Ultimately, his ""The Prestige"" is about the cost of losing one's soul on the path of vengeance and fame. Hugh Jackman is simply powerful. As Angier he is a man whose life takes a dark turn, and becomes obsessed discarding almost all of his humanity. Jackman's intensity and vulnerability make Angier's quest sympathetic, but never enrolling. Jackman is masterful and charismatic in this balancing act. He has a commanding presence and voice. His performance is Oscar worthy. Equally powerful is Christian Bale as the conversely internalized Borden. His Borden is the consummate magician, always creating. Bale's intense understated performance hints at the anger and drive just below the surface. Jackman and Bale have an amazing screen partnership that is a paradox of styles. The scenes where both discover that they have been betrayed are stunning. Michael Caine is awesome as usual. Here he wonderfully floats between the two leads. His final alliance is a complete surprise. David Bowie is absolutely great as Nikola Tesla, a completely original character.Nolan's ""The Prestige"" is an unsettling tale of revenge and deadly rivalry. Nolan navigates many twists and turns arriving upon an electrifying surprise in this story of all consuming obsession. Jackman and Bale each give their best performance in Nolan's parable of forfeited souls. ""The Prestige"" is one of the year's best movies.",The Prestige,482571
76,mike_76,a gorgeous film,9/10,28 October 2006,"What sets Nolan and this film apart is the content of this film, not the acting (the only weakness being the Scarlett Johannsons accent, which is easily overlooked) and not even so much the story (which is also quite good). The story is okay, but what really took my breath away was the atmosphere (much like in Memento). He creates the perfect atmosphere for his movies, his style is brilliant. The shots are just gorgeous. In my opinion he is leading the charge in giving movie-goers a different experience; watching a Christopher Nolan film is a hugely different and a much more absorbing experience than nearly any other director. Well, for me anyway, obviously the experience is a hugely subjective thing.This film is special. There are no real good guys, no real bad guys, just human struggles with that hedging of the supernatural that really gets you thinking. His films are not perfect in that they don't fit molds or answer all the questions. That is what makes this film special, it draws you in and really makes you question things; important things.However, the important thing is that it is a truly absorbing experience, what more can you ask of a film?",The Prestige,482571
77,neil-476,Unusual,8/10,15 July 2008,"The Prestige is an interesting and unusual movie, with a strong period feel and solid performances from the lead players.However, there are several elements which flaw the movie. One is Tesla's creation for Angier. Having as a Maguffin a machine which does something impossible not only negates the use of stage magic (based on deceptive illusions) as the centre around which the protagonists' rivalry is wound, it also takes the audience out of the movie and fatally weakens the first part of the denouement. Another flaw is Cutter's failure to act to rescue Borden from sentence of death once he discovers that Angier is not dead. Finally, and less importantly, David Bowie's accent as Tesla is a tad unconvincing.To compensate for this, Scarlett Johansson's mild estuary accent, complete with glottal stops, is excellent, pitched at a level where it falls short of blonde Essex girl.If The Prestige is ultimately less than 100% successful, it remains a worthwhile and entertaining movie nonetheless.",The Prestige,482571
78,anaconda-40658,Nolan's Prestige.,9/10,19 December 2015,"The Prestige (2006): Dir: Christopher Nolan / Cast: Christian Bale, Hugh Jackman, Scarlett Johansson, Michael Caine, Rebecca Hall: Spellbinding film about the explanations behind magic. Hugh Jackman and Christian Bale play rival magicians with a life long rivalry bent on figuring out the other. Controversy rises when a female apprentice drowns in a tank in a trick that backfired. Christopher Nolan previously made the best of the Batman series in Batman Begins as well as directing the clever thriller Memento. Here he examines the explanations and challenges of magic with tremendous sets and acts to overwhelm the mind. Jackman is excellent as an accomplished magician out to perfect the transporting act. Bale as the rival is married and has a daughter but spends much time in prison for murder. Scarlett Johansson plays an apprentice of Jackman's sent to achieve Bale's secrets. Finally there is Michael Caine who voices reason and the mystery behind it all. Rebecca Hall plays Bale's wife while Piper Perabo plays the wife of the Jackman character. Nolan is among the most intelligent of directors and seems confident in creating suspense as well as leave audiences guessing but the ending here may be questionable to some if not brilliantly vengeful. It doesn't believe magic so much as believe its illusion and utter disappointment. Score: 9 / 10",The Prestige,482571
79,nobbytatoes,Nolan is the real magician,9/10,15 November 2006,"Robert Angier and Alfred Borden have worked together since stage hands. Both wish to be the grandest magician, creating tricks that the world has never seen. Their friendship goes sour after Angier's wife, Julia, dies during 'the drowning woman' trick. Angier continues to build his act with craftsman Cutter, a designer for the illusions. Borden tries to crown himself as the greatest magician, yet lacks the style to drawn an audience. Borden and Angier's rivalry thickens after Borden performs the greatest trick 'The Transported Man'. Obsessed to know his secret, Angier is consumed to discover Borden's method.Angier is a showman. Style, grace and charm are his weapons. A magician relies on miss direction to fool us all. Angier is his own miss direction. His showman ship out reaches his craft, knowing his limitations and playing to that strength. After his wife death, revenge is his only driving force. He doesn't want to be the greatest magician, Angier wants Borden to know he will always be better than him, with no restraint to his conquest. Borden is no showman. Lacks pizazz and style, unable to make the simplest of tricks seem unreal to the audience. His hubris strains his progression, over confident in himself; but with reason. 'The Transported Man' is the greatest illusion beheld by any magician, he finally makes the simplest trick into the grandest of all; no wonder Angier becomes consumed with figuring out the method. They are each others opposite and equal, their antithesis. Their rivalry isn't one of brawn nor of words; they don't talk much after Julia's death. Their fights are of the mind, psychologically and game of wits to sabotage the other.Obsession and identity crisis is deeply explored through out The Prestige. Stated by Cutter, you can't be afraid to get your hands dirty. Though this is not about the death of a little bird for the sake of a trick, lives are torn and destroyed over two mens bitterness. Obsessed with each other, Angier and Borden's original identities are unrecognisable, with those they hold dear holding the brunt of each ones torture. The real magician of this act is director Christopher Nolan. Like a magician, Nolan draws us in nice and close. Cinematography by Wally Pfister, our view of the periodic time is confined and constricted. Our surroundings are blinded by whats happening. Smoke and mirrors, miss direction utilising the non linear time sequence, confuse us from what we are meant too see. Nolan is gifted with his craft as a film maker, playing with the audience. Offering his pledge, creating the turn, then the prestige of the final act, where the revelation finally emerges.Hugh Jackman and Christian Bale as Angier and Borden respectively, are both amazing. Jackman greatly evolves with Angier from a man of craft, to a man torn of revenge and obsession. Bale perfectly shows Borden torn between his love and his love of magic. Michael Caine shows his talent and perfect as Cutter. David Bowie is a real stand out in his minor role as Tesla. Scarlett Johansson wraps beauty and talent nicely.The Prestige is one film that is simple magic. Another mile stone from Nolan.",The Prestige,482571
80,DKosty123,Very Well Made Magic Tale,8/10,28 November 2017,"Christopher Priest's novel is given a class A film treatment here. With Jonathan Nolan and Christopher Nolan's top notch screenplay, and Christopher's Directing talents, this film comes off very well.Michael Caines Cutter character is good and his being the narrator is even better. Hugh Jackman as Robert Angier, and Christian Bale as Alfred Borden, the feuding magic men, and Scarlett Johanssons role as Olivia, the woman assistant between them are well acted roles.Magic and deception are the keys to the plot. There is a little romance but the key elements here are the feud between the men, who will stop at nothing to outwit each other.In the beginning, one lovely lady assistant dies as the result of a mistake by one of these guys when they are doing a joint act. After that, they split up because the dead woman was a wife of one of them. Then the rivalry begins.They claw each other until the death trying to find out each others secrets. This all takes place in the late 19th century, and the settings for this are magnificent. There are 3 elements to each magic act, and the final curtain is the Prestige, where the audience gets something they do not expect.In the case of this film, you have to watch the end of it to get what the movie viewer does not expect. It is very much worth watching. Very good film making here and the Nolans would go on to do Inception later on. This is a solid effort that shows how they got to the later film.",The Prestige,482571
