,User_name,Review title,Review Rating,Review date,Review_body,Movie_name,movie_id
58,Dr_Coulardeau,Freedom and justice are hard to conquer,8/10,14 July 2007,"One of these western films that was competing with young TV only by the size of the screen and the color. That will not last forever. So the rhythm is still slow and the picture is often centered on the faces and the general attitudes or postures of the characters. The story is simple though: the good suffering and submissive Mexicans or Indians who work hard, the banditos who exploit these farmers and the Yankee mercenaries who are going around fighting for the good cause of work and freedom. They are seven and only three will survive and two come back. They risk their lives for nearly nothing, twenty dollars, but for the sake of adventure and to prove they are the best shots, the best human beings, the best planners. The twist in this film is that they are successful first, then defeated and then successful again. That proves the point. They are ready to die to defend human decency, human freedom, justice, and to teach with their death how to fight, resist and conquer one's own freedom. A very light touch of romance is added, just enough to prove the point that man loves freedom and justice more than anything else. But let's say that four dead out of seven, fifty seven per cent casualties, that is poor productivity, even in the wild wild west.Dr Jacques COULARDEAU, University Paris Dauphine & University Paris 1 Pantheon Sorbonne",The Magnificent Seven,54047
59,claudio645,I'm not a fan of westerns but this one is a classic film,8/10,24 September 2016,"When I grew up it was sci-fi that took hold, with the advent of Star Wars, Battlestar Galactica, etc. and new, good westerns were few and far between. However, this was a western that slipped through the filter and struck me as such a good movie. Excellent acting from an all-star cast, an iconic score and archetypal script all contributed to being wonderful entertainment as well as a top-notch production.Having seen literally over a thousand movies, one of the highest praises I can give is to say I still vividly remember scenes decades later. The Magnificent Seven has quite a few scenes that fall under that category.
                
                    4 out of 5 found this helpful.
                        
                            Was this review helpful?  Sign in to vote.
                        
                        
                    Permalink",The Magnificent Seven,54047
60,MBunge,It'll be deja vu for anyone born after 1960,7/10,19 June 2012,"If you were born any time after the initial release of The Magnificent Seven, you probably wound up seeing it several times before you finally saw it. That's because this isn't just one of the greatest Westerns ever made. It's also the template for generations of ensemble adventure films that followed it. This movie has been copied, lifted from and made homage to so many times that you can practically make a drinking game out of all the genre conventions and clichés that originated here. Just about any motion picture made since 1960 where a bunch of guys are recruited for some mission will include one or more allusions to or imitations of The Magnificent Seven. There are better Westerns but few that have been as influential.A small Mexican farming village is sick and tired of giving up their crops to the bandit gang led by Calvera (Eli Wallach), perhaps the least ruthless Wild West outlaw in cinema history. The village sends three men north to buys guns so they can defend their land. When they ask the coolly collected and defiant Chris (Yul Brenner) to help them buy weapons, he suggests they hire themselves some gunfighters because men are cheaper than guns. With only $20 to offer in pay, Chris manages to assemble the sardonic Vin (Steve McQueen), the avaricious Harry (Brad Dexter), the stoic O'Reilly (Charles Bronson), the laconically deadly Britt (James Coburn), the haunted Lee (Robert Vaugh) and a desperate young man named Chico (Horst Buchholz).The seven head south to train the villagers for the showdown with Calvera and wind up facing their own fears of loneliness and isolation. When Calvera and his men arrive, the battle turns into a much more difficult and extended conflict that sees the Americans forced to decide if they're willing to die for the freedom of a little Mexican villageor maybe for the sake of their own souls.Now, while a lot of The Magnificent Seven will seem familiar to many viewers, you should know that the elements here which have been mimicked in so many other films have been streamlined, stripped down, truncated and abbreviated over time. Those flicks gave you the Cliff Notes. This is the original and its got a much more sprawling narrative than you might expect because this is a story that's about more than action scenes and clever quips. The dilemma of the Mexican villagers and how they react to it takes up a surprisingly large part of the film and a budding love affair between Chico and a village girl (Rosenda Monteros) is one of the biggest subplots of the production. You likely will find yourself wondering why young European actor Horst Buchholz gets so much screen time when there's a cast full of superstars and future Hollywood legends. Well, in fairness, Buchholz does a pretty good job here and it's not like the others get short shrift. Brenner, McQueen, Bronson, Vaughn, Coburn and even Dexter all get their moments in the sun, but director John Sturges clearly thought Buchholz was going to be the star of the production, right after Brenner. I'm sure Sturges kicked himself for that after seeing the final cut, but I'm not sure he could have more successfully balanced all these outstanding actors and their performances in any other way.I could go on and on about what's good in The Magnificent Seven, butc'mon. Brenner. McQueen. Bronson. Coburn. Vaughn. Eli Wallach, for good measure. You could have a chimp write the script and a zebra direct it and it would still kick massive ass with that crew of actors. Which isn't to slight Sturges or credited writer William Roberts. This film looks and feels and sounds remarkably modern for something now over half a century old. Sturges fight scenes still hold up against today's unlimitedly complicated visual effects and Roberts wrote some lines that are still unsurpassed.And in addition to being tremendously entertaining and widely influential, The Magnificent Seven was also prescient about the coming deconstruction of the Western that, along with overexposure on television, would nearly kill the genre. It's not a major theme, but this movie repeatedly pokes holes in some of the standard tropes of the classic Western. Sturges and Roberts, however, made sure that such moments stood on their own as bits of dialog or story and don't rely exclusively on their trangressive nature.The Magnificent Seven is an absolute must-see, no matter how many times you've unknowingly watched it before.",The Magnificent Seven,54047
61,ShootingShark,We Deal In Lead,8/10,27 July 2015,"When bandits threaten to steal the harvest of a poor Mexican village, the farmers resolve to hire gunmen to defend them. But how will they persuade them to help, and can they trust them to honour the agreement ?I reckon this is probably my favourite American western (though Rio Bravo, made at the same time, is almost as good) - it's just solid rip-roaring fun from start to finish, features the greatest cast of cowboys ever assembled, is a brilliant story filled with terrific themes and fascinating archetypes and is beautifully shot, cut and scored throughout. Every boy looking for heroes, role models, men to aspire to be like, should watch it, but at the same time it's sad, thoughtful, tender, even pessimistic. Unlike many westerns it never glorifies violence, celebrates greed, demonises ethnic groups, or deals in clichés. It's as stylish a movie as you could find, yet the drama plays as powerfully as any highbrow play. The gunslingers all have their own reasons for being there, but few are altruistic or noble, and the villagers tolerate their presence purely for services rendered. When Chico (Buchholz) tries to crow, the others don't spare him their bitter wisdom, and when the kids attempt to lionise O'Reilly (Bronson) at the cost of their fathers, he quickly puts them in their place. The main theme of redemption is almost existential; Calvera's dying words expressing his incomprehension as to why they would risk their lives for such scant reward. And yet it's joyous fun throughout, filled with funny dialogue (Bronson's first line is for my money the best opener in cinema), amusing scenes (McQueen's dinner table face pulling), great shootouts and chases, an absolutely barnstorming score by Elmer Bernstein (arguably his best in a career filled with classics) and gorgeous desert locations in Morelos State. But perhaps its greatest asset is its fantastic cast; everybody is great, right down to the lowest part - they look mythic, they deliver fabulous performances, they feel authentic and when they suffer we are truly moved. Very few actors don't look foolish with wide brimmed hats, gun belts and spurs, yet everyone here is iconic. Brynner is perhaps the greatest man-in-black cowboy in all cinema (ironically he was Russian), Wallach is simply terrific as the shrewd calculating bandito, McQueen is the coolest sidekick in any western (""So far so good !""), Bronson and Coburn are the epitome of tough guys and even Buchholz (who was German) is somehow wrong-but-right as the loudmouthed Chico. The film's writing credits are a little controversial - the original script was by Walter Bernstein, then largely rewritten by Walter Newman (neither of whom were credited for different reasons) and adapted by William Roberts. Newman is acknowledged as the main author, although of course the movie is almost a straight remake of Akira Kurosawa's 1954 classic Shichinin No Samurai / Seven Samurai, with only the setting changed. It's a very rare example of a cross-cultural remake which is every bit as good as the original. Beautifully shot from start to finish by the great cinematographer Charles Lang (The Uninvited, How The West Was Won, Wait Until Dark), originally this was neither popular nor acclaimed in the US but has deservedly become recognised as one of the greatest westerns of all time.",The Magnificent Seven,54047
62,Spondonman,That's Entertainment,8/10,7 July 2012,"This still gets frequent showings on regular TV after all these years – could it be because it has lots of decent things thrown in: good story, solid acting, fine production, stirring music, and nice colour. And no sex, little violence, er no subtitles ensures it's usually still shown at prime times.Seven disparate self-styled losers good at killing are enrolled by village of timid farmers to rid them permanently of marauding enormous gang of unofficial taxmen. It's fascinating watching the enrolment process and its results: cool smoker Brynner being offered everything for his help, McQueen looking for crackerjack kicks, Bronson caught swinging his chopper, Coburn calmly murdering a bragging twit, Dexter drooling over imaginary gold, Vaughn trying to run away from his sweaty self, Buchholz as an impetuous immature. As with Seven Samurai it's relentlessly corny, full of stilted dialogue, simply marvellous to watch, but an hour shorter. The members of the 7 who survived the carnage not surprisingly were the most intelligent ones with the least mental problems - however by the end of the '60's even that type got killed in The Wild Bunch.Of course I would have to state Kurosawa's film is a world classic and is much better overall, but watching this is still rather a magnificent - and easier - way to spend 2 hours. What a treat for (most) people coming across it for the first time!",The Magnificent Seven,54047
63,latsblaster,The Magnificent Seven: A good remake,7/10,16 June 2003,"First I watched ""The Magnificent Seven"" with just one eye, I thought it was a boring remake, but when I really watched it seriously I enjoyed almost everything in it. It is not as good as the fantastic Kurosawa-original, but who cares? 'The Magnificent Seven' is good entertainment with several cool actors.Chris Adams is the perfect role for Yul Brunner even if it seems like John Sturges have problems to use his whole potential. Eli Wallach is made for the role as Calvera (he copied that role in Sergio Leone's last dollar-movie), in a sense a smart bandit with some sort of understanding for others. Steve McQueen is bigger than life as Vin! It was the most suitable role he ever played. Horst Buchholz is the biggest disappointment. He is not good as Chico, and Chico is not an interesting character either. Chico has also too much screentime. Charles Bronson is not bad as Bernando O'Reilly, but Sturges hardly uses his full potential as Sergio Leone later would do in 'C'era una volta il West'. Robert Vaughn is simply powerful as Lee, but maybe he should have carried two guns! Brad Dexter is tough enough, even if he isn't the hardest of the seven. My favorite James Coburn is Britt, not the best character-name (Not a male name here in Sweden ...) but he is a solid cowboy. Maybe Sturges should have let him be more like Sean in 'Giù la testa' (Note: Fact is that Yul Brunner would have matched in the role as Britt).'The Magnificent Seven' should be seen in it's original format: panavision. I have a copy in TV-format (Terrible).Elmer Bernsteins score is a piece of music that makes you smile and feel good!'The Magnificent Seven' is the Western that inspired Sergio Leone's dollar-movies the most. He got the idea to base a Western on a Kurosawa-film, and he saw that he had the possibility to make a Western in similar environments as ""The Magnificent Seven"". He also used several actors from 'The Magnificent Seven' (He wanted Bronson for 'Per un pugno di dollari' when he didn't get Henry Fonda, later he worked with booth Bronson, Eli Wallach and James Coburn).'The Magnificent Seven' is an American Western, nothing else. Therefore it shouldn't be called a 'spaghetti-western' even if it is similar to Leone's dollar-movies.Rating: 7+ of 10.",The Magnificent Seven,54047
64,Hitchcoc,"Not Perfect, but Certainly Keeps Us Glued",8/10,9 February 2010,"When I first saw this in a movie theatre when I was in junior high, it was one of my favorite movies. It's a nice formula. Take a group of gunfighter and have them confront the evil forces led by Eli Wallach who have used the Mexican villagers as a cash crop. What really works is that we know each actor. As with ""The Great Escape,"" we have an ensemble of personalities who bounce off each other, portray true manlihood, and who have their own version of morality and integrity. We also have a weak society, who never really buy into what they have wrought. At the first sign of real trouble, half the town wants to go back to the way things were, holding on to their present safety, never realizing how horrible it will eventually get. The gunfighters get a little fed up. Of course, just like ""The Seven Samurai,"" we know the showdown is coming and that there will be great bloodshed. I agree with one reviewer that the setup is better than the resolution and the film begins to drag in the last third. It's still one of the better Westerns of all time and a joy to watch all these excellent actors and movie icons.
                
                    2 out of 5 found this helpful.
                        
                            Was this review helpful?  Sign in to vote.
                        
                        
                    Permalink",The Magnificent Seven,54047
65,Chase_Witherspoon,The best of the rest in the west,10/10,13 December 2012,"It would be easy to dismiss this remake of ""The Seven Samurai"" as Hollywood's dumbed-down version for the masses, taking a noble picture and turning it into a shoot 'em up affair, and there is evidence of that intent, but it must be said, this is one of the best remakes you could imagine concerning a rampaging bandit (Wallach) and his posse, ransacking peasant farmers until they hire seven ""magnificent"" gunslingers to defend their property and re-empower them to recover their dignity.Brynner and McQueen are superb (it's Brynner by a length in my opinion), while the supporting galaxy of stars (and I include forgotten man Brad Dexter in that catalogue) are well assisted by the familiar faces of Vladimir Sokoloff as the wise owl who challenges the pastoralists to defend themselves or perish, future Oscar nominated cinematographer John A. Alonzo, Enrique Lucero, Whit Bissell, Bob Wilke and Val Avery among other notables.There's a line in the movie where Brynner and McQueen are pondering walking out on the deal, and Brynner says words to the effect ""we had an agreement"" to which McQueen replies philosophically ""not any agreement a court would enforce"" and Brynner's response ""that's just the kind of promise you've got to keep"". I first heard that line when I was young seeing this film for the first time, and it's virtue has resonated with me ever since. Words on paper delivered with Brynner's trademark, authoritative timbre of the voice make it, for me, unforgettable and just what this narrative is all about.While it occasionally labours the point (take Bronson admonishing the children for bad-mouthing their parents), it's moments like the aforementioned where director Sturges manages to elevate above mere Hollywood fodder, and successfully convey the essence of ""The Seven Samurai"" into the living rooms of Western audiences who won't venture into foreign language films. Spurs, holsters and six-shooters translate a very rewarding tale into something we can all appreciate and so I think this remake, more than most of its ilk, is very worthwhile.",The Magnificent Seven,54047
66,basrutten,Not Impressed,6/10,23 December 2008,"While this is far from a terrible movie, I can't say that it's all that magnificent either. I watched this mainly to see how an American remake of The Seven Samurai would turn out. I have to say that Seven Samurai was a lot better. Normally, I'd say ripping off stuff is bad, but the Magnificent Seven would have been a whole lot better if it had stuck more closely to the original.As long as the movie is faithful to the original, all is (mostly) well. But when it starts to deviate, things go horrible wrong. Logic is thrown out of the window and the second half of the movie is very unbelievable to a fault. First of all, both the Seven and the bandits allow themselves to constantly surprised by the other. Next, the super-evil bandit leader catches the Seven off-guard, but instead of simply killing them he lets them go and even gives them their guns back? Yeah right. The story sacrifices all plausibility just to get a rather clichéd and moralistic message across, and it hurts.Apart from the weak plot, the rest of the movie feels rushed too. The cast is all-star, but several members seem to be phoning in their performances, and several others give simply horrible performances. Which is a shame, because most of the characters are really interesting and should have really been fleshed out a bit better.Still, ""The magnificent seven"" is far from a horrible movie. The action sequences are fairly good, the score is great, and Eli Wallach is simply brilliant. But is not enough to really leverage this movie above anything more than ""average"". The weak plot in the second half really hurts it, as do the less-than-convincing performances. It's not nearly as good as the original, and a mere shadow of the truly great Sergi Leone westerns that would be made a little later.",The Magnificent Seven,54047
67,darthrajab,Classic Western,9/10,7 September 2005,"I am surprised why this movie does not have a rating of at least 8. I am also surprised why this movie is not in the top 250. The Magnificent seven is a spectacular remake of The Seven Samurai, and is a classic of American movies. I would have to say that in my opinion it is the greatest western of all time. Not only does this movie have excellent characters it also has great lines and action. Yul Bryner and Steve Mcqueen are superb together, and Charles Bronson and James Coburn play excellent roles. If you are a great movie lover or you just like plain westerns than i urge you to see this movie. I guarantee that you will enjoy it as much as I have.
                
                    6 out of 8 found this helpful.
                        
                            Was this review helpful?  Sign in to vote.
                        
                        
                    Permalink",The Magnificent Seven,54047
68,mikavir,Classic western movie,10/10,22 July 2019,"The Magnificent Seven is one of the best, perhaps the best western movie of all time. It contains so many good features like a script, actors and appropriate landscapes.Particularly memorable performances we see from Yul Brynner as Chris, Charles Bronson as Bernando and Eli Wallach as Calvera. Chris' profession as gunfighter is disappearing with the wild west but he doesn't want to quit yet. Chris decides to go to a Mexican village with six other men hired by peasants. Six other men are Vin (Steve McQueen), Britt (James Coburn), Harry (Brad Dexter), Bernardo (Charles Bronson), Lee (Robert Vaughn) and Chico (Horst Buchholz). They all have their own reasons for taking the job like money, possible treasure finding or eagerness of youth. Their job is revenge on the bandit gang whose leader is Calvera (Eli Wallach). The bandit gang robs in the village food and other things.The Magnificent Seven is very exciting and hold on to the end. Movie contains interesting themes like disappearing wild west, feelings of loneliness in the life of an aging gunfighter and brave men's weaknesses along the heroism.Movie is worth watching to all movie lovers. 10/10",The Magnificent Seven,54047
