,User_name,Review title,Review Rating,Review date,Review_body,Movie_name,movie_id
24,SnoopyStyle,Great actors in memorable roles,8/10,29 January 2014,"A Mexican village is constantly harassed by bandit Calvera (Eli Wallach). The villagers decide to sent 3 men to a border town to buy guns. There they see Chris Larabee Adams (Yul Brynner) and Vin Tanner (Steve McQueen) take a stand against bigots who refuse to allow a red Indian be buried alongside white folks. The villagers ask Chris Adams to help them and he gathers various gunmen. Bernardo O'Reilly (Charles Bronson) is a powerful guy. Lee (Robert Vaughn) is on the run. Harry Luck (Brad Dexter) thinks Adams is hiding a secret reward. Britt (James Coburn) is a quiet master knife thrower. Then there is young and proud Chico (Horst Buchholz) who follows along.It starts with the memorable music. Adapted from 'Seven Samurai', what makes this great are the memorable characters. Eli Wallach is one of the greatest spaghetti western actors of all times, and he makes this villain iconic. And the seven heroes are all individuals. They all fit their roles well. Each are given enough time to develop their roles. There are good action scenes. There are some funny lines. It deserves its iconic status.",The Magnificent Seven,54047
25,ElMaruecan82,The Original is such a Masterpiece that even the Remake is a Classic ...,8/10,30 December 2014,"The startling opening of a triumphing fanfare, thrilling percussions following a mesmerizingly inspirational violins melody, all leading up to one of the most heart-pounding orchestral movement of cinema's history, that only one word can describe besides iconic  Magnificent!As far back as I can remember, this melody was stuck in my mind. It was the music for an ad, that would be unauthorized now, the one with the legendary cowboy riding toward the sunset with Monument Valley as the John Ford-like background. And only later, I knew the theme was of ""The Magnificent Seven""  one of the most emblematic westerns of Hollywood's Silver Age.I know the word ""iconic"" is hackneyed but there's no way it doesn't apply to Elmer Bernstein's score, voted #8 in the American Film Institute Top 25 scores, one that elevated the overall experience a few notches higher. Indeed, the movie is more restrained than what the score suggests, but it's this complementarity in pace and emotion that transcends the conventionality of the film, the last film leaving me with the same impression was ""Love Story"". What the mind doesn't get, the heart does, beating with the same musical rhythm.And this is why ""The Magnificent Seven"", although not the greatest Western ever, nor the most influential, is still a classic. But it takes more than musicality to make you forget the improbabilities of having a German kid playing a Mexican, a Mongol playing a badass gunslinger, a newcomer trying to steal his thunder with the most childish acting moves. It takes two things to be precise: a story -a script- and a casting. Eventually you close your eyes on some aspects when it's Yul Brynner and Steve McQueen leading the show.But let's start with the story and gives the original writer the credit he fully deserves, and it says a lot about Master Kurosawa's ""Seven Samurai"" when its own remake is a classic. The original was first modern movie, a multi-layered story whose epic feel was only the backdrop of a collective characters' study and an insightful commentary on the way classes and backgrounds condition people's behaviors and attitudes. More than that, served by an irresistible casting, with an unforgettable Takashi Shimura and Toshiro Mifune, was the first film to combine the thrills (men hired for a mission) with a humanistic and universal message.""Seven Samurai"" was a story of people working and fighting together, uniting their forces, and teaching that everyone is worthy of respect. And consequently, it was obvious that the film would make a perfect Western, since Kurosaws was influenced by John Ford's style, the loop was looped and explains why the film could be judged more positively than a rip-off of a Japanese movie. Only the location changed, the oppressed people are Mexican peasants and the villain is given a more colorful presence through Eli Wallach who plays Calvera. The remake shows signs of cinematic maturity by keeping attentive not to offend Mexican audience, after the dreadful ""Vera Cruz"". The script was written in order to portray Mexican in a positive light. Samurai belonged to a higher cast and could patronize peasants, but Americans couldn't. The Mexicans' initial intents became buying guns, but they finally hired men because they were cheaper. The men were paid for that, and this is why, less romantic of course, the French title is still explicit: ""The Seven Mercenaries"" And speaking of the mercenaries' casting, the film is a showcase of all the alpha male actors whose careers were about to start with the decade.Brynner, the lead, was the most experienced, while McQueen was the more-or-less sidekick, Bronson was the woodcutter and goodhearted O'Reilly, Vaughn as the man with a past, Coburn as the fast, lean and lanky knife thrower, and Brad Dexter is Curly, who'd believe that there would be more at stakes than protecting a village, and Bucholz as Montgomery Clift lookalike, the rookie. The correspondences with their Japanese alter-egos are uneven, Brynner was perfect, so was Coburn who was glad to play his favorite counterpart, but Mifune was such a larger-than-life character and the young Keiko Tsushima such a crucial one, they didn't deserve to be combined in one character. Still, the testosterone-laden cast is part of Hollywood's legend, as well as what went behind the scenes. The rivalries between Brynner and McQuee, and the other actors, the clanning that went during the shooting, Brynner's marriage, Eli Wallach getting adopted by his gang, everything contributed to cement the film's legend. It was a man's film with men playing cowboys, but the script managed to go beyond its usual material and be more than a classic Western, quite an underrated script, minimalist but with no wasted line, like when Yul Brynner points his finger to the direction he takes, would talking change anything? No, but we wouldn't remember it. Some of the Seven have no more than 20 lines but we never feel one presence surpassing the other.Half the length of its glorious ancestor, the script told the story with a sense of self- awareness, conveying the same noble values and reflecting on the gunslinger's condition. This self-questioning aspect leaves a bitter taste to this victory, and while the film feels like the last hurrah of the classic Western movie, there are some clues of maturity, when the last line is ""we always lose"", it makes you think about the future of these men: no land, no wives, no families, and maybe these cowardly peasants are not the most to pity, as Bronson would say.To a certain extent, the film is, after ""Rio Bravo"", one of the last classic Western and one that would pave the way to the new revisionist Westerns, but while I used to think it was Leone who started it, there is some credit to address to Sturges, after all, his film was also adapted from a Kurosawa movie, a magnificent one!",The Magnificent Seven,54047
26,Coventry,A Magnificent Classic,8/10,21 November 2010,"This was the first western I ever saw, along with my dad who was a big fan of the genre. Come to think of it, this might even be the very first movie with a body count that I ever watched! I have re-watched ""The Magnificent Seven"" numerous times ever since and it always remains an all-time favorite. The story owes all of its success to the Japanese classic ""Seven Samurai"" (which I scandalously haven't seen yet) but the primary reason why this western version is such an immortal classic is the ensemble cast and their unforgettable performances. This was the movie that introduced me, and I assume many others as well, to names like Yul Brunner, Steve McQueen, Charles Bronson and James Coburn. Each and every single one of them is a monument of action/western cinema and even now I still attempt to track down all of their films as much as possible. ""The Magnificent Seven"" revolves on a remote community of hard-working but petrified Mexican farmers that regularly receives the unwelcome visit from super-bandit Calvera and his forty minions. Calvera steals their crops, but their too afraid to fight back. They decide to hire gunmen to protect their village and approach the noble lone rider Chris Adams. He manages to hire six other multi-talented fighters who are prepared to risk their lives and protect a handful of cowardly villagers for a lousy $20 paycheck. Numerous sequences in ""The Magnificent Seven"" are legendary – or at least they are to me – like Brunner and McQueen driving the hearse up cemetery hill, Robert Vaughn catching flies, Coburn's duel, McQueen's witty jokes and Charles Bronson educating young and over-enthusiast kids a thing or two about responsibility. The climax is still very exciting to behold, with an enormous body count among the bad guys and a couple of painful and emotional deaths amongst the beloved heroes as well. John Sturges' direction is impeccable and the Oscar nominated music from Elmer Bernstein still remains phenomenal even fifty years later. A bona fide classic.",The Magnificent Seven,54047
27,kwhite-53010,The Best Western Ever!,10/10,18 December 2017,"Some may disagree with me but for my money this is the best western ever made. The dialogue, the music, the scenery and the outstanding cast and direction all come together in perfect alignment.
It is a movie I have watched many many times since first seeing it at a very early age. Needless to say, I am a huge, huge Yul Brynner fan.
                
                    16 out of 21 found this helpful.
                        
                            Was this review helpful?  Sign in to vote.
                        
                        
                    Permalink",The Magnificent Seven,54047
28,film-critic,"Seven Samurai, this film is not...",2/10,18 August 2009,"It is a hard order to fill if you want to revision Akira Kurosawa set within an American western using a hodgepodge of ethnic actors. Not only are you attempting to recreate the same symbolic references and deep moral elements of an already established cult classic, but there are so many other outside elements that may be harder to control than simply samurai's saving a small village. None the less, director John Sturges tried, and the final result was the abysmal ""The Magnificent Seven"". Not to plot my course to early, but being a large fan of Kurosawa's masterpiece, I had to put that aside and see this film for what it was – what Sturges envisioned – instead of just making comparison after comparison. With sloppy characters, lacking detail, American-ized natives, and a grossly unoriginal villain – this 1960 classic is only memorable for a couple of key performances and an energetic score. Outside of that, Sturges uttered blasphemy on Kurosawa's work.Again, I said I wouldn't compare the two works – so every attempt will be made not to. There were high hopes for ""The Magnificent Seven"", a family favorite film that has somehow slipped through my viewing time, but the moment this film began my attention began to fade. With a weak opening, and a lackluster retrieval of heroes to protect the village, ""The Magnificent Seven"" came out of the gates with a mere gallop, and eventually didn't even finish the race. As mentioned, our villain has these long monologues of corruption and greed, but when it comes down to it, Calvera didn't have the true evil gene. He was corrupt, but it was only skin deep. Outside of the typical ransacking of small villages, his character demonstrated no true evil – albeit with a PG rating, what could he do – but I don't believe Calvera could strike fear in any child today. Eli Wallach is to blame for this. Yet, he wasn't the only one dragging his feet. This film was bombarded by lackluster acting. Yul Brynner, the obvious lead, seemed to sputter his lines without a moment of emotion or spirit. His pathetic portrayal of Chris Adams, the main cowboy hired to protect, fell flat and was boring to the average viewer. That same description could also be used for most of those that he recruited (what is the saying, flies attract flies?), sans Steve McQueen. As a fan of McQueen's work, I was impressed by the way he picked up the lacking flag of the others. While he didn't provide much to each scene, he was interesting to watch, obviously caring more about the overall performance than Brynner did. Unlike Kurosawa's epic, this didn't focus as much on the men of the mission, just that they could be there to attack whoever descended onto the village. There was no individual character development, and when there was (see: Robert Vaughn's nightmare) it was rushed and ill-focused. Whereas in ""Samurai"" we felt something for each of the heroes, in this – nobody seemed to have the courage to stand forward and introduce themselves to us.I must admit – this film was boring. From the introduction, to the recruiting, all the way to the repeat battle – ""The Magnificent Seven"" provided little-to-no entertainment. With no character to stand behind, it was left up to the action to drive the focus, but alas, this seemed to fall short as well. I can agree that there were some decent moments that spoke for the western genre, but nothing challenging. Evil riders would ride in, gunshots would smoke, people would fall, and finally there would be celebration. Thinking about it now, it felt as if Sturges was providing us a cheapened Cliff-Notes version of the original tale. With a running time of a mere 128 minutes, there is no way you could capture the intensity and drama behind Kurosawa's original 203 minute epic. Again, not to compare side by side – but what made the original work was the characters, the story, the intensity that Kurosawa was able to push through your television set. ""The Magnificent Seven"" felt like a rushed Hollywood project that had big stars, but no heart.Overall, I really wanted to like this film. The cast itself sells this movie, but as a viewer of cinema, it just seemed like a poorly constructed feature. Hollywood was attempting to make a dime on Kurosawa's original idea, and it failed. I cannot watch this movie again, nor would I. The acting is atrocious, the story is choppy, and there was no real threat. The idea that these villagers could survive year after year of this attack forced me to believe that perhaps Calvera wasn't robbing them blind. We weren't given enough history of the violence prior to the introduction of our heroes. This just felt rushed from the beginning, but remained dull after seeing the sheer brilliance of ""Seven Samurai"". Watch this, if you must, for the music and McQueen, everything else is pure rubbish.Grade: * ½ out of *****",The Magnificent Seven,54047
29,meritcoba,A sad swan song for the classic western,5/10,12 May 2016,"Maybe the Magnificent Seven is the swan song of the classic western, you know the ones in which men are meticulously shaved all the time, dress in spotless clothes and the weather only turns sour when it was needed. But most of all, they did what they did because of some noble principle(unless they were bad).It is established early into the movie. Adams and Tanner step in when nobody wants to bury a dead Indian. They transport his corpse to the cemetery while opposed by nameless bigots who do not want an Indian in their graveyard. Even after death there is racism.Adams seems to be one of those decent selfless gun for hire types(think lone ranger) and thus, when asked by a group of Mexicans to have him protect their village from a band of marauders, he accepts the dangerous job for a pittance. This raises the one importance question that will plague the movie, echoed by Eli Wallach: why? What makes a gunslinger like Adams decide to put his life on the line to do this thing for no good money at all? I loathe to compare movies nowadays, but in the seven samurai there was a very good reason: they were lordless fighters who were trapped in a rigid social structure that allowed for no social mobility in desperate times. In other words: they were doomed to it. Fight or starve. But in the late 19th century US men were far doomed in that manner in a land of opportunity that experienced an economic boom. Sturges thus needs to establish another motive, so he has Tanner supply an answer of a kind: it seemed to be a good idea at the time. This might have been a sarcastic Bruce Willis line from say Die Hard, but this isn't a tongue in cheek movie because it takes itself pretty serious indeed. Wrong answer therefore. Seven against forty(six actually)is no good idea at any time. It almost feels as if Sturges is caught in between the mood of times: the spaghetti westerns will supply other reasons: greed, revenge, and other less noble principles. The classic westerns had their own noble reasons, but they are never supplied. In fact, when the villagers betray the seven, the latter even come back to save them again. The movie never explains why the men do what they do, even if their behavior is at odds with their characters. Take Harry Luck, a fortune seeker, who tags along because he believes there is more to the job than the twenty dollars pay for 6 weeks being shot at. Why would he think that Adams is hiding something? Does it follow from what went before? Is it made believable in the movie? But most of all, why does Adams take him along, knowing that Luck might bail the moment he finds out there is nothing else but the twenty dollars and the likely possibility of death?Sturges cannot shake loose from the confines of the earlier movie and the prescriptions of the classic western. He could have the villagers or Adams dupe the others. Suggesting more wealth that there was, but that would made them look bad and that cannot be. He could have spend more time on character building, thus giving personal reasons.. which actually seems the way he is heading, but alas there is not enough movie to do that for seven characters. Not even the character of Adams is well developed in the movie. The central weakness of this movie is this lack of proper motivation for the characters involved and the failure to establish their personalities. This would not have such a great weakness if the rest made up for it with, say, good gunfights. But they are weak and awkward at times. This leaves us actually with a weak movie that cannot deal with the cultural transition from 15th Century Japan to 19h Century us in an acceptable way. Sturges is just not up to the challenge. The movie therefore simply pales in comparison to The Big Country(2 years older) that sees a man resisting violence out of principle and A fistful of Dollars that followed four years later in which the main characters are no longer driven by noble goals. As such the movie is not so much interesting by itself, but rather as an in between piece of work. The last of the classic western and, perhaps, showing an embryonic development of what was to come.",The Magnificent Seven,54047
30,marmar-69780,the magnificent seven,9/10,24 April 2020,"The magnificent seven is for me one of best westerns ever made,this film has everything ,great group of big actors that worked brilliantly together and everyone of them give a film a dose of uniquenes and their characters were rich in personality and likeable and badass in same time,brynner and mcqueen give two best performances of a group but bronson and vaughn very also great in it,wallach as villain was also very useful and intimidating,gun fights are for that time very good made and they still hold up today,score is also one of most regonisable ever and it fitted in a story in a awesome way,magnificent seven is simply said one of my favourite westerns of all time
                
                    3 out of 4 found this helpful.
                        
                            Was this review helpful?  Sign in to vote.
                        
                        
                    Permalink",The Magnificent Seven,54047
31,jimbo-53-186511,Every bit as enjoyable as the 1954 Japanese original,7/10,9 March 2014,"I watched the Seven Samurai a few years ago which is the 1954 original classic film which this remake is based on. I'll admit to enjoying the original film, but if I'm being honest I did feel that at nearly 3 and a half hours it ran on for much longer than necessary. I decided to give this film a try as it does have a reasonably good IMDb rating and I also wanted to see how it stacked up against the much loved original film.The good news is that this film is very good and it's certainly one of the better remakes that I've come across in my time. I think one major thing that runs in the Magnificent Seven's favour is that it is much better paced than the original - we get to the action and 'meat of the plot' fairly quickly and there was never a dull moment in this remake. I did feel that in the original film there was far too much time spent on finding the Samurai to defend against the village and there were moments where it did get a bit boring, but the faster pacing of the remake does make it a slightly more enjoyable experience on the whole.Next we come to the cast and I must say that Yul Brynner was exceptional as the leader of the Magnificent Seven. His deep voice and cool and calm demeanour made him an ideal choice for this role and he doesn't disappoint. Of course, one good actor can't make a film great on their own and Brynner gets lots of support from the likes of Steve McQueen, Charles Bronson and Robert Vaughan to name a few. Eli Wallach was also excellent in the role of Calvera who is the leader of the bandits. Whilst he is portrayed as a 'bad guy' in some ways I found him more to be a 'likeable rogue'. Wallach is a fantastic actor and for me he was probably the strongest actor in this film (although I'll admit that Brynner comes in a close second). The Oscar nominated score by Elmer Bernstein was also great and fitted well with the tone of the film. The Magnificent Seven also has a humorous tone running through it and this made it all the more enjoyable. There are a couple of scenes where some kids are following Charles Bronson's character around (much to his annoyance) which did make me laugh.The only minor negatives I can thing of with this film is that I didn't think the finale of the Magnificent Seven was anywhere near as exciting as the finale of the Seven Samurai. In some ways the Seven Samurai was like a Firework with a very long fuse - you'll wait ages and ages and then BANG. The finale of the Seven Samurai is one of the most exciting finales that I've ever seen. Magnificent Seven differed in that there were lots of fireworks going BANG, BANG, BANG, but then when they came to the last firework there was just a slight puff of smoke, but no BANG. The ending of the Magnificent was by no means bad, but it was disappointing in comparison to the original.One thing I will say is that if you watched the Magnificent Seven and enjoyed it then I would definitely recommend watching the original film Seven Samurai. It is quite a lot longer than the Magnificent Seven, but if you're patient then you'll find that film just as rewarding as this film.",The Magnificent Seven,54047
